Question,Real Answer,Pred Answer
Where was the president born on the fourth of July born?,Plymouth Notch,"Answer: East Hampton, New York"
Who play's Marty's girlfriend in back to the future?,Claudia Wells,Claudia Wells
What is the record label for the band which performed Pythons?,Kanine Records,Sire Records
Who is the employer of the person Mach's principle was named after?,Charles University,The employer of the person Mach's principle was named after is the University of Vienna.
What is the life expectancy of the type of retriever named after the body of water the Patuxent River turns into?,average lifespan at 9.4 years,12 to 13 years
Who is the president of the newly declared independent country that is part of the Commission of Truth and Friendship with the country where Sambas is located?,Francisco Guterres,Xanana Gusmão
What is the capital of the country it is about?,Aden,Georgetown
The league playing in the Thursday night football game is a type of what?,sports league,American football
A participant of the Battle of Brechin is an instance of?,Scottish clan,Clan Gordon
