Question,Real Answer,Pred Answer
In what year was Twilight Princess from the game series on which The Legend of Neil was based originally planned for release?,2005,2005
What is the mascot of the school that owns Goss Stadium at Coleman Field?,Benny Beaver,The Ramblin' Wreck
Who is the spouse of the actor that plays vision in avengers age of ultron?,Jennifer Connelly,Jennifer Connelly
Who was the spouse of the leading lady in Gone With the wind?,Laurence Olivier,Rhett Butler
Who was the mother of the person who found the sacred writings that became the Book of Mormon?,Lucy Mack Smith,Lucy Mack Smith
Who is the mayor presiding now where Merrill Elam was born?,Lance Bottoms,Jacek Majchrowski
What county shares a border with the county where She Did It's performer was born?,Cabarrus County,Rowan County
What is the experimental satellite which was the forerunner to the communication satellite of the operator of GSAT-7 called?,ATS - 6 (Applications Technology Satellite - 6),Telstar
What watercourse is the river on which the Lostock Dam is located the mouth of?,Hunter River,Parramatta River
There is a state A where Storm of the Century was filmed based on the book by the author who wrote a short story featuring the author of This Is My God. What is the population of state A?,"1,335,907","1,362,359"
What is the capital of the county that shares a border with the county where KRSU is licensed to broadcast?,Green Bay,Kampong Cham
Kiwil's birth country participated in a Commission of Truth and Friendship. Who is the president of the other country that participated?,Francisco Guterres,Xanana Gusmão
Who is the child of the male star of the 1921 film Money?,Anthony Ainley,Aiden Lucas
What is the symbol of the Saints from the headquarters location of Ten High's manufacturer called?,fleur - de-lis,fleur-de-lis
Which country has a body of water that was inspiration for the name of the Mara Region?,Tanzania,Tanzania
"Along with the subject of The One That Got Away, what notable pop artist started out his career on adult contemporary radio?",Michael Bublé,Johnny Cash
Who is the federal leader of the political party Ken Epp belongs to?,Andrew Scheer,"Answer: The federal leader of the political party Ken Epp belongs to is not explicitly mentioned in the provided text. However, Ken Epp is associated with the Reform Party, the Canadian Alliance, and later the Conservative Party of"
Where is the country with ISO code ISO 3166-2:CV located?,central Atlantic Ocean,"Cape Verde is located in the Atlantic Ocean, approximately 570 kilometres (350 miles) off the western coast of the African continent, near Senegal, The Gambia, and Mauritania."
Who did the person portraying Batman in the Justice League movie play in Dazed and Confused?,Fred O'Bannion,Ben Affleck did not play a role in *Dazed and Confused*.
"In Batman Under the Red Hood, who does the actor of Barney Stinson from How I Met Your Mother play?",Nightwing / Dick Grayson,"Answer: In Batman: Under the Red Hood, the actor of Barney Stinson from How I Met Your Mother, Neil Patrick Harris, plays the role of the villain Mr. Freeze."
"What did the singer of ""Moon River"" in the movie Breakfast at Tiffany win a Tony for?",for Best Performance by a Leading Actress in a Play in Ondine,Best Choreography
Where is the headquarter of the Radio Television of the country whose co-official language is the same as the one Politika is written in?,Pristina,Pristina
What is the source of the river of which Kraai River is a tributary?,Thaba Putsoa,The source of the river of which the Kraai River is a tributary (the Orange River) is the Khatling Glacier in the Drakensberg mountains in Lesotho.
Who played the girlfriend of Chance's voice actor in Homeward Bound in Back to the Future?,Claudia Wells,Lea Thompson
Who is the voice of the character in Spongebob Squarepants with the same name as the creature that annelid larvae live like?,Mr. Lawrence,Carolyn Lawrence
Between which years did war with the person for whom Pyrrhic victory is named occur?,323–272 BC,280 BC and 279 BC
MV Miralda's owner announced it was in the process of doing what in April 2010?,trying to find a potential buyer for all of its operations in Finland,selling its interests in four Nigerian oil fields
When did the Battle at Choo Hoey's birthplace end?,15 February 1942,Answer: The Battle of Puebla ended on 15 February 1862.
Who is the president of the newly declared independent country that is part of the Commission of Truth and Friendship with the country where Sumardi was born?,Francisco Guterres,Xanana Gusmão
Who wrote the song The Story sung by the performer of Give Up the Ghost?,Phil Hanseroth,Brandi Carlile
Where did they film The Beach in the country where Siddhi Savetsila was born?,Ko Phi Phi Leh,Thailand
Who is the author of Growing Up this nationality of the creator MacGruder and Loud?,Min Zhou,American
In which county did Snappy Tomato Pizza form?,Kenton County,Kentucky
What other recognition did the Oscar winner for Best Actor in 2006 receive?,nominated for an Academy Award for Best Supporting Actor,Best Director
What is the Smile performer's birthday?,1 January 1986,1 January 1986
What record label does the performer of Emotional Rain belong to?,Attic Records,Warner Bros. Records
When did the majority party in the House of Representatives gain control of the body which approves members of the Cabinet?,January 2015,2015
What is the manufacturer of the Kentucky Tavern headquarters location saints symbol called?,fleur - de-lis,Sazerac Company
In which county was Zhu Qinan born?,Yongjia County,Zhejiang
Who sings Home Alone Tonight with the Rain is a Good Thing singer?,Karen Fairchild,Karen Fairchild
What is the name of the castle in the city where the performer of Never Too Loud was formed?,Casa Loma,Casa Loma
Who is the sibling of the actress that played the little girl in Miracle on 34th street 1947?,Lana Wood,Natalie Wood
What city is the star of 'Three Strangers in Rome' from?,La Goulette,Milan
What else happened in the northern part of Erich Zakowski's birthplace in the now Russian area?,names were replaced by new Russian names,"The northern part of Erich Zakowski's birthplace, which is in the now Russian area, became part of the Soviet Union after World War II. Specifically, it was annexed by the Soviet Union and became part of"
In which county is Southern Maryland Electric Cooperative headquartered?,Charles County,Charles County
When did the party that controls the House of Representatives take control of the branch who determines the rules of the US house and Senate?,January 2015,"The party that controls the House of Representatives takes control of the branch that determines the rules of the U.S. House and Senate at the beginning of a new Congress, which occurs every two years following a general election. The specific"
What series of wins did the sports team that the all time highest goal scorer in spain national team was a member or achieve in 2009?,continental treble,15 consecutive wins
"In Grown Ups, who plays the wife of the actor who produced The Chosen One?",Joyce Van Patten,Maria Bello
Who does the performer of Don't Be Cruel play in the wire?,a Western District uniformed officer,"The performer of ""Don't Be Cruel"" is not mentioned in the provided passages about *The Wire*. Therefore, the question cannot be answered based on the given information."
When did Burroughs Corporation merge to form a new corporation?,1986,1986
"When did the country, whose co-official language was used by the director of Group Portrait with a Lady, first attend the Olympics as an independent team?",2016,1992
Who followed Menucha Rochel Slonim's father?,Menachem Mendel Schneersohn,Rabbi Menachem Mendel Schneersohn
Who started out his career on adult contemporary radio along with the performer of All That Echoes?,Michael Bublé,Bart Millard
Who is the head of the developer of Simon?,ADM Michael S. Rogers,Answer: Tony Randall
When was the last time the team that Terry Twell was a member of beat the 194-95 winner of the FA Cup?,1 December 2010,2010
Who is the father of the artist who painted Head I?,Nicholas Bacon,Francis Bacon
Where is the origin of the river Augrabies Falls is part of?,Thaba Putsoa,Orange River
The BBC Footballer of the Year is a member of which team?,Egypt national football team,The question is not answerable based on the provided information.
Where was the person who acted in the film Sous les pieds des femmes born?,La Goulette,"Angers, France"
How many people were in British Colonies where does the london broil cut come from ?,2 million,2 million
Who is the spouse of the person who voices Jarvis in the Avengers Age of Ultron?,Jennifer Connelly,Jennifer Connelly
Which county shares a border with the county where the most populous city in the state where Redan High School is located?,Presque Isle County,Clarke County
The rapper who owns Aspiro was inspired by what when writing Song Cry?,three different relationships he had in the past,his past relationships
What administrative territorial entity includes the place that KTRP is licensed to broadcast to?,Canyon County,Answer: Minsk Region
"In A League of Their Own, who played the husband of the actress who played Thelma in Thelma and Louise?",Bill Pullman,Christopher McDonald
What is the former name of the country where Atika Suri studied?,Dutch East Indies,Indonesia
What province shares a border with the province where Lago District is located?,Cabo Delgado Province,Arkhangelsk Oblast
Who published Communications of the organization that Andries van Dam is a member of?,Association for Computing Machinery,The Association for Computing Machinery (ACM) published Communications of the organization that Andries van Dam is a member of.
What county shares a border with Cedar Springs?,Bell County,"Cedar Springs is located in Guadalupe County, Texas, and shares a border with the Komi Republic to the north, Sverdlovsk Oblast to the east, Cherdynsky District to the"
What administrative territorial entity is the owner of Ciudad Deportiva located?,Tamaulipas,Australia
Who is the son of the Italian navigator who explored the eastern coast of the continent Ulises Solís' birthplace is located in for England?,Sebastian Cabot,Sebastian Cabot
Who played the monarch at the end of WW2 in The King's Speech?,Colin Firth,Colin Firth
What is the place of birth of who does the voice of stan on the series that Insecurity is part of?,Denver,Trey Parker
Where did they film The Beach in the country where Pao Sarasin was born?,Ko Phi Phi Leh,Thailand
What is the competition that the 1965 Federation Cup is part of named after?,International Tennis Federation,The competition that the 1965 Federation Cup is part of is named after the International Tennis Federation (ITF).
Who is the president of the newly declared independent country that is part of the Commission of Truth and Friendship with the country where Kotamadya is located?,Francisco Guterres,Xanana Gusmão
"In the King's Speech, who played the person who was the King of England in 1950?",Colin Firth,Colin Firth
What is the body of water by the area where Athlete was formed?,River Thames,Deptford Creek
What award did the author of The Happy Journey to Trenton and Camden receive?,Pulitzer Prize for Drama,"The author of The Happy Journey to Trenton and Camden, Thornton Wilder, received the Pulitzer Prize for Drama."
Where was the designer of the Lap Engine educated?,University of Glasgow,Massachusetts Institute of Technology
Who is the father of the Labo M performer?,Louis Chedid,Louis Chedid
Why did Roncalli leave the place of death of the maker of The Gozzi Altarpiece?,for the conclave in Rome,Roncalli left the place of death of the maker of The Gozzi Altarpiece (Pope Pius XII) because he had to return to his post as Apostolic Nuncio to France. At the time
Who gives out the award named after the person who argued that colonies were redundant?,University of Cambridge,Foreign and Commonwealth Office
"In 1990, who became the president of the country that Germany invaded?",Lech Wałęsa,Hans Modrow
What is the name for the mouth of the watercourse of the body of water by Rotterdam Centrum?,Het Scheur,The mouth of the watercourse of the body of water by Rotterdam Centrum is the Saint-Maurice River.
"Who sings Home Alone Tonight with the singer of ""I Don't Want This Night to End""?",Karen Fairchild,"The question seems to be based on a misunderstanding or a mix-up of song titles and artists. There is no known song titled ""Home Alone Tonight"" performed by the singer of ""I Don't Want This Night to End"""
What company is the school where Lawrence Landweber was educated a part of?,City University of New York,Purdue University is part of the University of Purdue system.
What is the capital of the county that shares a border with the county where WAPL is licensed to broadcast?,Green Bay,Appleton
Who was the first black student admitted to where Robert Khayat was educated?,James Howard Meredith,James Howard Meredith
Who did the original voice of the character played by mila kunis in the cleveland show?,Lacey Chabert,Nia Long
What is the record label of the co-writer and recording artist of Permission to Fly?,Hollywood Records,Jive Records
What record label is the performer who released All Your Faded Things on?,Kill Rock Stars,Blue Note
What is another notable work made by the author of Miss Sara Sampson?,Emilia Galotti,Vanity Fair
When did the majority party in the body which determines rules of the US House and US Senate gain control of the House?,the 2010 election,2010
In what year did Margaret Knox's spouse pass away?,1572,1999
The city where Dmitry Borisovich was born is located where in Russia?,Yaroslavl Oblast,Moscow
What league includes the operating group of Al Janoub Stadium?,Qatar Stars League,The league that includes the operating group of Al Janoub Stadium is the Qatar Stars League.
When was the kingdom that Heptarchy was part of abolished?,918,"Answer: The kingdom of Mercia, which was part of the Heptarchy, effectively lost its political independence and was abolished in the late 9th century, with its final dissolution occurring in 1066 with"
What is the average salary of a working person with the same nationality as the producer of The Wild Women of Chastity Gulch?,"$59,039","$47,807"
The city that Psycho Donuts is located in is in which county?,Santa Clara County,Santa Clara County
