Question,Real Answer,Pred Answer
"When did the country, whose co-official language was used by the director of Group Portrait with a Lady, first attend the Olympics as an independent team?",2016,1992
Who followed Menucha Rochel Slonim's father?,Menachem Mendel Schneersohn,Rabbi Menachem Mendel Schneersohn
Who started out his career on adult contemporary radio along with the performer of All That Echoes?,Michael Bublé,Josh Groban
Who is the head of the developer of Simon?,ADM Michael S. Rogers,National Security Agency
When was the last time the team that Terry Twell was a member of beat the 194-95 winner of the FA Cup?,1 December 2010,1985
Who is the father of the artist who painted Head I?,Nicholas Bacon,Francis Bacon
Where is the origin of the river Augrabies Falls is part of?,Thaba Putsoa,Orange River
The BBC Footballer of the Year is a member of which team?,Egypt national football team,The BBC Footballer of the Year is a member of the Zambia national football team.
