row_id,is_warmup,example_id,sub_q_idx,main_question,sub_question,doc_tokens,query_tokens,full_tokens,fusion_selected_doc_tokens,fusion_reprocess_prefill_tokens,full_reuse_cache_ttft_s,full_ttft_compute_s,full_ttft_wall_s,fusion_ttft_compute_s,fusion_ttft_wall_s,fusion_storage_time_s,fusion_selection_time_s,fusion_selection_score_forward_time_s,fusion_reprocess_prefill_time_s,speedup_full_over_fusion_compute,ttft_reduction_pct_compute,speedup_full_reuse_over_fusion_compute,ttft_reduction_pct_full_reuse_vs_fusion_compute,speedup_full_over_fusion_wall,ttft_reduction_pct_wall
0,True,0,0,What is the network which National Cycle Route 57 is part of an example of?,What network is National Cycle Route 57 part of?,1313,27,2132,196,223,0.9915192341431975,0.28722310066223145,0.289772919844836,0.6738956859335303,0.743433004245162,0.027016626205295324,0.14005406573414803,0.12327637476846576,0.506824993994087,0.4262129980315109,-134.62447288528438,1.4713245014614857,32.034027911131304,0.38977677637415936,-156.55710155498528
1,True,1,0,What district is the headquarter of Julia's House located?,Where is the headquarters of Julia's House located?,1295,25,2112,194,219,0.8024193411692977,0.10836911201477051,0.2779058017767966,0.22288606548681855,0.285950839985162,0.024503760039806366,0.10294802021235228,0.10222316021099687,0.09543428523465991,0.4862085558290742,-105.67305696519833,3.6001323789205326,72.22324362695127,0.9718656598148727,-2.8948795444101227
2,False,2,0,What body of water includes the terrain feature where Coffee Swamp is located?,Where is Coffee Swamp located?,1441,21,2254,216,237,0.8651612140238285,0.11573100090026855,0.29647463001310825,0.2296637026593089,0.2907047988846898,0.02566251903772354,0.10836605494841933,0.10760115785524249,0.09563512867316604,0.5039150704277721,-98.44613878110509,3.7670785762225503,73.45423038659436,1.019847732650286,1.9461466662976656
3,False,3,0,Who is the spouse of the child of Peter Andreas Heiberg?,Who is the child of Peter Andreas Heiberg?,1154,26,1972,173,199,0.788204506970942,0.09566307067871094,0.2614664640277624,0.22024367935955524,0.2686298228800297,0.02222280018031597,0.10282162297517061,0.10210828483104706,0.09519925620406866,0.43435103770918093,-130.22852789166083,3.578783778326603,72.05754630788037,0.9733337171001061,-2.7396855190984226
4,False,3,1,Who is the spouse of the child of Peter Andreas Heiberg?,Who is the spouse of Johan Ludvig Heiberg?,1353,27,2172,202,229,0.854235609062016,0.1101689338684082,0.28222860395908356,0.22343432530760765,0.2801017430610955,0.0249165091663599,0.10317459003999829,0.10241864901036024,0.09534322610124946,0.4930707657238245,-102.81064494505303,3.823206697923286,73.84394622076839,1.0075931726619929,0.7535950885745213
5,False,4,0,"When was the sibling of Alice de Lusignan, Countess of Surrey crowned?","Who were the siblings of Alice de Lusignan, Countess of Surrey?",1178,32,2002,176,208,0.7904520276933908,0.09586882591247559,0.2621740628965199,0.22821679478511214,0.2759134159423411,0.022294765803962946,0.10940385097637773,0.10866335919126868,0.09651817800477147,0.42007787377237166,-138.05110014955747,3.4636014778740396,71.12831812816408,0.9502041138561658,-5.240546259240042
6,False,4,1,"When was the sibling of Alice de Lusignan, Countess of Surrey crowned?",When was King Henry III of England crowned?,2075,24,2891,311,335,1.1097040371969342,0.15319228172302246,0.3922801651060581,0.2526791119016707,0.32806294271722436,0.03075074078515172,0.10377547005191445,0.10295828897505999,0.11815290106460452,0.6062720442940166,-64.94245601650104,4.391752166790788,77.23004481988481,1.1957466511058708,16.370244560153026
7,False,6,0,Which university employed the person that Mach bands are named after?,Which university employed Ernst Mach?,1490,21,2303,223,244,0.8659008210524917,0.10617256164550781,0.29544842010363936,0.2232514638453722,0.27789534581825137,0.02501560002565384,0.10171830886974931,0.10095887305215001,0.09651755494996905,0.47557386552701286,-110.2722778704078,3.8785896680714687,74.21743247985228,1.0631643334425185,5.941163699311913
