row_id,is_warmup,example_id,sub_q_idx,main_question,sub_question,doc_tokens,query_tokens,full_tokens,fusion_selected_doc_tokens,fusion_reprocess_prefill_tokens,full_exact_cache_ttft_s,full_ttft_compute_s,full_ttft_wall_s,fusion_ttft_compute_s,fusion_ttft_wall_s,fusion_storage_time_s,fusion_selection_time_s,fusion_selection_score_forward_time_s,fusion_reprocess_prefill_time_s,speedup_full_over_fusion_compute,ttft_reduction_pct_compute,speedup_full_exact_over_fusion_compute,ttft_reduction_pct_full_exact_vs_fusion_compute,speedup_full_over_fusion_wall,ttft_reduction_pct_wall
0,True,0,0,What is the network which National Cycle Route 57 is part of an example of?,What network is National Cycle Route 57 part of?,1313,27,2132,196,223,0.4115599128417671,0.27966976165771484,0.2813152950257063,0.6836418430320919,0.7541474681347609,0.025753633119165897,0.1507375300861895,0.13241708697751164,0.5071506798267365,0.4090881278087398,-144.44610635768146,0.602011004792238,-66.10992025720748,0.3730242517706593,-168.07908473865513
1,True,1,0,What district is the headquarter of Julia's House located?,Where is the headquarters of Julia's House located?,1295,25,2112,194,219,0.274808791000396,0.10829448699951172,0.27745496109128,0.2230485682375729,0.2864926974289119,0.02388717094436288,0.10372782405465841,0.10297706630080938,0.09543357323855162,0.4855197585674048,-105.96484125602683,1.2320580812143676,18.834995261395594,0.9684538683926682,-3.257370602451992
2,False,2,0,What body of water includes the terrain feature where Coffee Swamp is located?,Where is Coffee Swamp located?,1441,21,2254,216,237,0.2932339422404766,0.11608195304870605,0.29628522600978613,0.23416920704767108,0.3010779828764498,0.027222723234444857,0.11130284098908305,0.11038968386128545,0.09564364282414317,0.49571826506238553,-101.72748726015799,1.2522310082417514,20.14253013874071,0.9840813439067364,-1.6176158802144958
3,False,3,0,Who is the spouse of the child of Peter Andreas Heiberg?,Who is the child of Peter Andreas Heiberg?,1154,26,1972,173,199,0.2585893771611154,0.09664702415466309,0.26107574813067913,0.22073897765949368,0.28236568719148636,0.02245644200593233,0.10308136092498899,0.10232472000643611,0.09520117472857237,0.4378339755824561,-128.39707646481463,1.1714713001888084,14.63726001321347,0.9246015361407229,-8.154698095569856
4,False,3,1,Who is the spouse of the child of Peter Andreas Heiberg?,Who is the spouse of Johan Ludvig Heiberg?,1353,27,2172,202,229,0.2790623912587762,0.10985898971557617,0.2807576796039939,0.22377969603985548,0.2901792568154633,0.02519299602136016,0.10319720581173897,0.10244551487267017,0.09538949420675635,0.4909247427702741,-103.6972091398427,1.2470407110083606,19.81015606207457,0.9675318721439108,-3.355768299822981
5,False,4,0,"When was the sibling of Alice de Lusignan, Countess of Surrey crowned?","Who were the siblings of Alice de Lusignan, Countess of Surrey?",1178,32,2002,176,208,0.25900412211194634,0.09911346435546875,0.2653630222193897,0.2220200370065868,0.28334051417186856,0.02201455319300294,0.10322221089154482,0.10252108192071319,0.09678327292203903,0.4464167545045869,-124.00592941672963,1.1665799429817334,14.279342276017658,0.936551636446971,-6.774678627836828
6,False,4,1,"When was the sibling of Alice de Lusignan, Countess of Surrey crowned?",When was King Henry III of England crowned?,2075,24,2891,311,335,0.38937005400657654,0.15299057960510254,0.39210261683911085,0.25340616842731833,0.3431370467878878,0.03157180501148105,0.10351456515491009,0.10250312695279717,0.1183197982609272,0.6037366041820845,-65.63514504056872,1.5365452878399652,34.918937442724285,1.142699747840085,12.48794778416763
7,False,6,0,Which university employed the person that Mach bands are named after?,Which university employed Ernst Mach?,1490,21,2303,223,244,0.2931011952459812,0.10654783248901367,0.295973117928952,0.22432090668007731,0.2876972043886781,0.025502215139567852,0.10205042082816362,0.10126087022945285,0.09676827071234584,0.47497950175892606,-110.5354012745472,1.3066155963072903,23.46639648063563,1.0287660547757467,2.7961706786697182
