Question,Real Answer,Pred Answer
In what year was Twilight Princess from the game series on which The Legend of Neil was based originally planned for release?,2005,"<think>
Okay, let's tackle this question. The user is asking about the year Twilight Princess was released as part of the Zelda series, specifically in relation to the Legend of Zelda: Twilight Princess and its connection to The Legend of Zelda: The"
What is the mascot of the school that owns Goss Stadium at Coleman Field?,Benny Beaver,"<think>
Okay, let's tackle this question. The user is asking about the mascot of the school that owns Goss Stadium at Coleman Field in Corvallis, Oregon. From the provided documents, I remember that Goss Stadium is associated with"
Who is the spouse of the actor that plays vision in avengers age of ultron?,Jennifer Connelly,"assistant_sole

Okay, let's tackle this question. The user is asking about the spouse of the actor who plays the character in the movie ""Avengers: Age of Ultron."" Wait, no, actually, the question is phr"
Who was the spouse of the leading lady in Gone With the wind?,Laurence Olivier,"think

Okay, let's tackle this question. The user is asking about the spouse of the leading lady in the film ""Gone with the Wind."" The leading lady is Scarlett O'Hara, played by Vivien Leigh. From the provided"
Who was the mother of the person who found the sacred writings that became the Book of Mormon?,Lucy Mack Smith,"<|im_start|>

<|im_start|>

Answer: Joseph Smith"
Who is the mayor presiding now where Merrill Elam was born?,Lance Bottoms,"<|im_start|>

<|im_start|>

Answer: The mayor presiding now is John Cranley."
What county shares a border with the county where She Did It's performer was born?,Cabarrus County,"The answer is: Gold Hill is an unincorporated community and census-designated place (CDP) in Rowan County, North Carolina, United States. It is located near the Cabarrus County line and is situated in the northeast"
What is the experimental satellite which was the forerunner to the communication satellite of the operator of GSAT-7 called?,ATS - 6 (Applications Technology Satellite - 6),"<|im_end|>

<|im_start|>

Answer: ATS-6"
What watercourse is the river on which the Lostock Dam is located the mouth of?,Hunter River,"<|im_start|>

<|im_start|>

Answer: Toongabbie Creek"
There is a state A where Storm of the Century was filmed based on the book by the author who wrote a short story featuring the author of This Is My God. What is the population of state A?,"1,335,907","Answer: 1,362,359"
