Question,Real Answer,Pred Answer
Who plays the wife of the producer of Here Comes the Boom in Grown Ups?,Maria Bello,"Okay, let's tackle this question. The user is asking about the woman who portrayed Corliss Archer in the film ""Kiss and Tell"" and what government position she held. 

First, I need to look at the provided documents"
What was the person who provided evidence to suggest the existence of the neutron a participant of?,Manhattan Project,"thinks
<think>
Okay, let's tackle this question. The user is asking about the person who provided evidence for the neutron's existence and was a participant in the Manhattan Project. From the given documents, I remember that James Chadwick is"
In which borough was Callum McManaman born?,Knowsley,"Concise answer: The question is asking for the name of the borough in which Callum McManaman was born. However, the provided text does not mention the birthplace of Callum McManaman. Instead, it discusses the history"
Who is the child of the Italian navigator who sailed for England and explored the eastern coast of the continent Francisco Bojado's birthplace is located?,Sebastian Cabot,"<think>
Okay, let's tackle this question. The user is asking about the woman who portrayed Corliss Archer in the film ""Kiss and Tell"" and what government position she held. 

First, I need to recall the information from"
Who is the spouse of the actor who played hannibal smith in the a team?,Sherry Boucher,"<|im_start|>

<|im_start|>

<|im_start|>

The woman who portrayed Corliss Archer in the film *Kiss and Tell* is Shirley Temple. According to the document, Shirley Temple Black was an American actress, singer, dancer, businesswoman, and diplomat"
When was the last time Peter Till's sports team beat the winner of the 1894-95 FA Cup?,1 December 2010,"<think>
Okay, let's tackle this question. The user is asking about the last time the teams in the Second City derby (Aston Villa and Birmingham City) had the same result in the Premier League during a specific season. The options given"
Who is the child of the cast member of Green Ice?,Tatum O'Neal,"<think>
Okay, let's tackle this question. The user is asking about the child of the cast member in the movie ""Green Ice."" First, I need to figure out which movie they're referring to. The provided documents mention ""Green Ice"
