Question,Real Answer,Pred Answer,em,f1,glm_correct,glm_reason
Who plays the wife of the producer of Here Comes the Boom in Grown Ups?,Maria Bello,Maggie Gyllenhaal,0.0,0.0,False,预测答案给出的演员是Maggie Gyllenhaal，而标准答案为Maria Bello。两者是完全不同的人，预测答案未包含标准答案的关键信息，语义上也不等价，因此判断为错误。
What was the person who provided evidence to suggest the existence of the neutron a participant of?,Manhattan Project,Manhattan Project,1.0,1.0,True,预测答案“Manhattan Project”与标准答案完全一致，包含了标准答案的所有关键信息，且在语义上完全等价，准确地回答了提出的问题。
In which borough was Callum McManaman born?,Knowsley,Whiston,0.0,0.0,False,预测答案“Whiston”与标准答案“Knowsley”在语义上并不等价，且预测答案未包含标准答案的关键信息。两者是不同的地名，因此预测答案未能正确回答问题。
Who is the child of the Italian navigator who sailed for England and explored the eastern coast of the continent Francisco Bojado's birthplace is located?,Sebastian Cabot,Sebastian Cabot,1.0,1.0,True,预测答案“Sebastian Cabot”与标准答案完全一致，包含了标准答案的关键信息，且在语义上完全等价，准确地回答了问题。
Who is the spouse of the actor who played hannibal smith in the a team?,Sherry Boucher,Joy Patricia Harmon,0.0,0.0,False,预测答案“Joy Patricia Harmon”与标准答案“Sherry Boucher”完全不一致。预测答案没有包含标准答案的关键信息，两者在语义上也不等价，因此预测答案未能正确回答问题。
When was the last time Peter Till's sports team beat the winner of the 1894-95 FA Cup?,1 December 2010,2019,0.0,0.4444444444444444,False,预测答案给出的年份是2019，而标准答案明确指出是2010年12月1日。两者在具体时间上存在明显差异，预测答案未能包含标准答案的关键信息，且语义上不等价。
Who is the child of the cast member of Green Ice?,Tatum O'Neal,Answer: Tristan Fry,0.0,0.0,False,预测答案“Tristan Fry”与标准答案“Tatum O'Neal”完全不同，两者在语义上不等价，且预测答案未包含标准答案的任何关键信息，因此未能正确回答问题。
How many times did plague occur in the birthplace of La Silvia's composer?,22,3,0.0,0.0,False,预测答案给出的数字是3，而标准答案明确指出瘟疫发生的次数是22。两者在数值上完全不一致，且语义上不等价，因此预测答案未能正确回答问题。
When did military instruction start at the place where Larry Alcala was educated?,1912,1912,1.0,1.0,True,预测答案“1912”与标准答案“1912”完全一致，包含了标准答案的关键信息，且在语义上完全等价，准确地回答了关于军事教学开始时间的问题。
What is the experimental satellite being forerunner to communication satellite of INSAT-4CR's manufacturer called?,ATS - 6 (Applications Technology Satellite - 6),ATS-6,0.0,0.25,True,预测答案“ATS-6”与标准答案“ATS - 6 (Applications Technology Satellite - 6)”在语义上完全等价，包含了核心关键信息，仅省略了全称和连字符的细微格式差异，准确回答了问题。
Who was the first African American student at the university Robert Khayat was educated at?,James Howard Meredith,James Meredith,0.0,0.7499999999999999,True,预测答案“James Meredith”与标准答案“James Howard Meredith”指的是同一个人。预测答案包含了标准答案的核心姓名信息，省略中间名属于措辞上的细微差异，两者在语义上完全等价，正确回答了问题。
Who gives out the prize named after the author of Lectures on Jurisprudence?,University of Cambridge,Royal Society of Chemistry,0.0,0.25,False,预测答案“Royal Society of Chemistry”与标准答案“University of Cambridge”完全不同，两者在语义上不等价，且预测答案未包含标准答案的关键信息，因此判断为错误。
Who is Frances Freeling Broderip's sibling?,Tom Hood,Tom Hood,1.0,1.0,True,预测答案“Tom Hood”与标准答案完全一致，准确地包含了标准答案中的关键信息，在语义上完全等价，正确地回答了关于Frances Freeling Broderip的兄弟姐妹是谁的问题。
Who is the spouse of the person who voices Jarvis in Iron Man?,Jennifer Connelly,LaTanya Richardson,0.0,0.0,False,预测答案“LaTanya Richardson”与标准答案“Jennifer Connelly”完全不同。在《钢铁侠》中为贾维斯（Jarvis）配音的演员是保罗·贝坦尼，其配偶是詹妮弗·康纳利，而非LaTanya Richardson，因此预测答案未能正确回答问题。
What is the source of the river that is the mouth of the Caledon River?,Thaba Putsoa,The source of the river that is the mouth of the Caledon River is the Orange River.,0.0,0.0,False,预测答案给出的是“Orange River”，而标准答案是“Thaba Putsoa”。两者在语义上完全不同，预测答案没有包含标准答案的关键信息，因此判断为错误。
What is the name of the famous bridge located in the birthplace of the composer of Nulla in mundo pax sincera?,Rialto Bridge,Royal Albert Bridge,0.0,0.3333333333333333,False,预测答案“Royal Albert Bridge”与标准答案“Rialto Bridge”完全不同，两者在语义上不等价，且预测答案未包含标准答案的任何关键信息，因此未能正确回答问题。
When did the party that gained control of Congress in the midterm elections in 1946 take control of the government branch that determines the rules of the US House?,January 2015,1946,0.0,0.0,False,预测答案“1946”与标准答案“January 2015”完全不一致。问题询问的是该政党何时接管决定美国众议院规则的政府分支（即规则委员会），标准答案明确为2015年1月，而预测答案给出的是赢得中期选举的年份，未能正确回答问题。
Where did the producer of Julius Caesar study or work?,Clifton College,"John Houseman, the producer of Julius Caesar (1953), studied at Clifton College in England and worked in the grain trade in London before emigrating to the United States in 1925.",0.0,0.09302325581395349,True,预测答案明确指出了《Julius Caesar》的制片人John Houseman在Clifton College学习，并在伦敦从事粮食贸易工作。这不仅包含了标准答案“Clifton College”的关键信息，还额外补充了工作经历，完整且准确地回答了问题。
Mehmet Hayri Tarhan's birthplace is the capital of what municipality?,Malko Tarnovo Municipality,Malko Tarnovo,0.0,0.888888888888889,True,预测答案“Malko Tarnovo”包含了标准答案“Malko Tarnovo Municipality”的核心地名信息。在常识问答的语境下，省略“Municipality”这一行政区划后缀并不改变其语义指向，两者在语义上是等价的，因此判定为正确。
What is the performer of Heartbeat named after?,Natalie Albino,Nina Sky,0.0,0.0,False,预测答案“Nina Sky”是一个音乐组合名称，而标准答案“Natalie Albino”是该组合中具体成员的名字。两者在语义上并不等价，预测答案未包含标准答案的关键信息。
The author of Elizabeth and After attended which university?,University of Toronto,University of Toronto,1.0,1.0,True,预测答案“University of Toronto”与标准答案完全一致，包含了标准答案的关键信息，且在语义上完全等价，准确地回答了问题。
What year did the publisher of Labyrinth end?,1986,1999,0.0,0.3333333333333333,False,预测答案给出的年份是1999年，而标准答案明确指出该出版商结束的年份是1986年。两者在年份信息上完全不一致，且语义上不等价，因此预测答案未能正确回答问题。
The food safety system of the agency that has the authority to decide if a drug is marketed otc or prescription is known as?,Food Safety Modernization Act (FSMA),FDA,0.0,0.0,False,预测答案“FDA”指的是拥有决定药物上市权力的机构（美国食品药品监督管理局），而问题询问的是该机构的食品安全系统名称。标准答案“Food Safety Modernization Act (FSMA)”才是具体的食品安全系统/法案名称，两者在语义上完全不同，预测答案未包含标准答案的关键信息。
Who is the president of the newly declared independent country that has a Commission of Truth and Friendship with the country where Ambelau is located?,Francisco Guterres,José Ramos-Horta,0.0,0.0,False,预测答案“José Ramos-Horta”与标准答案“Francisco Guterres”是两个完全不同的人名，预测答案没有包含标准答案的关键信息，两者在语义上也不等价，因此判断为错误。
Who was the British general in the battle named after the birth city of the person who recorded Mother-in-Law?,General Edward Pakenham,Edward Pakenham,0.0,0.888888888888889,True,预测答案“Edward Pakenham”与标准答案“General Edward Pakenham”在语义上完全等价。预测答案包含了标准答案的核心人物姓名，仅省略了头衔“General”，这属于措辞上的细微差异，不影响对问题实质的正确回答。
Where is Sean Hampton's birth place in the state of Florida?,in Northern Florida,"Ocala, Florida",0.0,0.5,False,"预测答案“Ocala, Florida”是一个具体的城市，而标准答案是“in Northern Florida”这一地区概念。两者在语义上并不等价，预测答案未能包含标准答案的关键信息，因此判断为错误。"
Who is the president of the group Kim Un-yong is a member of?,Thomas Bach,Thomas Bach,1.0,1.0,True,预测答案“Thomas Bach”与标准答案完全一致，准确包含了标准答案的关键信息，且在语义上完全等价，正确地回答了关于该组织主席是谁的问题。
"During the war in which The Things They Carried is set, when was conscription introduced by the country where the film Grievous Bodily Harm was later released?",1964,1964,1.0,1.0,True,预测答案“1964”与标准答案“1964”完全一致，包含了标准答案的关键信息，且在语义上完全等价，准确地回答了问题中所询问的征兵引入时间。
Who is the president of the new country who has jointly established a Commission on Truth and Friendship with the birth country of Satyo Husodo?,Francisco Guterres,Xanana Gusmão,0.0,0.0,False,预测答案给出的姓名是“Xanana Gusmão”，而标准答案为“Francisco Guterres”。两者是不同的人名，预测答案未包含标准答案的关键信息，在语义上也不等价，因此判断为错误。
Who is the spouse of the current queen of England?,Philip Mountbatten,"Philip Mountbatten, Duke of Edinburgh",0.0,0.6666666666666666,True,"预测答案“Philip Mountbatten, Duke of Edinburgh”包含了标准答案“Philip Mountbatten”的核心信息，附加的头衔“Duke of Edinburgh”只是对同一人物的进一步补充说明，两者在语义上完全等价，正确回答了问题。"
In which year did Taifa of Francisco Giner de los Rios' birthplace cease to exist?,1065,1915,0.0,0.3333333333333333,False,预测答案给出的年份是1915年，而标准答案是1065年。两者在数值上完全不同，且在语义上不等价，因此预测答案未能正确回答问题。
What did M. King Hubbert's employer announce it was in the process of doing in April 2010?,trying to find a potential buyer for all of its operations in Finland,selling its operations in Finland,0.0,0.5882352941176471,True,预测答案“selling its operations in Finland”与标准答案“trying to find a potential buyer for all of its operations in Finland”在语义上高度一致。寻找买家的最终目的就是出售业务，预测答案准确概括了标准答案的核心意图，符合允许措辞细微差异的标准。
Who did the person considered the founder of three major monotheistic religions marry after the death of Sarah?,Keturah,Abraham married Keturah after the death of Sarah.,0.0,0.33333333333333337,True,预测答案明确指出了亚伯拉罕在撒拉死后娶了基土拉，包含了标准答案“Keturah”这一关键信息，且语义与标准答案完全一致，准确回答了原问题。
In what region of the country of S-Fone is The place of birth of John Phan located?,South Central Coast,South Central Coast,1.0,1.0,True,预测答案“South Central Coast”与标准答案完全一致，包含了标准答案的所有关键信息，且在语义上完全等价，准确地回答了所提出的问题。
"Along with the Closer performer, what notable pop artist started out his career on adult contemporary radio?",Michael Bublé,Josh Groban,0.0,0.0,False,预测答案给出的艺术家是“Josh Groban”，而标准答案为“Michael Bublé”。两者是不同的歌手，预测答案未包含标准答案的关键信息，在语义上也不等价，因此判断为错误。
The Live Life Loud album's band signed to which label?,Fair Trade Services,Blue Note,0.0,0.0,False,预测答案给出的厂牌是“Blue Note”，而标准答案明确指出该乐队签约的厂牌是“Fair Trade Services”。两者在语义上完全不同，预测答案未包含标准答案的关键信息，因此判断为错误。
Who is the child of Sigrid Eskilsdotter's child?,Svante Stensson Sture,Christina Gyllenstierna,0.0,0.0,False,预测答案“Christina Gyllenstierna”与标准答案“Svante Stensson Sture”完全不同，两者在语义上不等价，且预测答案未包含标准答案的任何关键信息，因此未能正确回答问题。
What is the record label of the Metalworks Studio founder?,TML Entertainment,Metalworks Institute,0.0,0.0,False,预测答案“Metalworks Institute”与标准答案“TML Entertainment”在语义上完全不同，且未包含标准答案的任何关键信息。Metalworks Institute 是一家教育机构，而非问题所询问的唱片公司，因此预测答案未能正确回答问题。
Who is the president of the new country that jointly established a Commission of Truth and Friendship with the country that broadcasts Dahsyat?,Francisco Guterres,Susilo Bambang Yudhoyono,0.0,0.0,False,预测答案“Susilo Bambang Yudhoyono”与标准答案“Francisco Guterres”完全不同，两者指代的是不同的人物。预测答案没有包含标准答案的关键信息，在语义上也不等价，因此未能正确回答问题。
How many times did the plague occur in the city where Flora's painter died?,22,3,0.0,0.0,False,预测答案给出的数字是3，而标准答案明确指出瘟疫发生的次数是22。两者在数值上完全不一致，且语义上无法等价，因此预测答案未能正确回答问题。
What is the seat of the county sharing a border with the county in which Valley New School is located?,Green Bay,Appleton,0.0,0.0,False,预测答案“Appleton”与标准答案“Green Bay”不一致。Appleton是Valley New School本身所在县的县治，而问题询问的是与该县接壤的县的县治，正确答案应为Green Bay，因此预测答案错误。
What is the highest city in the state where Dell ranks sixth by revenue?,Fort Davis,Fort Davis,1.0,1.0,True,预测答案“Fort Davis”与标准答案完全一致，包含了标准答案的所有关键信息，且在语义上完全等价，准确地回答了问题。
Who played the girlfriend of who plays marty mcfly's daughter in back to the future 2?,Claudia Wells,Lea Thompson played the girlfriend of Marty McFly's daughter in Back to the Future 2.,0.0,0.0,False,预测答案给出的演员是Lea Thompson，而标准答案是Claudia Wells。两者在人物指代上完全不同，预测答案没有包含标准答案的关键信息，因此判断为错误。
"What specific part of the book where the quote ""by the skin of your teeth"" comes from document reference for Mary?",Genesis 3:15,Job 19:20,0.0,0.4444444444444445,False,预测答案“Job 19:20”与标准答案“Genesis 3:15”完全不同，两者在文本出处和语义上均不等价，预测答案未包含标准答案的关键信息，因此判断为错误。
What is the seat of the county sharing a border with the county in which J. P. Hayes was born?,Green Bay,Appleton,0.0,0.0,False,预测答案给出的城市是“Appleton”，而标准答案为“Green Bay”。两者是不同的城市，在语义上并不等价，且预测答案未包含标准答案的关键信息，因此未能正确回答问题。
How many times did plague occur in the place where Venus with a Mirror's creator died?,22,3,0.0,0.0,False,预测答案给出的数字是3，而标准答案明确指出瘟疫发生的次数是22。两者在数值上完全不一致，且不满足语义等价的要求，因此预测答案未能正确回答问题。
What is the source of the river Orlam clans crossed to migrate to Namibia?,Thaba Putsoa,Cape Colony,0.0,0.0,False,预测答案“Cape Colony”是奥兰姆人迁徙的出发地，而问题询问的是他们渡过的河流源头。标准答案明确指出该河流的源头是“Thaba Putsoa”，预测答案未包含此关键信息，且两者在语义上完全不等价。
"Why was Common Sense, by the same author as Rights of Man, an important work?",crystallized the rebellious demand for independence from Great Britain,Common Sense was an important work because it was a highly influential pamphlet that catalyzed the call for American independence from Great Britain. It was widely read and helped to solidify public support for the American Revolution by arguing for,0.0,0.23076923076923075,True,预测答案包含了标准答案的关键信息，明确指出了《常识》催化并巩固了美国脱离英国独立的呼声。两者在语义上高度等价，均表达了该作品在推动美国独立革命中的重要作用，符合正确回答的标准。
In which county was Larkin I. Smith born?,Pearl River County,Pearl River County,1.0,1.0,True,预测答案“Pearl River County”与标准答案“Pearl River County”完全一致，包含了标准答案的所有关键信息，语义上完全等价，准确地回答了Larkin I. Smith出生在哪个县的问题。
What movie did the person who acted in the comedy film Crime School win his only Oscar for?,The African Queen,The African Queen,1.0,1.0,True,预测答案与标准答案完全一致，均为“The African Queen”。预测答案准确包含了标准答案的关键信息，在语义上完全等价，正确回答了关于在喜剧电影《Crime School》中出演的演员获得其唯一奥斯卡奖的电影名称的问题。
with what movie did Mary Philips' husband win his only oscar?,The African Queen,The African Queen,1.0,1.0,True,预测答案与标准答案完全一致，均为“The African Queen”，准确包含了标准答案的关键信息，语义上完全等价，正确地回答了关于Mary Philips丈夫获得唯一奥斯卡奖的电影的问题。
The all time top goal scorer in premier league in one season is a member of what team?,Egypt national football team,Answer: Manchester City,0.0,0.0,False,预测答案“Manchester City”与标准答案“Egypt national football team”在语义上完全不同。英超单赛季进球纪录保持者是穆罕默德·萨拉赫，他是埃及国家足球队的成员，而不是曼彻斯特城队的成员，因此预测答案未包含正确信息。
Where is the province of Gonbad-e Qabus County located?,in the north-east of the country south of the Caspian Sea,"Golestan Province, Iran.",0.0,0.0,False,预测答案回答了Gonbad-e Qabus County所在的省份（伊朗的戈勒斯坦省），但标准答案要求的关键信息是其在国家内部的地理位置（位于里海以南的东北部）。预测答案未能包含标准答案的关键信息，两者在语义上不等价。
Who wrote the song turn me on that is performed by performer of Feelin' the Same Way?,John D. Loudermilk,John D. Loudermilk,1.0,1.0,True,预测答案“John D. Loudermilk”与标准答案完全一致，包含了标准答案的关键信息，且在语义上完全等价，正确地回答了问题。
What institute did the actor playing the voice of John Smith in Pocahontas attend?,National Institute of Dramatic Art,National Institute of Dramatic Art (NIDA),0.0,0.8,True,预测答案“National Institute of Dramatic Art (NIDA)”包含了标准答案“National Institute of Dramatic Art”的全部关键信息，括号中的简称只是对原机构的补充说明，两者在语义上完全等价，正确回答了问题。
Who led the muslim forces to retake the proposed embassy destination?,Abu Ubaidah,Abu Ubaidah,1.0,1.0,True,预测答案“Abu Ubaidah”与标准答案完全一致，准确包含了问题所要求的关键人物信息，语义上完全等价，因此正确回答了问题。
Which is the body of water near George Mills' place of birth?,River Thames,River Ravensbourne,0.0,0.0,False,预测答案给出的水体名称是“River Ravensbourne”，而标准答案是“River Thames”。两者指代的是完全不同的河流，在语义上并不等价，且预测答案未包含标准答案的关键信息，因此判断为错误。
When did the party who gained control of congress in the midterm elections in 1946 take control of the determiner of rules of the US House and US Senate?,January 2015,1946,0.0,0.0,False,预测答案“1946”只是中期选举举行的时间，而问题询问的是该政党何时正式掌控国会规则制定权。标准答案为“January 2015”，两者在时间点和语义上完全不同，因此预测答案不正确。
Who does the Nothing Suits Me Like a Suit artist play in Batman Under the Red Hood?,Nightwing / Dick Grayson,Jason Todd,0.0,0.0,False,预测答案“Jason Todd”与标准答案“Nightwing / Dick Grayson”不一致。在《Batman Under the Red Hood》中，演唱《Nothing Suits Me Like a Suit》的艺术家（Neil Patrick Harris）配音的角色是夜翼/迪克·格雷森，而不是杰森·托德。因此，预测答案未能包含标准答案的关键信息，属于回答错误。
When was the death penalty abolished in the country near the country where the writer of The Book Thief is a citizen of?,1989,1989,1.0,1.0,True,预测答案“1989”与标准答案“1989”完全一致，包含了标准答案的关键信息，且在语义上完全等价，因此预测答案正确地回答了问题。
What is the seat of the county sharing a border with the county in which Miller Electric is headquartered?,Green Bay,Pécs,0.0,0.0,False,预测答案“Pécs”与标准答案“Green Bay”完全不一致，两者在语义上没有任何关联，且预测答案未包含标准答案的任何关键信息，因此判定为错误。
Who is the brother of the Nothin' My Love Can't Fix performer?,Matthew Lawrence,Joey Lawrence,0.0,0.6666666666666666,False,预测答案“Joey Lawrence”与标准答案“Matthew Lawrence”是两个不同的人。虽然他们现实中是兄弟关系，但针对该问题所询问的特定对象，预测答案未能包含标准答案的关键信息，两者在语义上不等价，因此判断为错误。
Who is the brother of the Melissa and Joey Theme Song singer?,Matthew Lawrence,Michael Lawrence,0.0,0.6666666666666666,False,预测答案给出的名字是“Michael Lawrence”，而标准答案是“Matthew Lawrence”。两者虽然姓氏相同，但名字完全不同，指代的是不同的人，因此预测答案没有包含正确的关键信息，属于错误回答。
When was the last time the team that Arthur James was a member of beat the 1894-95 FA cup winner?,1 December 2010,2005–06,0.0,0.3333333333333333,False,预测答案“2005–06”与标准答案“1 December 2010”在信息内容上完全不一致，两者既不匹配也不在语义上等价，因此预测答案未能正确回答问题。
Who started the foundation that developed the Free Software Directory?,Richard Stallman,Free Software Foundation (FSF),0.0,0.0,False,预测答案“Free Software Foundation (FSF)”是该基金会的名称，而问题询问的是“谁”创立了该基金会。标准答案明确指出创立者是“Richard Stallman”（理查德·斯托曼）。两者在语义上并不等价，预测答案未能包含标准答案的关键信息。
What pantheon is the God of the underworld in ancient Egypt a part of?,ancient Egyptian religion,Egyptian,0.0,0.25,True,预测答案“Egyptian”虽然省略了“ancient”和“religion”等词，但在语境下明确指代了古埃及的宗教或神话体系，与标准答案“ancient Egyptian religion”在语义上等价，包含了关键信息。
Where was the president born on the fourth of July born?,Plymouth Notch,"Answer: La Rioja, Argentina",0.0,0.0,False,"预测答案给出的出生地是“La Rioja, Argentina”（阿根廷拉里奥哈），而标准答案是“Plymouth Notch”。两者在地理位置和语义上完全不同，预测答案没有包含标准答案的关键信息，因此判断为错误。"
Who play's Marty's girlfriend in back to the future?,Claudia Wells,Elisabeth Shue,0.0,0.0,False,预测答案给出的演员是Elisabeth Shue，而标准答案为Claudia Wells。虽然两人都在《回到未来》系列中饰演过Marty的女友Jennifer，但Claudia Wells出演了第一部，Elisabeth Shue出演了后两部。预测答案与标准答案信息不一致，因此判断为错误。
