Question,Real Answer,Pred Answer,em,f1,glm_correct,glm_reason
What is the record label for the band which performed Pythons?,Kanine Records,Sire Records,0.0,0.5,False,预测答案给出的唱片公司是“Sire Records”，而标准答案为“Kanine Records”。两者在语义上完全不同，预测答案未包含标准答案的关键信息，因此判断为错误。
Who is the employer of the person Mach's principle was named after?,Charles University,The employer of the person Mach's principle was named after is not explicitly mentioned in the provided passages.,0.0,0.0,False,预测答案未能提供问题所要求的具体雇主信息，也没有包含标准答案中的关键信息“Charles University”。它仅仅表示在提供的段落中没有明确提及，因此未能正确回答问题。
What is the life expectancy of the type of retriever named after the body of water the Patuxent River turns into?,average lifespan at 9.4 years,12 to 13 years,0.0,0.3333333333333333,False,预测答案给出的寿命是“12 to 13 years”，而标准答案明确指出该犬种的平均寿命为“9.4 years”。两者在数值上完全不同，语义上存在根本冲突，因此预测答案未能正确回答问题。
Who is the president of the newly declared independent country that is part of the Commission of Truth and Friendship with the country where Sambas is located?,Francisco Guterres,José Ramos-Horta,0.0,0.0,False,预测答案“José Ramos-Horta”与标准答案“Francisco Guterres”是两个不同的人名，预测答案未包含标准答案的关键信息，两者在语义上不等价，因此判断为错误。
What is the capital of the country it is about?,Aden,Georgetown,0.0,0.0,False,预测答案“Georgetown”与标准答案“Aden”完全不同，两者在语义上没有任何等价或包含关系，未能提供问题所要求的关键信息，因此判断为错误。
The league playing in the Thursday night football game is a type of what?,sports league,American football,0.0,0.0,False,预测答案“American football”指的是一种运动项目，而问题询问的是参加比赛的联盟属于什么类型。标准答案“sports league”准确指出了其类别为体育联盟，预测答案在语义上与标准答案不一致，未能正确回答问题。
A participant of the Battle of Brechin is an instance of?,Scottish clan,Clan Gordon,0.0,0.0,False,预测答案“Clan Gordon”是“Scottish clan”的一个具体实例，而问题询问的是该实例所属的类别。预测答案与标准答案在语义上并不等价，未能正确回答问题。
What is the symbol of the Saints from the city that is the location of Blanton's manufacturer's headquarters called?,fleur - de-lis,fleur-de-lis,0.0,0.6666666666666666,True,预测答案“fleur-de-lis”与标准答案“fleur - de-lis”在语义上完全等价，仅仅是连字符的空格格式存在细微差异，包含了标准答案的所有关键信息，符合允许措辞细微差异的判断标准。
What mythology is the city where Eutychides was born in a part of?,Greek mythology,Greek mythology,1.0,1.0,True,预测答案“Greek mythology”与标准答案完全一致，包含了标准答案的所有关键信息，且在语义上完全等价，准确地回答了关于Eutychides出生地所属神话体系的问题。
What is the oldest college in the state that contains Borough House Plantation?,College of Charles Towne,College of Charleston,0.0,0.5,True,预测答案“College of Charleston”与标准答案“College of Charles Towne”指代的是同一所教育机构。“Charles Towne”是查尔斯顿的历史旧称，两者在语义上完全等价，仅为措辞上的细微差异。
"What county shares a border with the other county, that contains the city, that is the birthplace of the performer of Never Gonna Fall in Love Again?",Cabarrus County,Answer: Lempira,0.0,0.0,False,预测答案“Lempira”与标准答案“Cabarrus County”完全不一致，没有包含标准答案的任何关键信息，且两者在语义上没有任何关联，因此预测答案未能正确回答问题。
What city was the author of What We Talk About When We Talk About love born in?,Clatskanie,"Clatskanie, Oregon",0.0,0.7499999999999999,True,"预测答案“Clatskanie, Oregon”包含了标准答案“Clatskanie”的关键信息，两者在语义上完全等价。预测答案只是额外补充了该城市所在的州名，不影响对问题核心事实的正确回答。"
What undertaking included the person who discovered that the number of protons in each element's atoms is unique?,Manhattan Project,Manhattan Project,1.0,1.0,True,预测答案“Manhattan Project”与标准答案完全一致，包含了标准答案的关键信息，且在语义上完全等价，准确地回答了问题。
What was the story of the character from The Bourne Deception based on?,the novel of the same name by Robert Ludlum,the legendary Bavarian prophet Mühlhiasl,0.0,0.10526315789473685,False,预测答案与标准答案完全不一致。标准答案指出该角色的故事基于罗伯特·陆德伦的同名小说，而预测答案却给出了一个巴伐利亚先知的名字，两者在语义上毫无关联，且未包含标准答案的任何关键信息。
Which two features were played up the person who had the biggest net worth in 2017?,ease of use and enhanced support for Plug and Play,"1. The person who had the biggest net worth in 2017 was Bill Gates, who was named the richest man in the world by Forbes' annual list of the world's billionaires for the fourth year in a",0.0,0.09302325581395347,False,预测答案只指出了2017年净资产最高的人是比尔·盖茨，但并未回答问题所问的“哪两个特征”，也没有包含标准答案中的关键信息“ease of use and enhanced support for Plug and Play”。此外，预测答案的句子甚至未完整结束，因此判断为错误。
"Who is one of the members of the music group that performed ""Good Little Girls""?",Aaron Benward,Michael Conner Humphreys,0.0,0.0,False,预测答案“Michael Conner Humphreys”与标准答案“Aaron Benward”完全不同，没有包含标准答案的任何关键信息，两者在语义上也不等价，因此未能正确回答问题。
How many times did plague occur in the place where Bajazet's composer was born?,22,3,0.0,0.0,False,预测答案给出的数字是3，而标准答案为22。两者在数值上完全不一致，且不存在语义等价或措辞上的细微差异，因此预测答案未能正确回答问题。
What year did the company that published Starship Command end?,1986,1999,0.0,0.3333333333333333,False,预测答案给出的年份是1999年，而标准答案明确指出该公司结束的年份是1986年。两者在关键信息上完全不一致，因此预测答案未能正确回答问题。
Who is the spouse of the child of Peter Andreas Heiberg?,Johanne Luise Heiberg,Johanne Luise Pätges,0.0,0.5714285714285714,True,预测答案“Johanne Luise Pätges”与标准答案“Johanne Luise Heiberg”指向的是同一个人。“Pätges”是该人物婚前的本姓，而“Heiberg”是其婚后随夫姓。两者在语义上完全等价，因此预测答案正确。
What character in A League of their Own was played by the actress who played Thelma in the movie Thelma and Louise?,Dottie Hinson,Thelma Dickinson,0.0,0.28571428571428575,False,预测答案“Thelma Dickinson”是电影《末路狂花》中Thelma的角色名，而问题询问的是该演员在《红粉联盟》中扮演的角色。标准答案为“Dottie Hinson”，两者完全不同，因此预测答案错误。
What is the abbreviated name of the exclusive platform of the video game named for the league with a halftime event just before the publishers clearing house sweepstakes drawing.,NES,NFL,0.0,0.0,False,预测答案“NFL”与标准答案“NES”完全不同。标准答案“NES”是任天堂娱乐系统的缩写，而“NFL”是国家橄榄球联盟的缩写，两者在语义上没有任何等价关系，因此预测答案未能包含标准答案的关键信息。
When was the last time the sports team Alan O'Neil was a member of beat the winner of the 1894-95 FA cup?,1 December 2010,2008,0.0,0.4444444444444444,False,预测答案给出的时间是2008年，而标准答案明确指出时间是1 December 2010。两者在年份上存在明显差异，语义上并不等价，因此预测答案未能正确回答问题。
Who is the spouse of the person who plays Batman in the Lego Batman Movie?,Amy Poehler,"Will Arnett is the voice actor who plays Batman in The Lego Batman Movie. The question asks for the spouse of the person who plays Batman, which refers to Will Arnett's spouse. Based on the information provided in the",0.0,0.0,False,预测答案虽然正确指出了扮演蝙蝠侠的配音演员是Will Arnett，但句子未完整且并未给出其配偶的名字。预测答案没有包含标准答案中的关键信息“Amy Poehler”，未能正确回答问题。
By how much of the population of the region where Baton a feu originated reduced by the black death?,30% to 65%,"The Bâton à feu originated in Western Europe. According to the provided information, the Black Death reduced the population of Western Europe by an estimated one-third to one-half during the peak years of 1347 to",0.0,0.09523809523809523,True,预测答案指出黑死病使西欧人口减少了三分之一到二分之一，这与标准答案中的“30% to 65%”在语义和数值范围上完全等价，准确回答了问题。
When did the explorer reach the headquarters location of the group Con-Test's record label is part of?,"August 3, 1769",1769,0.0,0.5454545454545454,True,"预测答案“1769”包含了标准答案“August 3, 1769”中的核心年份信息。在许多自然语言问答场景中，年份是回答时间类问题的关键要素，两者在语义上基本等价，能够正确回答该问题。"
What is the name of the castle in the city where the performers of Spirit If.. became a band?,Casa Loma,Casa Loma,1.0,1.0,True,预测答案与标准答案完全一致，均为“Casa Loma”。预测答案准确包含了标准答案所需的关键信息，在语义上完全等价，正确地回答了问题。
Who wrote a book about growing up in the same nationality as the man who produced The Wild Women of Chastity Gulch?,Min Zhou,Katherine Applegate,0.0,0.0,False,预测答案“Katherine Applegate”与标准答案“Min Zhou”完全不一致，未包含标准答案的关键信息，且两者在语义上并不等价，因此预测答案未能正确回答问题。
Who is the spouse of the actor of Ethan in A Dog's Purpose?,Meg Ryan,Peggy Lipton,0.0,0.0,False,预测答案“Peggy Lipton”与标准答案“Meg Ryan”完全不同，两者在语义上不等价，且预测答案未包含标准答案的任何关键信息，因此未能正确回答问题。
Who is the federal leader of the party that Pierre-Hugues Boisvenu is a member of?,Andrew Scheer,Andrew Scheer,1.0,1.0,True,预测答案“Andrew Scheer”与标准答案完全一致，包含了标准答案的关键信息，且在语义上完全等价，准确地回答了问题中所询问的政党联邦领袖是谁。
At what local time does the country where Fuser and Alberto meet the indigenous couple traveling to look for work change their clocks for DST?,24:00,12:00 midnight,0.0,0.5714285714285715,True,预测答案中的“12:00 midnight”与标准答案的“24:00”在语义上完全等价，均表示午夜零点这一时间点。虽然措辞不同，但表达的时间信息一致，符合允许细微差异的判断标准。
When did the place of birth of the performer of Mother-in-Law elect its first black Mayor?,1970s,2008,0.0,0.28571428571428575,False,预测答案给出的时间是2008年，而标准答案明确指出其出生地选出首位黑人市长的时间是在1970年代。两者在时间信息上完全不一致，且语义上也不等价，因此预测答案未能正确回答问题。
When was the last time Ken Faulkner's team beat the 1894-95 FA Cup winner?,1 December 2010,1914,0.0,0.2222222222222222,False,预测答案给出的时间是1914年，而标准答案为2010年12月1日。两者在时间信息上完全不一致，预测答案未能包含标准答案的关键信息，因此判断为错误。
