method,selector_family,rate,main_acc,sub_acc,matching_overlap_rows,note
online_draft_rate015,online full Draft,0.15,99/135 (73.33%),209/248 or 209/250 (~84%),,online selector upper reference; exact denominator differs across summaries
old_unrelated_draft_smart_freq/offline15_only,old unrelated draft offline,0.15,not in final qwen3 full table,not in final qwen3 full table,"old_unrelated_draft_smart_freq:J=0.396,R=0.525","used primarily for selection overlap, not a clean QA baseline"
offline10_draft005,old unrelated offline10 + online Draft5,0.10+0.05,97/135 (71.85%),208/250 (83.20%),"old_unrelated_draft_smart_freq:J=0.383,R=0.533; pipeline_old10_draft005:J=0.383,R=0.533",fair-budget residual baseline
offline10_docgen_draft005,docgen offline10 + online Draft5,0.10+0.05,99/135 (73.33%),207/250 (82.80%),"docgen_draft_smart_freq:J=0.232,R=0.363; pipeline_docgen10:J=0.232,R=0.363",docgen less similar to online Draft10 but QA comparable
offline10_hybrid_old70_docgen30_draft005,old70/docgen30 offline10 + online Draft5,0.10+0.05,100/135 (74.07%),209/250 (83.60%),"pipeline_hybrid_old70_docgen30:J=0.348,R=0.499",best docgen hybrid in this group
offline15_docgen_only,docgen offline15 only,0.15,87/135 (64.44%),192/250 (76.80%),"docgen_draft_smart_freq:J=0.287,R=0.409; pipeline_docgen15_freq:J=0.287,R=0.409; pipeline_docgen15_mean:J=0.250,R=0.368",pure offline docgen underperforms; online residual remains important
offline15_docgen_mean_score_only,docgen mean-score offline15 only,0.15,84/135 (62.22%),188/250 (75.20%),"docgen_draft_smart_freq:J=0.287,R=0.409; pipeline_docgen15_freq:J=0.287,R=0.409; pipeline_docgen15_mean:J=0.250,R=0.368",mean-score worse than docgen frequency
