Question,Real Answer,Pred Answer,em,f1,glm_correct,glm_reason
Who plays the wife of the producer of Here Comes the Boom in Grown Ups?,Maria Bello,"The question is based on a mix-up of different movies and their cast members. The movie ""Here Comes the Boom"" does not have a character who is the wife of the producer. However, if we consider the movie """,0.0,0.0,False,预测答案被截断且未提供任何有效的人名信息，完全没有包含标准答案中的关键信息“Maria Bello”，也没有在语义上与标准答案等价，因此判定为错误。
What was the person who provided evidence to suggest the existence of the neutron a participant of?,Manhattan Project,the Manhattan Project,1.0,1.0,True,预测答案“the Manhattan Project”与标准答案“Manhattan Project”在语义上完全等价，仅仅是多了一个定冠词“the”，属于措辞上的细微差异，不影响核心意思的表达，因此预测答案正确回答了问题。
In which borough was Callum McManaman born?,Knowsley,Merseyside,0.0,0.0,False,预测答案“Merseyside”是一个更大的地理范围（默西赛德郡），而标准答案是“Knowsley”（诺斯利）。虽然诺斯利位于默西赛德郡内，但两者并非同一级行政区划，在语义上并不等价，因此预测答案不够准确。
Who is the child of the Italian navigator who sailed for England and explored the eastern coast of the continent Francisco Bojado's birthplace is located?,Sebastian Cabot,Sebastian Cabot,1.0,1.0,True,预测答案“Sebastian Cabot”与标准答案完全一致，包含了标准答案的关键信息，且在语义上完全等价，因此预测答案正确地回答了问题。
Who is the spouse of the actor who played hannibal smith in the a team?,Sherry Boucher,The question is unrelated to the provided passage.,0.0,0.0,False,预测答案表示问题与提供的段落无关，并没有给出任何具体的人名。它既没有包含标准答案“Sherry Boucher”的关键信息，在语义上也不等价，属于未给出可核验答案的情况。
When was the last time Peter Till's sports team beat the winner of the 1894-95 FA Cup?,1 December 2010,2003–04,0.0,0.3333333333333333,False,预测答案“2003–04”与标准答案“1 December 2010”在时间信息上完全不一致，且未包含标准答案的关键信息，因此预测答案未能正确回答问题。
Who is the child of the cast member of Green Ice?,Tatum O'Neal,"The information provided in the given passage does not mention any children of the cast members of Green Ice. Therefore, it is not possible to determine who the child of a cast member is based on the given information.",0.0,0.0,False,预测答案表示无法根据已知信息确定《Green Ice》演员的孩子是谁，未能包含标准答案中的关键信息“Tatum O'Neal”，两者在语义上完全不一致，因此预测错误。
How many times did plague occur in the birthplace of La Silvia's composer?,22,1,0.0,0.0,False,预测答案给出的数字是1，而标准答案明确指出瘟疫发生的次数是22。两者在数值上完全不一致，且语义上也不等价，因此预测答案未能正确回答问题。
When did military instruction start at the place where Larry Alcala was educated?,1912,1946,0.0,0.3333333333333333,False,预测答案给出的年份是1946年，而标准答案明确指出军事教学开始于1912年。两者在具体年份上完全不一致，且不存在语义等价或措辞上的细微差异，因此预测答案未能正确回答问题。
What is the experimental satellite being forerunner to communication satellite of INSAT-4CR's manufacturer called?,ATS - 6 (Applications Technology Satellite - 6),ATS-6,0.0,0.25,True,预测答案“ATS-6”包含了标准答案“ATS - 6 (Applications Technology Satellite - 6)”中的核心关键信息。两者在语义上完全等价，仅仅是省略了全称和空格等细微的格式差异，意思保持一致，正确回答了问题。
Who was the first African American student at the university Robert Khayat was educated at?,James Howard Meredith,James Howard Meredith,1.0,1.0,True,预测答案“James Howard Meredith”与标准答案完全一致，包含了标准答案中的所有关键信息，且在语义上完全等价，准确地回答了关于该大学第一位非裔美国学生的问题。
Who gives out the prize named after the author of Lectures on Jurisprudence?,University of Cambridge,"The prize named after the author of *Lectures on Jurisprudence* is the **Gyldendal Prize**, which was established in 1996 by the Norwegian publisher Gyldendal N",0.0,0.05263157894736842,False,预测答案给出的颁发机构是挪威出版商Gyldendal，而标准答案是University of Cambridge。两者在核心信息上完全不一致，且预测答案未能包含标准答案的任何关键信息，因此判断为错误。
Who is Frances Freeling Broderip's sibling?,Tom Hood,Heather Barclay,0.0,0.0,False,预测答案给出的名字是“Heather Barclay”，与标准答案“Tom Hood”完全不一致，没有包含标准答案的任何关键信息，因此未能正确回答关于Frances Freeling Broderip兄弟姐妹的问题。
Who is the spouse of the person who voices Jarvis in Iron Man?,Jennifer Connelly,Jennifer Connelly,1.0,1.0,True,预测答案“Jennifer Connelly”与标准答案完全一致，包含了标准答案的关键信息，且在语义上完全等价，准确地回答了问题，符合正确的判断标准。
What is the source of the river that is the mouth of the Caledon River?,Thaba Putsoa,The source of the river that is the mouth of the Caledon River is the confluence of the Kilombero and Luwegu rivers.,0.0,0.0,False,预测答案给出的源头是“Kilombero and Luwegu rivers”，而标准答案是“Thaba Putsoa”。两者信息完全不一致，因此预测答案未能正确回答问题。
What is the name of the famous bridge located in the birthplace of the composer of Nulla in mundo pax sincera?,Rialto Bridge,Royal Albert Bridge,0.0,0.3333333333333333,False,预测答案给出的桥梁名称是“Royal Albert Bridge”，而标准答案是“Rialto Bridge”。两者在名称和语义上完全不同，预测答案未包含标准答案的关键信息，因此判断为错误。
When did the party that gained control of Congress in the midterm elections in 1946 take control of the government branch that determines the rules of the US House?,January 2015,"The Republican Party gained control of the Senate in the 1946 midterm elections. The branch of government that determines the rules of the US House is the House of Representatives, not the Senate. Therefore, the question is",0.0,0.10256410256410256,False,预测答案未能包含标准答案“January 2015”这一关键信息，且句子未完整，没有给出可核验的最终答案，因此判定为错误。
Where did the producer of Julius Caesar study or work?,Clifton College,Vassar College,0.0,0.4,False,预测答案“Vassar College”与标准答案“Clifton College”是两所完全不同的机构，两者在语义上不等价，且预测答案未包含标准答案的关键信息，因此判断为错误。
Mehmet Hayri Tarhan's birthplace is the capital of what municipality?,Malko Tarnovo Municipality,Izmir,0.0,0.0,False,预测答案“Izmir”与标准答案“Malko Tarnovo Municipality”完全不一致。预测答案没有包含标准答案的任何关键信息，两者在语义上也不等价，因此未能正确回答问题。
What is the performer of Heartbeat named after?,Natalie Albino,Dave Bickler,0.0,0.0,False,预测答案“Dave Bickler”与标准答案“Natalie Albino”完全不一致，没有包含标准答案的任何关键信息，两者在语义上也不等价，因此未能正确回答问题。
The author of Elizabeth and After attended which university?,University of Toronto,University of Toronto,1.0,1.0,True,预测答案“University of Toronto”与标准答案完全一致，包含了标准答案的所有关键信息，且在语义上完全等价，准确地回答了《Elizabeth and After》作者所就读的大学，符合正确回答的判断标准。
What year did the publisher of Labyrinth end?,1986,1999,0.0,0.3333333333333333,False,预测答案给出的年份是1999年，而标准答案明确指出该出版商结束的年份是1986年。两者在关键信息上完全不一致，且语义上不等价，因此预测答案未能正确回答问题。
The food safety system of the agency that has the authority to decide if a drug is marketed otc or prescription is known as?,Food Safety Modernization Act (FSMA),OTC monograph system,0.0,0.0,False,预测答案“OTC monograph system”与标准答案“Food Safety Modernization Act (FSMA)”完全不一致，且在语义上不等价。预测答案未能包含标准答案的关键信息，因此判断为错误。
Who is the president of the newly declared independent country that has a Commission of Truth and Friendship with the country where Ambelau is located?,Francisco Guterres,Francisco Guterres,1.0,1.0,True,预测答案与标准答案完全一致，均为“Francisco Guterres”。预测答案准确包含了标准答案的关键信息，语义完全等价，符合正确回答问题的判断标准。
Who was the British general in the battle named after the birth city of the person who recorded Mother-in-Law?,General Edward Pakenham,Edward Pakenham,0.0,0.888888888888889,True,预测答案“Edward Pakenham”包含了标准答案“General Edward Pakenham”的核心人物信息。两者在语义上完全等价，仅仅是省略了军衔“General”，不影响对问题中英国将领身份的准确表达，符合允许措辞细微差异的评判标准。
Where is Sean Hampton's birth place in the state of Florida?,in Northern Florida,"Ocala, Florida",0.0,0.5,False,"预测答案“Ocala, Florida”给出了一个具体的城市，而标准答案是“in Northern Florida”这一区域信息。两者在语义上并不等价，预测答案未能包含标准答案的关键信息，因此判断为错误。"
Who is the president of the group Kim Un-yong is a member of?,Thomas Bach,Kim Jong Un,0.0,0.0,False,预测答案“Kim Jong Un”与标准答案“Thomas Bach”完全不一致。金云龙曾是国际奥委会（IOC）成员，该组织的主席是托马斯·巴赫，而非金正恩，因此预测答案未能正确回答问题。
"During the war in which The Things They Carried is set, when was conscription introduced by the country where the film Grievous Bodily Harm was later released?",1964,1964,1.0,1.0,True,预测答案“1964”与标准答案“1964”完全一致，包含了标准答案的关键信息，且在语义上完全等价，准确回答了问题所询问的征兵引入时间。
Who is the president of the new country who has jointly established a Commission on Truth and Friendship with the birth country of Satyo Husodo?,Francisco Guterres,Xanana Gusmão,0.0,0.0,False,预测答案“Xanana Gusmão”与标准答案“Francisco Guterres”是两个不同的人名，预测答案未包含标准答案的关键信息，两者在语义上也不等价，因此未能正确回答问题。
Who is the spouse of the current queen of England?,Philip Mountbatten,The spouse of the current queen of England is King Charles III.,0.0,0.0,False,预测答案给出的是“King Charles III”，而标准答案是“Philip Mountbatten”。两者在语义上完全不同，且King Charles III是当前女王伊丽莎白二世的儿子而非配偶，因此预测答案未能正确回答问题。
In which year did Taifa of Francisco Giner de los Rios' birthplace cease to exist?,1065,1151,0.0,0.3333333333333333,False,预测答案给出的年份是1151年，而标准答案明确指出该事件发生的年份是1065年。两者在关键的时间信息上完全不一致，因此预测答案未能正确回答问题。
What did M. King Hubbert's employer announce it was in the process of doing in April 2010?,trying to find a potential buyer for all of its operations in Finland,"selling its gas stations and the heavy vehicle fuel supply networks in Finland and Sweden, along with a refinery located in Gothenburg, Sweden",0.0,0.21621621621621623,False,预测答案与标准答案在语义上并不等价。标准答案强调的是雇主正在寻找买家以出售其在芬兰的所有业务，而预测答案具体列出了在芬兰和瑞典出售加油站、重型车辆燃料供应网络以及哥德堡炼油厂等具体资产。预测答案未能包含标准答案中“所有芬兰业务”这一关键信息，且引入了标准答案中没有的具体资产细节，因此判断为错误。
Who did the person considered the founder of three major monotheistic religions marry after the death of Sarah?,Keturah,Abraham married Keturah after the death of Sarah.,0.0,0.33333333333333337,True,预测答案明确指出了在Sarah死后，亚伯拉罕娶了Keturah，这与标准答案完全一致，包含了关键信息且语义等价。
In what region of the country of S-Fone is The place of birth of John Phan located?,South Central Coast,South Central Coast,1.0,1.0,True,预测答案“South Central Coast”与标准答案完全一致，包含了标准答案的所有关键信息，且在语义上完全等价，准确地回答了问题。
"Along with the Closer performer, what notable pop artist started out his career on adult contemporary radio?",Michael Bublé,Josh Groban,0.0,0.0,False,预测答案给出的艺术家是“Josh Groban”，而标准答案为“Michael Bublé”。两者是不同的歌手，预测答案未包含标准答案的关键信息，且在语义上不等价，因此判断为错误。
The Live Life Loud album's band signed to which label?,Fair Trade Services,Sony Music,0.0,0.0,False,预测答案给出的唱片公司是“Sony Music”，而标准答案是“Fair Trade Services”。两者在语义上完全不同，预测答案没有包含标准答案的关键信息，因此判断为错误。
Who is the child of Sigrid Eskilsdotter's child?,Svante Stensson Sture,Cecilia Månsdotter and Christina Gyllenstierna,0.0,0.0,False,预测答案给出的名字是“Cecilia Månsdotter and Christina Gyllenstierna”，这与标准答案“Svante Stensson Sture”完全不一致。预测答案没有包含标准答案的关键信息，两者在语义上也不等价，因此未能正确回答问题。
What is the record label of the Metalworks Studio founder?,TML Entertainment,Island Records,0.0,0.0,False,预测答案给出的唱片公司是“Island Records”，而标准答案是“TML Entertainment”。两者在语义上完全不同，预测答案未包含标准答案的关键信息，因此判断为错误。
Who is the president of the new country that jointly established a Commission of Truth and Friendship with the country that broadcasts Dahsyat?,Francisco Guterres,Susilo Bambang Yudhoyono,0.0,0.0,False,预测答案“Susilo Bambang Yudhoyono”与标准答案“Francisco Guterres”完全不同。问题询问的是与播出Dahsyat节目的国家共同建立真相与友谊委员会的“新国家”的总统，而预测答案给出的是另一国（印度尼西亚）的总统，因此未包含标准答案的关键信息，语义上也不等价。
How many times did the plague occur in the city where Flora's painter died?,22,3,0.0,0.0,False,预测答案给出的数字是3，而标准答案明确指出瘟疫发生的次数是22。两者在数值上完全不一致，且不存在语义等价的情况，因此预测答案未能正确回答问题。
What is the seat of the county sharing a border with the county in which Valley New School is located?,Green Bay,Braniewo,0.0,0.0,False,预测答案“Braniewo”与标准答案“Green Bay”完全不同，没有包含标准答案的任何关键信息，两者在语义上也不等价，因此未能正确回答问题。
What is the highest city in the state where Dell ranks sixth by revenue?,Fort Davis,Fort Davis,1.0,1.0,True,预测答案“Fort Davis”与标准答案完全一致，包含了标准答案的关键信息，且在语义上完全等价，准确地回答了问题所要求寻找的最高城市。
Who played the girlfriend of who plays marty mcfly's daughter in back to the future 2?,Claudia Wells,Rebcca Sweitzer,0.0,0.0,False,预测答案给出的名字是“Rebcca Sweitzer”，而标准答案为“Claudia Wells”。两者在人物名称上完全不一致，且语义上不等价，因此预测答案未能正确回答问题。
"What specific part of the book where the quote ""by the skin of your teeth"" comes from document reference for Mary?",Genesis 3:15,"The quote ""by the skin of your teeth"" does not come from a book reference for Mary. It is a modern idiom derived from the biblical reference in Job 19:20, not associated with Mary.",0.0,0.10810810810810813,False,预测答案指出该引用出自《约伯记》（Job 19:20），而标准答案明确要求的是《创世记》（Genesis 3:15）。两者在具体的文献出处上完全不一致，因此预测答案未能包含标准答案的关键信息，属于回答错误。
What is the seat of the county sharing a border with the county in which J. P. Hayes was born?,Green Bay,Appleton,0.0,0.0,False,预测答案“Appleton”与标准答案“Green Bay”不一致。两者是不同的城市，预测答案没有包含标准答案的关键信息，在语义上也不等价，因此未能正确回答问题。
How many times did plague occur in the place where Venus with a Mirror's creator died?,22,1,0.0,0.0,False,预测答案给出的数字是1，而标准答案明确指出该地发生瘟疫的次数是22。两者在数值上完全不一致，且语义上也不等价，因此预测答案未能正确回答问题。
What is the source of the river Orlam clans crossed to migrate to Namibia?,Thaba Putsoa,Orange River,0.0,0.0,False,预测答案给出的“Orange River”与标准答案“Thaba Putsoa”在信息内容上完全不同，两者在语义上并不等价，且未包含标准答案的关键信息，因此判断为错误。
"Why was Common Sense, by the same author as Rights of Man, an important work?",crystallized the rebellious demand for independence from Great Britain,"Common Sense was an important work because it was a highly influential pamphlet that crystallized sentiment for American independence in 1776, advocating for a complete break from British rule and promoting republicanism. It was widely read",0.0,0.15686274509803919,True,预测答案包含了标准答案的核心信息，明确指出了《常识》这部作品“crystallized sentiment for American independence”（即凝聚了独立情绪），这与标准答案中的“crystallized the rebellious demand for independence from Great Britain”在语义上完全等价，且提供了更多合理的补充细节，符合正确回答的标准。
In which county was Larkin I. Smith born?,Pearl River County,"Poplarville, Mississippi",0.0,0.0,False,"问题询问的是Larkin I. Smith出生在哪个县，标准答案明确给出了“Pearl River County”。预测答案给出的是“Poplarville, Mississippi”，这是一个城市/城镇名，而不是县名。虽然Poplarville是Pearl River County的县治所在地，但两者在行政级别和语义上并不等价，因此预测答案未能正确回答所问的具体地理层级。"
What movie did the person who acted in the comedy film Crime School win his only Oscar for?,The African Queen,The African Queen,1.0,1.0,True,预测答案与标准答案完全一致，均为“The African Queen”。预测答案包含了标准答案的关键信息，且在语义上完全等价，准确地回答了问题。
with what movie did Mary Philips' husband win his only oscar?,The African Queen,The African Queen,1.0,1.0,True,预测答案与标准答案完全一致，均为“The African Queen”，准确包含了标准答案的关键信息，语义上完全等价，正确地回答了关于Mary Philips丈夫获得唯一奥斯卡奖的电影的问题。
The all time top goal scorer in premier league in one season is a member of what team?,Egypt national football team,Manchester United,0.0,0.0,False,预测答案“Manchester United”与标准答案“Egypt national football team”完全不一致。英超单赛季进球纪录保持者是穆罕默德·萨拉赫，他是埃及国家足球队的成员，而不是曼联的成员，因此预测答案未能包含标准答案的关键信息。
Where is the province of Gonbad-e Qabus County located?,in the north-east of the country south of the Caspian Sea,"Golestan Province, Iran.",0.0,0.0,False,预测答案指出Gonbad-e Qabus County位于伊朗的Golestan省，而标准答案强调其位于该国东北部、里海以南。两者在地理位置的具体描述上存在明显差异，预测答案未包含标准答案的关键信息，且语义不等价。
Who wrote the song turn me on that is performed by performer of Feelin' the Same Way?,John D. Loudermilk,Lee Alexander,0.0,0.0,False,预测答案给出的作者是“Lee Alexander”，而标准答案明确指出该歌曲的作者是“John D. Loudermilk”。两者名字完全不同，且在语义上不等价，因此预测答案未能正确回答问题。
What institute did the actor playing the voice of John Smith in Pocahontas attend?,National Institute of Dramatic Art,National Institute of Dramatic Art (NIDA),0.0,0.8,True,预测答案“National Institute of Dramatic Art (NIDA)”不仅完整包含了标准答案的关键信息，还额外提供了该机构的缩写，两者在语义上完全等价，正确地回答了问题。
Who led the muslim forces to retake the proposed embassy destination?,Abu Ubaidah,Abu Ubaidah,1.0,1.0,True,预测答案“Abu Ubaidah”与标准答案完全一致，包含了标准答案中的关键信息，且在语义上完全等价，准确地回答了所提出的问题。
Which is the body of water near George Mills' place of birth?,River Thames,River Thames,1.0,1.0,True,预测答案“River Thames”与标准答案完全一致，准确包含了问题所需的关键信息，在语义上完全等价，正确地回答了关于George Mills出生地附近水域的问题。
When did the party who gained control of congress in the midterm elections in 1946 take control of the determiner of rules of the US House and US Senate?,January 2015,"November 4, 2014",0.0,0.0,False,"预测答案“November 4, 2014”是选举举行的日期，而标准答案“January 2015”是该政党实际接管并控制美国众议院和参议院规则制定权的日期。两者在语义上并不等价，预测答案未能包含标准答案的关键信息。"
Who does the Nothing Suits Me Like a Suit artist play in Batman Under the Red Hood?,Nightwing / Dick Grayson,Jason Todd,0.0,0.0,False,预测答案给出的角色是“Jason Todd”，而标准答案明确指出该艺术家在《Batman Under the Red Hood》中扮演的角色是“Nightwing / Dick Grayson”。两者是完全不同的角色，预测答案未包含标准答案的关键信息，语义上也不等价，因此判断为错误。
When was the death penalty abolished in the country near the country where the writer of The Book Thief is a citizen of?,1989,1989,1.0,1.0,True,预测答案“1989”与标准答案“1989”完全一致，包含了标准答案的关键信息，且在语义上完全等价，正确地回答了所提出的问题。
What is the seat of the county sharing a border with the county in which Miller Electric is headquartered?,Green Bay,Pécs,0.0,0.0,False,预测答案“Pécs”与标准答案“Green Bay”完全不一致。预测答案没有包含标准答案的关键信息，两者在语义上也不等价，因此预测答案未能正确回答问题。
Who is the brother of the Nothin' My Love Can't Fix performer?,Matthew Lawrence,Joey Lawrence's brother is not mentioned in the provided text.,0.0,0.14285714285714288,False,预测答案未能包含标准答案中的关键信息“Matthew Lawrence”。此外，预测答案声称文本中未提及相关信息，未能给出可核验的具体答案，与标准答案在语义上完全不一致，因此判断为错误。
Who is the brother of the Melissa and Joey Theme Song singer?,Matthew Lawrence,Joey Lawrence,0.0,0.6666666666666666,False,预测答案“Joey Lawrence”与标准答案“Matthew Lawrence”不一致。虽然两人是兄弟，但问题询问的是另一位特定的兄弟，预测答案未能包含标准答案的关键信息。
When was the last time the team that Arthur James was a member of beat the 1894-95 FA cup winner?,1 December 2010,1982,0.0,0.2222222222222222,False,预测答案给出的时间是1982年，而标准答案明确指出该队伍最后一次击败对手的时间是2010年12月1日。两者在年份和具体日期上均不一致，语义上完全不同，因此预测答案未能正确回答问题。
Who started the foundation that developed the Free Software Directory?,Richard Stallman,Richard Stallman,1.0,1.0,True,预测答案“Richard Stallman”与标准答案完全一致，准确地包含了问题所需的关键信息，语义上完全等价，正确地回答了是谁创立了开发Free Software Directory的基金会。
What pantheon is the God of the underworld in ancient Egypt a part of?,ancient Egyptian religion,Egyptian,0.0,0.25,True,预测答案“Egyptian”虽然省略了“ancient”和“religion”等词，但在语境下明确指代了古埃及宗教体系，与标准答案“ancient Egyptian religion”在语义上等价，包含了关键信息。
