Question,Real Answer,Pred Answer,em,f1,glm_correct,glm_reason
Where was the president born on the fourth of July born?,Plymouth Notch,Calvin Coolidge,0.0,0.0,False,预测答案“Calvin Coolidge”回答的是总统的名字，而问题询问的是出生地。标准答案是“Plymouth Notch”，两者在语义上完全不同，预测答案没有包含标准答案的关键信息。
Who play's Marty's girlfriend in back to the future?,Claudia Wells,Claudia Wells,1.0,1.0,True,预测答案“Claudia Wells”与标准答案完全一致，准确包含了问题所需的关键信息，正确回答了谁在《回到未来》中扮演Marty的女朋友这一问题。
What is the record label for the band which performed Pythons?,Kanine Records,Sire Records,0.0,0.5,False,预测答案给出的唱片公司是“Sire Records”，而标准答案是“Kanine Records”。两者在语义上完全不同，预测答案没有包含标准答案的关键信息，因此判断为错误。
Who is the employer of the person Mach's principle was named after?,Charles University,"The question is asking for the employer of the person after whom Mach's principle was named. Mach's principle is named after Ernst Mach, an Austrian physicist and philosopher. The passage does not provide information about Ernst Mach's employer.",0.0,0.0,False,预测答案没有给出“Charles University”这一关键信息，而是明确表示文中没有提供恩斯特·马赫的雇主信息，因此未能正确回答问题。
What is the life expectancy of the type of retriever named after the body of water the Patuxent River turns into?,average lifespan at 9.4 years,12 to 13 years,0.0,0.3333333333333333,False,预测答案给出的寿命是“12 to 13 years”，而标准答案明确指出平均寿命为“9.4 years”。两者在数值上完全不同，语义上存在直接冲突，因此预测答案未能正确回答问题。
Who is the president of the newly declared independent country that is part of the Commission of Truth and Friendship with the country where Sambas is located?,Francisco Guterres,Xanana Gusmão,0.0,0.0,False,预测答案“Xanana Gusmão”与标准答案“Francisco Guterres”是两个不同的人名，预测答案没有包含标准答案的关键信息，两者在语义上不等价，因此未能正确回答问题。
What is the capital of the country it is about?,Aden,Turkey,0.0,0.0,False,预测答案“Turkey”是一个国家名称，而标准答案“Aden”是一个城市（首都）名称。两者在语义上完全不同，预测答案没有包含标准答案的关键信息，因此判断为错误。
The league playing in the Thursday night football game is a type of what?,sports league,football,0.0,0.0,False,预测答案“football”指的是一项体育运动，而标准答案“sports league”指的是体育联盟。两者在语义上并不等价，预测答案未能准确包含标准答案的关键信息，因此判断为错误。
A participant of the Battle of Brechin is an instance of?,Scottish clan,participant of the Battle of Praga,0.0,0.0,False,预测答案“participant of the Battle of Praga”与标准答案“Scottish clan”在语义上完全不同，且未包含标准答案的任何关键信息。预测答案回答的是另一场战役的参与者，未能正确回答问题所要求的实例类别。
What is the symbol of the Saints from the city that is the location of Blanton's manufacturer's headquarters called?,fleur - de-lis,fleur-de-lis,0.0,0.6666666666666666,True,预测答案“fleur-de-lis”与标准答案“fleur - de-lis”在语义上完全等价，唯一的区别仅在于连字符前后的空格差异，属于允许的措辞和格式上的细微差异，包含了标准答案的关键信息。
What mythology is the city where Eutychides was born in a part of?,Greek mythology,Greek mythology,1.0,1.0,True,预测答案“Greek mythology”与标准答案完全一致，包含了标准答案的所有关键信息，且在语义上完全等价，准确地回答了关于Eutychides出生地所属神话体系的问题。
What is the oldest college in the state that contains Borough House Plantation?,College of Charles Towne,College of Charleston,0.0,0.5,True,预测答案“College of Charleston”与标准答案“College of Charles Towne”指代的是同一所高等教育机构。Charleston（查尔斯顿）与Charles Towne（查尔斯镇）是同一地名在不同历史时期的名称，两者在语义上完全等价，属于可接受的措辞差异。
"What county shares a border with the other county, that contains the city, that is the birthplace of the performer of Never Gonna Fall in Love Again?",Cabarrus County,Candelaria municipality,0.0,0.0,False,预测答案“Candelaria municipality”与标准答案“Cabarrus County”完全不一致，既不包含标准答案的关键信息，在语义上也不等价，因此判断为错误。
What city was the author of What We Talk About When We Talk About love born in?,Clatskanie,"Raymond Carver was born in Clatskanie, Oregon.",0.0,0.4,True,预测答案明确指出了《当我们谈论爱情时我们在谈论什么》的作者雷蒙德·卡佛的出生地是Clatskanie，包含了标准答案的关键信息，语义上完全一致，因此判断为正确。
What undertaking included the person who discovered that the number of protons in each element's atoms is unique?,Manhattan Project,Manhattan Project,1.0,1.0,True,预测答案“Manhattan Project”与标准答案完全一致，包含了标准答案的关键信息，且在语义上完全等价，准确地回答了所提出的问题。
What was the story of the character from The Bourne Deception based on?,the novel of the same name by Robert Ludlum,The story of the character from The Bourne Deception is based on the Jason Bourne series created by Robert Ludlum.,0.0,0.41379310344827586,False,预测答案虽然提到了作者Robert Ludlum，但回答的是基于“Jason Bourne系列”，而标准答案明确指出是基于“同名小说”。两者在具体出处上存在明显差异，语义不等价。
Which two features were played up the person who had the biggest net worth in 2017?,ease of use and enhanced support for Plug and Play,The person who had the biggest net worth in 2017 was Bill Gates. The two features played up were his status as the richest man in the world for the 17th time and his role as the,0.0,0.08888888888888888,False,预测答案未能包含标准答案中的关键信息“ease of use and enhanced support for Plug and Play”。此外，预测答案的语句不完整，在列举特征时戛然而止，没有给出可核验的正确答案，因此判断为错误。
"Who is one of the members of the music group that performed ""Good Little Girls""?",Aaron Benward,Tom Hanks,0.0,0.0,False,预测答案给出的信息是“Tom Hanks”，这与标准答案“Aaron Benward”完全不符。Tom Hanks是一名演员，并非演唱“Good Little Girls”的音乐组合的成员，因此预测答案未能正确回答问题。
How many times did plague occur in the place where Bajazet's composer was born?,22,0,0.0,0.0,False,预测答案给出的数字是0，而标准答案明确指出瘟疫发生的次数是22次。两者在数值和语义上完全不一致，因此预测答案未能正确回答问题。
What year did the company that published Starship Command end?,1986,1999,0.0,0.3333333333333333,False,预测答案给出的年份是1999年，而标准答案明确指出该公司结束的年份是1986年。两者在关键信息上完全不一致，且语义上不等价，因此预测答案未能正确回答问题。
Who is the spouse of the child of Peter Andreas Heiberg?,Johanne Luise Heiberg,Baroness Gyllembourg-Ehrensvärd,0.0,0.0,False,预测答案“Baroness Gyllembourg-Ehrensvärd”与标准答案“Johanne Luise Heiberg”不一致。虽然两者都与Peter Andreas Heiberg的家庭有关，但前者是他的配偶，而后者才是他孩子的配偶，因此预测答案未能正确回答问题。
What character in A League of their Own was played by the actress who played Thelma in the movie Thelma and Louise?,Dottie Hinson,Thelma Dickinson,0.0,0.28571428571428575,False,预测答案“Thelma Dickinson”是电影《末路狂花》中Thelma的角色名，而问题问的是该女演员在《红粉联盟》中扮演的角色。标准答案“Dottie Hinson”才是她在该电影中扮演的正确角色，两者语义完全不同。
What is the abbreviated name of the exclusive platform of the video game named for the league with a halftime event just before the publishers clearing house sweepstakes drawing.,NES,NES,1.0,1.0,True,预测答案“NES”与标准答案“NES”完全一致，包含了标准答案的关键信息，且在语义上完全等价，因此预测答案正确地回答了问题。
When was the last time the sports team Alan O'Neil was a member of beat the winner of the 1894-95 FA cup?,1 December 2010,1999,0.0,0.0,False,预测答案“1999”与标准答案“1 December 2010”完全不一致，没有包含标准答案的关键信息，且在语义上无法等价，因此未能正确回答问题。
Who is the spouse of the person who plays Batman in the Lego Batman Movie?,Amy Poehler,Tara Strong,0.0,0.0,False,预测答案给出的名字是“Tara Strong”，而标准答案是“Amy Poehler”。两者在语义上完全不同，且预测答案没有包含标准答案的任何关键信息，因此判断为错误。
By how much of the population of the region where Baton a feu originated reduced by the black death?,30% to 65%,"The region where Bâton à feu originated is France. According to the passage, the Black Death reduced the population of Europe by one third to one half. Therefore, the population of France was reduced by one third to one",0.0,0.049999999999999996,True,预测答案指出该地区（法国）的人口减少了三分之一到二分之一（one third to one half），这与标准答案中的“30% to 65%”在数值范围上高度重合且语义等价，因此判定为正确回答了问题。
When did the explorer reach the headquarters location of the group Con-Test's record label is part of?,"August 3, 1769",1769,0.0,0.5454545454545454,False,"标准答案给出了具体的日期“August 3, 1769”，而预测答案仅给出了年份“1769”，缺失了关键的月份和日期信息。两者在语义上并不完全等价，预测答案未能完整包含标准答案的关键信息。"
What is the name of the castle in the city where the performers of Spirit If.. became a band?,Casa Loma,Casa Loma,1.0,1.0,True,预测答案“Casa Loma”与标准答案完全一致，包含了标准答案中的所有关键信息，且在语义上完全等价，准确地回答了问题中关于城堡名称的询问。
Who wrote a book about growing up in the same nationality as the man who produced The Wild Women of Chastity Gulch?,Min Zhou,Katherine Applegate,0.0,0.0,False,预测答案“Katherine Applegate”与标准答案“Min Zhou”完全不同，两者在语义上不等价，且预测答案未包含标准答案的任何关键信息，因此未能正确回答问题。
Who is the spouse of the actor of Ethan in A Dog's Purpose?,Meg Ryan,Peggy Lipton,0.0,0.0,False,预测答案给出的名字是“Peggy Lipton”，而标准答案是“Meg Ryan”。两者是完全不同的人，预测答案没有包含标准答案的关键信息，在语义上也不等价，因此判断为错误。
Who is the federal leader of the party that Pierre-Hugues Boisvenu is a member of?,Andrew Scheer,Andrew Scheer,1.0,1.0,True,预测答案“Andrew Scheer”与标准答案完全一致，包含了标准答案的关键信息，且在语义上完全等价，准确地回答了关于Pierre-Hugues Boisvenu所在政党联邦领导人的问题。
At what local time does the country where Fuser and Alberto meet the indigenous couple traveling to look for work change their clocks for DST?,24:00,"The country where Fuser and Alberto meet the indigenous couple traveling to look for work is Chile. According to the passage, Chile observes daylight saving time from the second Saturday in October to the second Saturday in March. Therefore, the",0.0,0.0,False,预测答案虽然正确指出了该国家是智利，并提到了夏令时的起止月份，但句子未完整结束，并未给出问题所问的“具体在当地时间几点更改时钟”（即24:00），缺少标准答案的关键信息。
When did the place of birth of the performer of Mother-in-Law elect its first black Mayor?,1970s,2017,0.0,0.5714285714285715,False,预测答案给出的时间是2017年，而标准答案给出的时间是1970s（20世纪70年代）。两者在时间信息上完全不一致，预测答案未能包含标准答案的关键信息，且语义上也不等价，因此判断为错误。
When was the last time Ken Faulkner's team beat the 1894-95 FA Cup winner?,1 December 2010,1944–45 season,0.0,0.0,False,预测答案“1944–45 season”与标准答案“1 December 2010”在时间信息上完全不一致，两者在语义上并不等价，因此预测答案未能正确回答问题。
