Question,Real Answer,Pred Answer
In what region of the country of S-Fone is The place of birth of John Phan located?,South Central Coast,South Central Coast region of Vietnam
"Along with the Closer performer, what notable pop artist started out his career on adult contemporary radio?",Michael Bublé,Josh Groban
The Live Life Loud album's band signed to which label?,Fair Trade Services,BEC Recordings
Who is the child of Sigrid Eskilsdotter's child?,Svante Stensson Sture,Cecilia Månsdotter and Christina Gyllenstierna
What is the record label of the Metalworks Studio founder?,TML Entertainment,Metalworks Institute
Who is the president of the new country that jointly established a Commission of Truth and Friendship with the country that broadcasts Dahsyat?,Francisco Guterres,Susilo Bambang Yudhoyono
How many times did the plague occur in the city where Flora's painter died?,22,3
What is the seat of the county sharing a border with the county in which Valley New School is located?,Green Bay,Appleton
