Question,Real Answer,Pred Answer
Where was the person who acted in the film Sous les pieds des femmes born?,La Goulette,Italy
How many people were in British Colonies where does the london broil cut come from ?,2 million,2 million
Who is the spouse of the person who voices Jarvis in the Avengers Age of Ultron?,Jennifer Connelly,Linda Cardellini
Which county shares a border with the county where the most populous city in the state where Redan High School is located?,Presque Isle County,Fulton County
The rapper who owns Aspiro was inspired by what when writing Song Cry?,three different relationships he had in the past,"Jay-Z was inspired by three different past relationships when writing ""Song Cry."""
What administrative territorial entity includes the place that KTRP is licensed to broadcast to?,Canyon County,"Notus, Idaho"
"In A League of Their Own, who played the husband of the actress who played Thelma in Thelma and Louise?",Bill Pullman,Harvey Keitel
What is the former name of the country where Atika Suri studied?,Dutch East Indies,Indonesia
