Question,Real Answer,Pred Answer
When did the party that gained control of Congress in the midterm elections in 1946 take control of the government branch that determines the rules of the US House?,January 2015,1946
Where did the producer of Julius Caesar study or work?,Clifton College,The Juilliard School
Mehmet Hayri Tarhan's birthplace is the capital of what municipality?,Malko Tarnovo Municipality,Malko Tarnovo
What is the performer of Heartbeat named after?,Natalie Albino,Nina Sky
The author of Elizabeth and After attended which university?,University of Toronto,University of Toronto
What year did the publisher of Labyrinth end?,1986,1986
The food safety system of the agency that has the authority to decide if a drug is marketed otc or prescription is known as?,Food Safety Modernization Act (FSMA),OTC monograph system
Who is the president of the newly declared independent country that has a Commission of Truth and Friendship with the country where Ambelau is located?,Francisco Guterres,José Ramos-Horta
Who was the British general in the battle named after the birth city of the person who recorded Mother-in-Law?,General Edward Pakenham,"General Louis-Joseph de Saint Véran, Marquis de Montcalm"
