Question,Real Answer,Pred Answer
Who is the child of the male star of the 1921 film Money?,Anthony Ainley,<|im_end|>
What is the symbol of the Saints from the headquarters location of Ten High's manufacturer called?,fleur - de-lis,<|im_end|>
Which country has a body of water that was inspiration for the name of the Mara Region?,Tanzania,<|im_end|>
"Along with the subject of The One That Got Away, what notable pop artist started out his career on adult contemporary radio?",Michael Bublé,<|im_end|>
Who is the federal leader of the political party Ken Epp belongs to?,Andrew Scheer,<|im_end|>
Where is the country with ISO code ISO 3166-2:CV located?,central Atlantic Ocean,<|im_end|>
Who did the person portraying Batman in the Justice League movie play in Dazed and Confused?,Fred O'Bannion,<|im_end|>
