Question,Real Answer,Pred Answer,em,f1,glm_correct,glm_reason
In what year was Twilight Princess from the game series on which The Legend of Neil was based originally planned for release?,2005,2005,1.0,1.0,True,预测答案“2005”与标准答案“2005”完全一致，包含了标准答案的关键信息，且在语义上完全等价，准确地回答了关于《黄昏公主》原计划发布年份的问题。
What is the mascot of the school that owns Goss Stadium at Coleman Field?,Benny Beaver,Benny Beaver,1.0,1.0,True,预测答案“Benny Beaver”与标准答案完全一致，准确包含了标准答案的关键信息，且在语义上完全等价，正确地回答了关于学校吉祥物的问题。
Who is the spouse of the actor that plays vision in avengers age of ultron?,Jennifer Connelly,Jennifer Connelly,1.0,1.0,True,预测答案“Jennifer Connelly”与标准答案完全一致，准确包含了标准答案的关键信息，且在语义上完全等价，正确回答了关于《复仇者联盟2：奥创纪元》中幻视扮演者配偶的问题。
Who was the spouse of the leading lady in Gone With the wind?,Laurence Olivier,Clark Gable,0.0,0.0,False,预测答案“Clark Gable”与标准答案“Laurence Olivier”不一致。Clark Gable是电影《乱世佳人》的男主角，而女主角的配偶是Laurence Olivier，因此预测答案未能正确回答问题。
Who was the mother of the person who found the sacred writings that became the Book of Mormon?,Lucy Mack Smith,Lucy Mack Smith,1.0,1.0,True,预测答案“Lucy Mack Smith”与标准答案完全一致，准确包含了标准答案的关键信息，且在语义上完全等价，正确回答了关于找到成为《摩门经》的神圣著作的人的母亲是谁这一问题。
Who is the mayor presiding now where Merrill Elam was born?,Lance Bottoms,Jacek Majchrowski,0.0,0.0,False,预测答案“Jacek Majchrowski”与标准答案“Lance Bottoms”完全不同，两者在语义上没有任何关联。预测答案未能包含标准答案的关键信息，因此未能正确回答问题。
What county shares a border with the county where She Did It's performer was born?,Cabarrus County,Cabarrus County,1.0,1.0,True,预测答案“Cabarrus County”与标准答案完全一致，包含了标准答案的所有关键信息，且在语义上完全等价，准确地回答了所提出的问题。
What is the experimental satellite which was the forerunner to the communication satellite of the operator of GSAT-7 called?,ATS - 6 (Applications Technology Satellite - 6),ATS-6,0.0,0.25,True,预测答案“ATS-6”包含了标准答案的核心关键信息，两者在语义上完全等价。预测答案仅省略了全称及连字符的细微格式差异，但准确传达了相同的卫星名称，符合正确回答的标准。
What watercourse is the river on which the Lostock Dam is located the mouth of?,Hunter River,Paterson River,0.0,0.6666666666666666,False,预测答案给出的水道名称是“Paterson River”，而标准答案为“Hunter River”。两者指代的是完全不同的河流，预测答案未包含标准答案的关键信息，在语义上也不等价，因此判断为错误。
There is a state A where Storm of the Century was filmed based on the book by the author who wrote a short story featuring the author of This Is My God. What is the population of state A?,"1,335,907","Answer: 1,362,359",0.0,0.5714285714285715,False,"预测答案给出的数值为1,362,359，而标准答案为1,335,907。两者在数值上不一致，且不存在语义等价关系，因此预测答案未能正确回答问题。"
What is the capital of the county that shares a border with the county where KRSU is licensed to broadcast?,Green Bay,Potes,0.0,0.0,False,预测答案“Potes”与标准答案“Green Bay”完全不一致，没有包含标准答案的任何关键信息，且两者在语义上并不等价，因此预测答案未能正确回答问题。
Kiwil's birth country participated in a Commission of Truth and Friendship. Who is the president of the other country that participated?,Francisco Guterres,Johan Henri Eliza Ferrier,0.0,0.0,False,预测答案给出的总统是Johan Henri Eliza Ferrier，而标准答案为Francisco Guterres。两者是完全不同的人物，预测答案未包含标准答案的关键信息，因此判断为错误。
Who is the child of the male star of the 1921 film Money?,Anthony Ainley,Aiden Lucas,0.0,0.0,False,预测答案“Aiden Lucas”与标准答案“Anthony Ainley”完全不一致，两者在语义上没有任何等价关系，也没有包含标准答案的任何关键信息，因此预测答案未能正确回答问题。
What is the symbol of the Saints from the headquarters location of Ten High's manufacturer called?,fleur - de-lis,fleur-de-lis,0.0,0.6666666666666666,True,预测答案“fleur-de-lis”与标准答案“fleur - de-lis”在语义上完全等价，仅仅是连字符前后的空格格式存在细微差异，包含了标准答案的所有关键信息，正确回答了问题。
Which country has a body of water that was inspiration for the name of the Mara Region?,Tanzania,Tanzania,1.0,1.0,True,预测答案“Tanzania”与标准答案完全一致，准确包含了标准答案的关键信息，且在语义上完全等价，正确地回答了关于Mara Region命名灵感来源的水体所在国家的问题。
"Along with the subject of The One That Got Away, what notable pop artist started out his career on adult contemporary radio?",Michael Bublé,Josh Groban,0.0,0.0,False,预测答案给出的名字是“Josh Groban”，而标准答案明确指出该著名流行艺术家是“Michael Bublé”。两者是不同的歌手，预测答案没有包含标准答案的关键信息，在语义上也不等价，因此判断为错误。
Who is the federal leader of the political party Ken Epp belongs to?,Andrew Scheer,Answer: The federal leader of the political party Ken Epp belongs to is Andrew Scheer.,0.0,0.33333333333333337,True,预测答案明确指出了Ken Epp所属政党的联邦领袖是Andrew Scheer，包含了标准答案的核心信息，且在语义上与标准答案完全等价，准确回答了问题。
Where is the country with ISO code ISO 3166-2:CV located?,central Atlantic Ocean,"Cape Verde is located in the central Atlantic Ocean, approximately 570 kilometres (350 mi) off the western coast of the African continent, near Senegal, The Gambia, and Mauritania.",0.0,0.1621621621621622,True,预测答案明确指出了ISO 3166-2:CV对应的国家是佛得角，并准确给出了其位于“central Atlantic Ocean”的地理位置信息。这与标准答案的核心内容完全一致，且提供了额外的地理细节，语义上完全等价。
Who did the person portraying Batman in the Justice League movie play in Dazed and Confused?,Fred O'Bannion,"Ben Affleck played Batman in the Justice League movie. In Dazed and Confused, he did not play a role.",0.0,0.0,False,预测答案错误地指出本·阿弗莱克在《年少轻狂》中没有扮演角色，这与标准答案“Fred O'Bannion”相矛盾。预测答案未能包含标准答案的关键信息，且语义上完全不一致。
"In Batman Under the Red Hood, who does the actor of Barney Stinson from How I Met Your Mother play?",Nightwing / Dick Grayson,Neil Patrick Harris plays the role of the adult Dick Grayson (Nightwing) in the animated film Batman: Under the Red Hood.,0.0,0.3076923076923077,True,预测答案明确指出了《老爸老妈的浪漫史》中巴尼·斯廷森的演员是尼尔·帕特里克·哈里斯，并准确回答了他在《蝙蝠侠：红头罩之下》中扮演的角色是迪克·格雷森（夜翼）。这与标准答案完全一致，包含了所有关键信息，语义上完全等价。
"What did the singer of ""Moon River"" in the movie Breakfast at Tiffany win a Tony for?",for Best Performance by a Leading Actress in a Play in Ondine,Best Actor,0.0,0.0,False,预测答案“Best Actor”与标准答案“for Best Performance by a Leading Actress in a Play in Ondine”在语义上完全不一致。标准答案明确指出获奖类别是最佳女主角，且获奖作品为《Ondine》，而预测答案不仅错误地写成了最佳男主角，还遗漏了关键的作品信息。
Where is the headquarter of the Radio Television of the country whose co-official language is the same as the one Politika is written in?,Pristina,Belgrade,0.0,0.0,False,预测答案“Belgrade”与标准答案“Pristina”是两个完全不同的地点。虽然Politika使用的语言是塞尔维亚语，但标准答案明确指出该国家（科索沃）的广播电视台总部位于Pristina，因此预测答案在事实上与标准答案不符。
What is the source of the river of which Kraai River is a tributary?,Thaba Putsoa,Orange River,0.0,0.0,False,预测答案“Orange River”与标准答案“Thaba Putsoa”在字面和语义上均不一致，且“Orange River”并未包含标准答案的关键信息，因此预测答案未能正确回答问题。
Who played the girlfriend of Chance's voice actor in Homeward Bound in Back to the Future?,Claudia Wells,Lea Thompson,0.0,0.0,False,预测答案给出的演员是Lea Thompson，而标准答案是Claudia Wells。两者并非同一人，预测答案没有包含标准答案的关键信息，在语义上也不等价，因此判断为错误。
Who is the voice of the character in Spongebob Squarepants with the same name as the creature that annelid larvae live like?,Mr. Lawrence,Mary Jo Catlett,0.0,0.0,False,预测答案“Mary Jo Catlett”与标准答案“Mr. Lawrence”不一致。Mary Jo Catlett是为《海绵宝宝》中“泡芙老师”配音的演员，而Mr. Lawrence才是为与环节动物幼虫形态相似的生物“海绵”同名的角色“海绵宝宝”配音的演员。因此预测答案错误。
Between which years did war with the person for whom Pyrrhic victory is named occur?,323–272 BC,280 BC to 279 BC,0.0,0.375,False,预测答案给出的年份范围是280 BC到279 BC，而标准答案明确指出战争发生的年份范围是323–272 BC。两者在时间跨度上存在显著差异，预测答案未能包含标准答案的关键信息，且语义上不等价。
MV Miralda's owner announced it was in the process of doing what in April 2010?,trying to find a potential buyer for all of its operations in Finland,selling its interests in four Nigerian oil fields,0.0,0.1904761904761905,False,预测答案提到的是“出售其在四个尼日利亚油田的权益”，而标准答案是“试图为其在芬兰的所有业务寻找潜在买家”。两者在具体出售对象（尼日利亚油田 vs 芬兰业务）和动作（出售权益 vs 寻找买家）上完全不同，语义不一致，因此预测答案未能正确回答问题。
When did the Battle at Choo Hoey's birthplace end?,15 February 1942,1942,0.0,0.5454545454545454,False,预测答案“1942”仅给出了年份，而标准答案明确指出了具体的日期“15 February 1942”。预测答案缺失了月份和具体日期等关键信息，在语义上不够准确和完整，因此不能被判定为正确回答了问题。
Who is the president of the newly declared independent country that is part of the Commission of Truth and Friendship with the country where Sumardi was born?,Francisco Guterres,Answer: Xanana Gusmão,0.0,0.0,False,预测答案“Xanana Gusmão”与标准答案“Francisco Guterres”是两个不同的人名，预测答案未包含标准答案的关键信息，两者在语义上也不等价，因此判断为错误。
Who wrote the song The Story sung by the performer of Give Up the Ghost?,Phil Hanseroth,Brandi Carlile,0.0,0.0,False,预测答案“Brandi Carlile”与标准答案“Phil Hanseroth”不一致。虽然Brandi Carlile是演唱《Give Up the Ghost》和《The Story》的表演者，但该问题的核心是询问《The Story》这首歌的创作者，正确答案应为Phil Hanseroth，因此预测答案未能包含标准答案的关键信息。
Where did they film The Beach in the country where Siddhi Savetsila was born?,Ko Phi Phi Leh,"The Beach was filmed on the Thai island of Ko Phi Phi Le in the country where Siddhi Savetsila was born, Thailand.",0.0,0.21428571428571427,True,预测答案明确指出了电影《The Beach》的拍摄地点是Ko Phi Phi Le，这与标准答案Ko Phi Phi Leh在语义上完全等价，仅存在拼写上的细微差异。此外，预测答案还准确补充了Siddhi Savetsila的出生国泰国，完整且正确地回答了问题。
Who is the author of Growing Up this nationality of the creator MacGruder and Loud?,Min Zhou,Ilyasah Shabazz,0.0,0.0,False,预测答案“Ilyasah Shabazz”与标准答案“Min Zhou”完全不同，两者在语义上不等价，且预测答案未包含标准答案的任何关键信息，因此判断为错误。
In which county did Snappy Tomato Pizza form?,Kenton County,Kentucky,0.0,0.0,False,问题询问的是Snappy Tomato Pizza成立的“县”，标准答案为“Kenton County”（肯顿县），而预测答案“Kentucky”（肯塔基州）是一个州，并非县。两者在地理行政级别和具体信息上均不一致，因此预测答案错误。
What other recognition did the Oscar winner for Best Actor in 2006 receive?,nominated for an Academy Award for Best Supporting Actor,Silver Bear for Best Actor,0.0,0.5,False,预测答案给出的认可是“Silver Bear for Best Actor”（银熊奖最佳男演员），而标准答案是“nominated for an Academy Award for Best Supporting Actor”（获得奥斯卡最佳男配角提名）。两者在语义上完全不同，预测答案未包含标准答案的关键信息。
What is the Smile performer's birthday?,1 January 1986,1 January 1986,1.0,1.0,True,预测答案“1 January 1986”与标准答案完全一致，包含了问题所需的关键信息，语义上完全等价，准确回答了Smile表演者的生日。
What record label does the performer of Emotional Rain belong to?,Attic Records,A&M Records,0.0,0.6666666666666666,False,预测答案给出的唱片公司是“A&M Records”，而标准答案是“Attic Records”。两者是不同的唱片公司名称，在语义上并不等价，且预测答案未包含标准答案的关键信息，因此判断为错误。
When did the majority party in the House of Representatives gain control of the body which approves members of the Cabinet?,January 2015,2014,0.0,0.4444444444444444,False,预测答案给出的时间是2014年，而标准答案明确指出是January 2015。两者在具体时间上存在明显差异，年份并不一致，因此预测答案未能包含标准答案的关键信息，属于错误回答。
What is the manufacturer of the Kentucky Tavern headquarters location saints symbol called?,fleur - de-lis,Sazerac Company,0.0,0.0,False,预测答案给出的“Sazerac Company”是制造商的名称，而问题询问的是总部所在地的象征符号叫什么。标准答案明确指出该符号为“fleur-de-lis”，两者在语义上完全不同，因此预测答案未能正确回答问题。
In which county was Zhu Qinan born?,Yongjia County,Zhejiang,0.0,0.0,False,问题询问的是朱启南出生在哪个县，标准答案明确给出的是“永嘉县”。而预测答案给出的是“浙江”，这是一个省份而非县级的行政区划，没有包含标准答案的关键信息，两者在语义上不等价，因此判断为错误。
Who sings Home Alone Tonight with the Rain is a Good Thing singer?,Karen Fairchild,Karen Fairchild,1.0,1.0,True,预测答案“Karen Fairchild”与标准答案完全一致，包含了标准答案的所有关键信息，且在语义上完全等价，准确地回答了关于与该歌手合唱《Home Alone Tonight》的歌手是谁的问题。
What is the name of the castle in the city where the performer of Never Too Loud was formed?,Casa Loma,Danko Jones,0.0,0.0,False,预测答案“Danko Jones”是表演该曲目的乐队名称，而问题询问的是该乐队所在城市中的一座城堡的名字。标准答案明确指出城堡名为“Casa Loma”，预测答案未包含此关键信息，因此回答错误。
Who is the sibling of the actress that played the little girl in Miracle on 34th street 1947?,Lana Wood,Lucy Kellaway,0.0,0.0,False,预测答案“Lucy Kellaway”与标准答案“Lana Wood”完全不一致。在1947年版《34街的奇迹》中饰演小女孩的演员是娜塔莉·伍德，她的兄弟姐妹是拉娜·伍德，预测答案未包含标准答案的关键信息，因此判断为错误。
What city is the star of 'Three Strangers in Rome' from?,La Goulette,Tunis,0.0,0.0,False,预测答案给出的城市是“Tunis”（突尼斯市），而标准答案明确指出该明星来自“La Goulette”（拉古莱特）。这两个是不同的地名，预测答案没有包含标准答案的关键信息，两者在语义上也不等价，因此判断为错误。
What else happened in the northern part of Erich Zakowski's birthplace in the now Russian area?,names were replaced by new Russian names,"The northern part of Erich Zakowski's birthplace, which is now part of the Russian area (Kaliningrad Oblast), was renamed from Königsberg to Kaliningrad in 1946. The",0.0,0.044444444444444446,True,预测答案指出该地区从Königsberg更名为Kaliningrad，这与标准答案“names were replaced by new Russian names”在语义上完全等价，准确包含了标准答案的关键信息，尽管措辞不同但意思一致。
In which county is Southern Maryland Electric Cooperative headquartered?,Charles County,Charles County,1.0,1.0,True,预测答案“Charles County”与标准答案完全一致，准确地包含了问题所询问的关键信息，语义上完全等价，因此判断为正确。
When did the party that controls the House of Representatives take control of the branch who determines the rules of the US house and Senate?,January 2015,2014,0.0,0.4444444444444444,False,预测答案“2014”与标准答案“January 2015”在时间上不一致。标准答案明确指出是2015年1月，而预测答案给出的是2014年，两者在时间指代上存在明显差异，因此预测答案未能包含标准答案的关键信息，不能被判定为正确。
What series of wins did the sports team that the all time highest goal scorer in spain national team was a member or achieve in 2009?,continental treble,the treble,0.0,0.6666666666666666,True,预测答案“the treble”与标准答案“continental treble”在语义上等价。在足球语境中，特别是指代西班牙国家队历史最佳射手（大卫·比利亚）所在的巴塞罗那队在2009年取得的成就时，“the treble”即特指“continental treble”（洲际三冠王），两者表达的核心信息完全一致。
"In Grown Ups, who plays the wife of the actor who produced The Chosen One?",Joyce Van Patten,Salma Hayek,0.0,0.0,False,预测答案“Salma Hayek”与标准答案“Joyce Van Patten”完全不一致。在电影《Grown Ups》中，Salma Hayek饰演的是Adam Sandler角色的妻子，而Joyce Van Patten才是该问题所指的制片人角色的妻子，因此预测答案未能正确回答问题。
Who does the performer of Don't Be Cruel play in the wire?,a Western District uniformed officer,Bobby Brown,0.0,0.0,False,预测答案“Bobby Brown”指的是歌曲《Don't Be Cruel》的演唱者，而问题询问的是该演唱者在美剧《The Wire》中扮演的角色。标准答案明确指出该角色是“a Western District uniformed officer”，预测答案并未包含此关键信息，两者在语义上完全不等价。
When did Burroughs Corporation merge to form a new corporation?,1986,1986,1.0,1.0,True,预测答案“1986”与标准答案完全一致，准确地给出了Burroughs Corporation合并成立新公司的时间，包含了标准答案的关键信息，语义完全等价。
