Question,Real Answer,Pred Answer,em,f1,glm_correct,glm_reason
Who plays the wife of the producer of Here Comes the Boom in Grown Ups?,Maria Bello,Maggie Gyllenhaal,0.0,0.0,False,预测答案给出的演员是Maggie Gyllenhaal，而标准答案是Maria Bello。两者是完全不同的人，预测答案没有包含标准答案的关键信息，语义上也不等价，因此判断为错误。
What was the person who provided evidence to suggest the existence of the neutron a participant of?,Manhattan Project,Manhattan Project,1.0,1.0,True,预测答案“Manhattan Project”与标准答案完全一致，包含了标准答案的核心关键信息，且在语义上完全等价，准确地回答了提出的问题。
In which borough was Callum McManaman born?,Knowsley,Merseyside,0.0,0.0,False,预测答案“Merseyside”是一个更大的地理范围（都市郡），而标准答案“Knowsley”是一个具体的自治市。虽然Knowsley位于Merseyside内，但预测答案并未包含标准答案的关键信息，且两者在语义上并不等价，因此判断为错误。
Who is the child of the Italian navigator who sailed for England and explored the eastern coast of the continent Francisco Bojado's birthplace is located?,Sebastian Cabot,Sebastian Cabot,1.0,1.0,True,预测答案“Sebastian Cabot”与标准答案完全一致，包含了标准答案的关键信息，且在语义上完全等价，因此正确地回答了问题。
Who is the spouse of the actor who played hannibal smith in the a team?,Sherry Boucher,Joy Patricia Harmon,0.0,0.0,False,预测答案“Joy Patricia Harmon”与标准答案“Sherry Boucher”完全不一致。预测答案没有包含标准答案的关键信息，两者在语义上也不等价，因此预测答案未能正确回答问题。
When was the last time Peter Till's sports team beat the winner of the 1894-95 FA Cup?,1 December 2010,20 March 2005,0.0,0.6153846153846153,False,预测答案给出的日期是“20 March 2005”，而标准答案为“1 December 2010”。两者在时间信息上完全不一致，预测答案未能包含标准答案的关键信息，因此判断为错误。
Who is the child of the cast member of Green Ice?,Tatum O'Neal,Answer: Stuart Epps,0.0,0.0,False,预测答案“Stuart Epps”与标准答案“Tatum O'Neal”完全不同，两者在语义上没有任何等价或包含关系，未能提供问题所要求的关键信息，因此判断为错误。
How many times did plague occur in the birthplace of La Silvia's composer?,22,3,0.0,0.0,False,预测答案给出的数字是3，而标准答案明确指出瘟疫发生的次数是22。两者在数值上完全不一致，且不满足语义等价或包含关键信息的要求，因此预测答案未能正确回答问题。
When did military instruction start at the place where Larry Alcala was educated?,1912,1912,1.0,1.0,True,预测答案“1912”与标准答案完全一致，包含了标准答案的关键信息，且在语义上完全等价，准确地回答了问题所询问的时间，因此判断为正确。
What is the experimental satellite being forerunner to communication satellite of INSAT-4CR's manufacturer called?,ATS - 6 (Applications Technology Satellite - 6),ATS-6,0.0,0.25,True,预测答案“ATS-6”包含了标准答案“ATS - 6 (Applications Technology Satellite - 6)”的核心关键信息。两者在语义上完全等价，预测答案仅仅是省略了全称和空格，符合允许措辞细微差异的判断标准，因此判断为正确。
Who was the first African American student at the university Robert Khayat was educated at?,James Howard Meredith,Robert Robinson Taylor,0.0,0.0,False,预测答案给出的名字是“Robert Robinson Taylor”，而标准答案是“James Howard Meredith”。两者是完全不同的人物，预测答案没有包含标准答案的关键信息，在语义上也不等价，因此未能正确回答该问题。
Who gives out the prize named after the author of Lectures on Jurisprudence?,University of Cambridge,The Royal Society of Chemistry gives out the prize named after the author of *Lectures on Jurisprudence*.,0.0,0.1,False,预测答案给出的颁奖机构是“The Royal Society of Chemistry”（英国皇家化学学会），而标准答案是“University of Cambridge”（剑桥大学）。两者在语义上完全不一致，预测答案未能包含标准答案的关键信息，因此判断为错误。
Who is Frances Freeling Broderip's sibling?,Tom Hood,Tom Hood,1.0,1.0,True,预测答案“Tom Hood”与标准答案完全一致，准确地包含了标准答案中的关键信息，在语义上完全等价，正确地回答了关于Frances Freeling Broderip的兄弟姐妹是谁的问题。
Who is the spouse of the person who voices Jarvis in Iron Man?,Jennifer Connelly,LaTanya Richardson Jackson,0.0,0.0,False,预测答案“LaTanya Richardson Jackson”与标准答案“Jennifer Connelly”完全不同。在电影《钢铁侠》中为贾维斯（Jarvis）配音的演员是保罗·贝坦尼，其配偶是詹妮弗·康纳利，而非拉坦雅·理查森·杰克逊，因此预测答案不正确。
What is the source of the river that is the mouth of the Caledon River?,Thaba Putsoa,The source of the river that is the mouth of the Caledon River is the Great Ruaha River.,0.0,0.0,False,预测答案给出的河流源头是“Great Ruaha River”，而标准答案为“Thaba Putsoa”。两者在关键信息上完全不一致，且语义上不等价，因此预测答案未能正确回答问题。
What is the name of the famous bridge located in the birthplace of the composer of Nulla in mundo pax sincera?,Rialto Bridge,Royal Albert Bridge,0.0,0.3333333333333333,False,预测答案“Royal Albert Bridge”与标准答案“Rialto Bridge”完全不同，两者在语义上不等价，且预测答案未包含标准答案的任何关键信息，因此未能正确回答问题。
When did the party that gained control of Congress in the midterm elections in 1946 take control of the government branch that determines the rules of the US House?,January 2015,1946,0.0,0.0,False,预测答案“1946”与标准答案“January 2015”完全不一致。问题询问的是该政党控制决定众议院规则的政府分支的具体时间，标准答案明确为2015年1月，预测答案未能包含此关键信息，因此判断为错误。
Where did the producer of Julius Caesar study or work?,Clifton College,"John Houseman, the producer of *Julius Caesar* (1953), studied at Clifton College in England and worked in the international grain trade in London before emigrating to the United States in 1",0.0,0.09756097560975609,True,预测答案明确指出了该制片人John Houseman曾在Clifton College学习，包含了标准答案中的核心关键信息，且语义完全一致，因此判定为正确。
Mehmet Hayri Tarhan's birthplace is the capital of what municipality?,Malko Tarnovo Municipality,Izmir,0.0,0.0,False,预测答案“Izmir”与标准答案“Malko Tarnovo Municipality”完全不一致。问题询问的是Mehmet Hayri Tarhan出生地所在的首府对应的市政区，标准答案明确为Malko Tarnovo Municipality，而预测答案给出了一个毫无关联的地名，未能包含标准答案的关键信息，语义上也不等价。
What is the performer of Heartbeat named after?,Natalie Albino,Nina Sky,0.0,0.0,False,预测答案“Nina Sky”是一个音乐组合名称，而标准答案“Natalie Albino”是该组合中具体成员的名字。两者在语义上并不等价，预测答案未包含标准答案的关键信息，因此判断为错误。
The author of Elizabeth and After attended which university?,University of Toronto,University of Toronto,1.0,1.0,True,预测答案“University of Toronto”与标准答案完全一致，包含了标准答案的关键信息，且在语义上完全等价，准确地回答了《Elizabeth and After》作者所就读的大学，符合正确回答的标准。
What year did the publisher of Labyrinth end?,1986,1999,0.0,0.3333333333333333,False,预测答案给出的年份是1999年，而标准答案明确指出该出版商结束的年份是1986年。两者在关键信息上完全不一致，且语义上不等价，因此预测答案未能正确回答问题。
The food safety system of the agency that has the authority to decide if a drug is marketed otc or prescription is known as?,Food Safety Modernization Act (FSMA),FSMA,0.0,0.2857142857142857,True,预测答案“FSMA”是标准答案“Food Safety Modernization Act (FSMA)”的缩写形式，两者在语义上完全等价。预测答案包含了标准答案的核心关键信息，符合评估标准中允许措辞细微差异的要求，因此判断为正确。
Who is the president of the newly declared independent country that has a Commission of Truth and Friendship with the country where Ambelau is located?,Francisco Guterres,José Ramos-Horta,0.0,0.0,False,预测答案“José Ramos-Horta”与标准答案“Francisco Guterres”是两个不同的人名。预测答案没有包含标准答案的关键信息，两者在语义上也不等价，因此未能正确回答该问题。
Who was the British general in the battle named after the birth city of the person who recorded Mother-in-Law?,General Edward Pakenham,Edward Pakenham,0.0,0.888888888888889,True,预测答案“Edward Pakenham”与标准答案“General Edward Pakenham”在语义上完全等价，指向同一位历史人物。预测答案包含了标准答案的核心关键信息，仅仅是省略了头衔“General”，这属于措辞上的细微差异，不影响对问题实质的正确回答。
Where is Sean Hampton's birth place in the state of Florida?,in Northern Florida,"Ocala, Florida",0.0,0.5,False,"预测答案“Ocala, Florida”给出了一个具体的城市，而标准答案是“in Northern Florida”这一区域概念。两者在语义上并不等价，预测答案未能包含标准答案的关键信息，因此判断为错误。"
Who is the president of the group Kim Un-yong is a member of?,Thomas Bach,International Olympic Committee,0.0,0.0,False,预测答案回答的是该组织的名称（International Olympic Committee），而问题询问的是该组织的总统（即主席）是谁。标准答案给出了具体的人名“Thomas Bach”，预测答案在语义上并未包含标准答案的关键信息，因此判断为错误。
"During the war in which The Things They Carried is set, when was conscription introduced by the country where the film Grievous Bodily Harm was later released?",1964,1964,1.0,1.0,True,预测答案“1964”与标准答案“1964”完全一致，包含了标准答案的关键信息，且在语义上完全等价，准确地回答了问题中关于征兵制引入时间的询问。
Who is the president of the new country who has jointly established a Commission on Truth and Friendship with the birth country of Satyo Husodo?,Francisco Guterres,Xanana Gusmão,0.0,0.0,False,预测答案“Xanana Gusmão”与标准答案“Francisco Guterres”是两个不同的人名，预测答案未包含标准答案的关键信息，两者在语义上不等价，因此判断为错误。
Who is the spouse of the current queen of England?,Philip Mountbatten,Philip Mountbatten,1.0,1.0,True,预测答案“Philip Mountbatten”与标准答案完全一致，包含了标准答案的全部关键信息，且在语义上完全等价，因此预测答案正确地回答了问题。
In which year did Taifa of Francisco Giner de los Rios' birthplace cease to exist?,1065,1915,0.0,0.3333333333333333,False,预测答案给出的年份是1915年，而标准答案是1065年。两者在数值和语义上完全不同，预测答案没有包含标准答案的关键信息，因此判断为错误。
What did M. King Hubbert's employer announce it was in the process of doing in April 2010?,trying to find a potential buyer for all of its operations in Finland,selling all of its operations in Finland and conducting market research for its operations in Sweden,0.0,0.5517241379310345,False,预测答案虽然包含了“selling all of its operations in Finland”这一与标准答案在语义上等价的信息，但它额外添加了“conducting market research for its operations in Sweden”的内容。这改变了原意，超出了标准答案的范围，因此不能算作完全正确。
Who did the person considered the founder of three major monotheistic religions marry after the death of Sarah?,Keturah,Keturah,1.0,1.0,True,预测答案“Keturah”与标准答案完全一致，准确包含了标准答案的关键信息，且在语义上完全等价，正确回答了亚伯拉罕在撒拉死后所娶之人的问题。
In what region of the country of S-Fone is The place of birth of John Phan located?,South Central Coast,South Central Coast,1.0,1.0,True,预测答案“South Central Coast”与标准答案完全一致，包含了标准答案的所有关键信息，且在语义上完全等价，准确地回答了问题。
"Along with the Closer performer, what notable pop artist started out his career on adult contemporary radio?",Michael Bublé,Bart Millard,0.0,0.0,False,预测答案给出的名字是“Bart Millard”，而标准答案为“Michael Bublé”。两者并非同一人，预测答案没有包含标准答案的关键信息，在语义上也不等价，因此判断为错误。
The Live Life Loud album's band signed to which label?,Fair Trade Services,Blue Note,0.0,0.0,False,预测答案给出的标签是“Blue Note”，而标准答案是“Fair Trade Services”。两者在语义上完全不同，预测答案没有包含标准答案的任何关键信息，因此判断为错误。
Who is the child of Sigrid Eskilsdotter's child?,Svante Stensson Sture,Christina Gyllenstierna,0.0,0.0,False,预测答案“Christina Gyllenstierna”与标准答案“Svante Stensson Sture”完全不同，没有包含标准答案的关键信息，两者在语义上也不等价，因此未能正确回答问题。
What is the record label of the Metalworks Studio founder?,TML Entertainment,Metalworks Institute,0.0,0.0,False,预测答案“Metalworks Institute”与标准答案“TML Entertainment”完全不同，两者在语义上并不等价，且预测答案未包含标准答案中的任何关键信息，因此未能正确回答该问题。
Who is the president of the new country that jointly established a Commission of Truth and Friendship with the country that broadcasts Dahsyat?,Francisco Guterres,Susilo Bambang Yudhoyono,0.0,0.0,False,预测答案“Susilo Bambang Yudhoyono”与标准答案“Francisco Guterres”完全不同，两者是不同的人物。预测答案没有包含标准答案的关键信息，在语义上也不等价，因此判断为错误。
How many times did the plague occur in the city where Flora's painter died?,22,3,0.0,0.0,False,预测答案给出的数字是3，而标准答案明确指出瘟疫发生的次数是22。两者在数值上完全不一致，且不满足语义等价的要求，因此预测答案未能正确回答问题。
What is the seat of the county sharing a border with the county in which Valley New School is located?,Green Bay,Braniewo,0.0,0.0,False,预测答案“Braniewo”与标准答案“Green Bay”完全不同，没有包含标准答案的任何关键信息，两者在语义上也不等价，因此未能正确回答问题。
What is the highest city in the state where Dell ranks sixth by revenue?,Fort Davis,Fort Davis,1.0,1.0,True,预测答案“Fort Davis”与标准答案完全一致，包含了标准答案的所有关键信息，且在语义上完全等价，准确地回答了所提出的问题。
Who played the girlfriend of who plays marty mcfly's daughter in back to the future 2?,Claudia Wells,"<think>
Okay, let's try to figure out who played the girlfriend of who plays Marty McFly's daughter in Back to the Future 2. 

First, I need to understand the question. The user is asking about the actress who portrayed",0.0,0.0,False,预测答案没有给出任何实质性的回答，仅仅复述了问题并开始了思考过程，未包含标准答案“Claudia Wells”这一关键信息，属于未给出可核验答案的情况。
"What specific part of the book where the quote ""by the skin of your teeth"" comes from document reference for Mary?",Genesis 3:15,Job 19:20,0.0,0.4444444444444445,False,预测答案“Job 19:20”与标准答案“Genesis 3:15”完全不同，两者在文本出处和语义上均不等价，因此预测答案未能正确回答问题。
What is the seat of the county sharing a border with the county in which J. P. Hayes was born?,Green Bay,Appleton,0.0,0.0,False,预测答案“Appleton”与标准答案“Green Bay”是两个完全不同的地理实体，预测答案没有包含标准答案的关键信息，两者在语义上也不等价，因此未能正确回答问题。
How many times did plague occur in the place where Venus with a Mirror's creator died?,22,3,0.0,0.0,False,预测答案给出的数字是3，而标准答案为22。两者在数值上完全不一致，且不满足语义等价的要求，因此预测答案未能正确回答问题。
What is the source of the river Orlam clans crossed to migrate to Namibia?,Thaba Putsoa,Cape Colony,0.0,0.0,False,预测答案给出的“Cape Colony”是奥兰姆人迁徙的出发地，而问题询问的是他们渡过的河流的源头。标准答案明确指出该河流源头是“Thaba Putsoa”，预测答案与标准答案在语义和信息上完全不符，因此判断为错误。
"Why was Common Sense, by the same author as Rights of Man, an important work?",crystallized the rebellious demand for independence from Great Britain,"It was an important work because it crystallized sentiment for independence in 1776, was the most widely read pamphlet of the American Revolution, and contributed significantly to spreading the idea of republicanism and encouraging recruitment for",0.0,0.11999999999999998,True,预测答案包含了标准答案的核心信息，即“crystallized sentiment for independence”（将独立的情绪/诉求明确化），这与标准答案中的“crystallized the rebellious demand for independence”在语义上高度等价。此外，预测答案还补充了该作品在传播共和思想和鼓励参军方面的历史影响，进一步准确回答了其为何重要的原因。
In which county was Larkin I. Smith born?,Pearl River County,Pearl River County,1.0,1.0,True,预测答案“Pearl River County”与标准答案“Pearl River County”完全一致，包含了标准答案的关键信息，且在语义上完全等价，准确地回答了Larkin I. Smith的出生地所在县的问题。
What movie did the person who acted in the comedy film Crime School win his only Oscar for?,The African Queen,The African Queen,1.0,1.0,True,预测答案与标准答案完全一致，均为“The African Queen”。该答案准确包含了标准答案的关键信息，且在语义上完全等价，正确地回答了所提出的问题。
with what movie did Mary Philips' husband win his only oscar?,The African Queen,The African Queen,1.0,1.0,True,预测答案与标准答案完全一致，均为“The African Queen”，准确包含了标准答案的关键信息，语义完全等价，正确地回答了问题。
The all time top goal scorer in premier league in one season is a member of what team?,Egypt national football team,Manchester City,0.0,0.0,False,预测答案“Manchester City”与标准答案“Egypt national football team”在语义上完全不同。英超单赛季进球纪录保持者是穆罕默德·萨拉赫，他是埃及国家足球队的成员，而不是曼彻斯特城队的成员，因此预测答案未包含标准答案的关键信息。
Where is the province of Gonbad-e Qabus County located?,in the north-east of the country south of the Caspian Sea,"Golestan Province, Iran.",0.0,0.0,False,"预测答案“Golestan Province, Iran”指出了Gonbad-e Qabus County所在的国家和省份，但未能包含标准答案中的关键信息，即“in the north-east of the country south of the Caspian Sea”（位于该国东北部、里海以南）。两者在语义上并不等价，因此判断为错误。"
Who wrote the song turn me on that is performed by performer of Feelin' the Same Way?,John D. Loudermilk,Lee Alexander,0.0,0.0,False,预测答案给出的作者是Lee Alexander，而标准答案明确指出该歌曲的作者是John D. Loudermilk。两者在关键信息上不一致，且语义上不等价，因此预测答案未能正确回答问题。
What institute did the actor playing the voice of John Smith in Pocahontas attend?,National Institute of Dramatic Art,National Institute of Dramatic Art (NIDA),0.0,0.8,True,预测答案“National Institute of Dramatic Art (NIDA)”不仅完整包含了标准答案的关键信息，还额外提供了该机构的缩写，两者在语义上完全等价，正确地回答了问题。
Who led the muslim forces to retake the proposed embassy destination?,Abu Ubaidah,Abu Ubayda,0.0,0.5,True,预测答案“Abu Ubayda”与标准答案“Abu Ubaidah”仅存在拼写上的细微差异，属于同一个人名的不同音译或拼写方式。两者在语义上完全等价，且包含了标准答案的关键信息，因此判断为正确。
Which is the body of water near George Mills' place of birth?,River Thames,River Ravensbourne,0.0,0.0,False,预测答案“River Ravensbourne”与标准答案“River Thames”是两个不同的水体名称。预测答案没有包含标准答案的关键信息，两者在语义上也不等价，因此未能正确回答问题。
When did the party who gained control of congress in the midterm elections in 1946 take control of the determiner of rules of the US House and US Senate?,January 2015,"January 3, 2015",0.0,0.8571428571428571,True,"预测答案“January 3, 2015”包含了标准答案“January 2015”的关键信息，且提供了更具体的日期。两者在语义上完全等价，均准确回答了问题，符合允许措辞细微差异的判断标准。"
Who does the Nothing Suits Me Like a Suit artist play in Batman Under the Red Hood?,Nightwing / Dick Grayson,"The Nothing Suits Me Like a Suit artist is not directly associated with the film Batman: Under the Red Hood. Therefore, there is no character in Batman: Under the Red Hood that the artist plays.",0.0,0.0,False,预测答案错误地认为该艺术家与电影《Batman: Under the Red Hood》没有关联，并得出其没有饰演任何角色的结论。这与标准答案相悖，标准答案明确指出该艺术家在电影中饰演了Nightwing / Dick Grayson。因此，预测答案没有包含标准答案的关键信息，语义上也不等价。
When was the death penalty abolished in the country near the country where the writer of The Book Thief is a citizen of?,1989,1989,1.0,1.0,True,预测答案“1989”与标准答案“1989”完全一致，包含了标准答案的关键信息，且在语义上完全等价，因此预测答案正确地回答了问题。
What is the seat of the county sharing a border with the county in which Miller Electric is headquartered?,Green Bay,Pécs,0.0,0.0,False,预测答案“Pécs”与标准答案“Green Bay”完全不一致，两者在语义上没有任何关联，且预测答案未包含标准答案的任何关键信息，因此判定为错误。
Who is the brother of the Nothin' My Love Can't Fix performer?,Matthew Lawrence,Joey Lawrence,0.0,0.6666666666666666,False,预测答案给出的兄弟是Joey Lawrence，而标准答案是Matthew Lawrence。两者是不同的人，预测答案没有包含标准答案的关键信息，语义上也不等价，因此判断为错误。
Who is the brother of the Melissa and Joey Theme Song singer?,Matthew Lawrence,Matthew Lawrence,1.0,1.0,True,预测答案“Matthew Lawrence”与标准答案完全一致，准确包含了问题所需的关键信息，语义上完全等价，正确回答了问题。
When was the last time the team that Arthur James was a member of beat the 1894-95 FA cup winner?,1 December 2010,20 March 2005,0.0,0.6153846153846153,False,预测答案“20 March 2005”与标准答案“1 December 2010”所表示的日期完全不同，两者在语义上不等价，未能包含标准答案的关键信息，因此预测答案不正确。
Who started the foundation that developed the Free Software Directory?,Richard Stallman,Free Software Foundation,0.0,0.0,False,问题询问的是“谁”创立了该基金会，标准答案是具体的人物“Richard Stallman”。预测答案“Free Software Foundation”是一个组织机构，并未回答问题所问的发起人，因此判断为错误。
What pantheon is the God of the underworld in ancient Egypt a part of?,ancient Egyptian religion,Egyptian,0.0,0.25,True,预测答案“Egyptian”虽然省略了“religion”一词，但在语境下明确指代了“古埃及宗教”这一神系，与标准答案在语义上高度等价，包含了关键信息，属于可接受的措辞细微差异。
Where was the president born on the fourth of July born?,Plymouth Notch,"Answer: La Rioja, Argentina",0.0,0.0,False,"预测答案给出的地点是“La Rioja, Argentina”，而标准答案是“Plymouth Notch”。两者在地理位置和语义上完全不同，预测答案没有包含标准答案的任何关键信息，因此判断为错误。"
