Question,Real Answer,Pred Answer,em,f1,glm_correct,glm_reason
In what year was Twilight Princess from the game series on which The Legend of Neil was based originally planned for release?,2005,2005,1.0,1.0,True,预测答案“2005”与标准答案“2005”完全一致，包含了标准答案的关键信息，且在语义上完全等价，准确地回答了问题中关于游戏最初计划发行的年份。
What is the mascot of the school that owns Goss Stadium at Coleman Field?,Benny Beaver,Benny Beaver,1.0,1.0,True,预测答案“Benny Beaver”与标准答案完全一致，包含了标准答案的所有关键信息，在语义上完全等价，准确地回答了关于拥有Goss体育场学校吉祥物的问题。
Who is the spouse of the actor that plays vision in avengers age of ultron?,Jennifer Connelly,Jennifer Connelly,1.0,1.0,True,预测答案“Jennifer Connelly”与标准答案完全一致，包含了标准答案的关键信息，且在语义上完全等价，准确地回答了关于《复仇者联盟2：奥创纪元》中幻视扮演者配偶的问题。
Who was the spouse of the leading lady in Gone With the wind?,Laurence Olivier,Clark Gable,0.0,0.0,False,预测答案“Clark Gable”与标准答案“Laurence Olivier”不一致。虽然Clark Gable是电影《乱世佳人》的男主角，但女主角（费雯·丽）当时的配偶是Laurence Olivier，因此预测答案未能正确回答问题。
Who was the mother of the person who found the sacred writings that became the Book of Mormon?,Lucy Mack Smith,Lucy Mack Smith,1.0,1.0,True,预测答案“Lucy Mack Smith”与标准答案完全一致，准确包含了问题所要求的关键信息，语义上完全等价，正确回答了《摩门经》发现者母亲的名字。
Who is the mayor presiding now where Merrill Elam was born?,Lance Bottoms,Jacek Majchrowski,0.0,0.0,False,预测答案“Jacek Majchrowski”与标准答案“Lance Bottoms”完全不一致，两者是不同的人名，且预测答案未包含标准答案的任何关键信息，因此未能正确回答问题。
What county shares a border with the county where She Did It's performer was born?,Cabarrus County,Rowan County,0.0,0.4,False,预测答案给出的“Rowan County”与标准答案“Cabarrus County”不一致，两者是不同的地理实体，在语义上不等价，因此未能正确回答问题。
What is the experimental satellite which was the forerunner to the communication satellite of the operator of GSAT-7 called?,ATS - 6 (Applications Technology Satellite - 6),ATS-6,0.0,0.25,True,预测答案“ATS-6”包含了标准答案的核心关键信息，且与标准答案“ATS - 6 (Applications Technology Satellite - 6)”在语义上完全等价，仅仅是省略了全称和连字符的细微格式差异，不影响答案的正确性。
What watercourse is the river on which the Lostock Dam is located the mouth of?,Hunter River,Paterson River,0.0,0.6666666666666666,False,预测答案“Paterson River”与标准答案“Hunter River”不一致。虽然Lostock Dam确实位于Paterson River上，但问题询问的是该河流的河口属于哪条水系，正确答案应为Hunter River，因此预测答案未能包含标准答案的关键信息。
There is a state A where Storm of the Century was filmed based on the book by the author who wrote a short story featuring the author of This Is My God. What is the population of state A?,"1,335,907","1,362,359",0.0,0.6666666666666666,False,"预测答案给出的数值是1,362,359，而标准答案的数值是1,335,907。两者在数字上不一致，且不存在语义等价关系，因此预测答案未能正确回答问题。"
What is the capital of the county that shares a border with the county where KRSU is licensed to broadcast?,Green Bay,Potes,0.0,0.0,False,预测答案“Potes”与标准答案“Green Bay”完全不一致，没有包含标准答案的任何关键信息，且两者在语义上也不等价，因此未能正确回答问题。
Kiwil's birth country participated in a Commission of Truth and Friendship. Who is the president of the other country that participated?,Francisco Guterres,Johan Henri Eliza Ferrier,0.0,0.0,False,预测答案给出的姓名是“Johan Henri Eliza Ferrier”，与标准答案“Francisco Guterres”完全不一致，两者在语义上并不等价，因此未能正确回答问题。
Who is the child of the male star of the 1921 film Money?,Anthony Ainley,Richard Ainley,0.0,0.6666666666666666,False,预测答案“Richard Ainley”与标准答案“Anthony Ainley”是两个不同的人名，在语义上并不等价，也没有包含标准答案的关键信息，因此未能正确回答问题。
What is the symbol of the Saints from the headquarters location of Ten High's manufacturer called?,fleur - de-lis,Fleur-de-lis,0.0,0.6666666666666666,True,预测答案“Fleur-de-lis”与标准答案“fleur - de-lis”在语义上完全等价，仅仅是大小写和连字符前后的空格存在细微的格式差异，包含了标准答案的所有关键信息，符合正确回答的标准。
Which country has a body of water that was inspiration for the name of the Mara Region?,Tanzania,Tanzania,1.0,1.0,True,预测答案“Tanzania”与标准答案完全一致，准确地给出了拥有启发Mara Region命名的相关水域的国家，包含了标准答案的关键信息，语义完全等价。
"Along with the subject of The One That Got Away, what notable pop artist started out his career on adult contemporary radio?",Michael Bublé,Josh Groban,0.0,0.0,False,预测答案给出的名字是“Josh Groban”，而标准答案明确指出该著名的流行艺术家是“Michael Bublé”。两者是不同的歌手，预测答案没有包含标准答案的关键信息，在语义上也不等价，因此判断为错误。
Who is the federal leader of the political party Ken Epp belongs to?,Andrew Scheer,Andrew Scheer,1.0,1.0,True,预测答案“Andrew Scheer”与标准答案完全一致，准确包含了问题所需的关键信息，语义上完全等价，因此判断为正确。
Where is the country with ISO code ISO 3166-2:CV located?,central Atlantic Ocean,Cape Verde,0.0,0.0,True,ISO 3166-2:CV 代表的国家是佛得角（Cape Verde）。预测答案给出了具体的国家名称，而标准答案给出的是该国的地理位置（中大西洋）。两者在事实和语义上完全对应，预测答案准确地回答了该ISO代码所对应实体的位置问题。
Who did the person portraying Batman in the Justice League movie play in Dazed and Confused?,Fred O'Bannion,"Ben Affleck portrayed Batman in the Justice League movie. In Dazed and Confused, he played the role of David Wooderson.",0.0,0.0,False,预测答案指出Ben Affleck在《Dazed and Confused》中扮演的角色是David Wooderson，这与标准答案中的Fred O'Bannion不一致，因此预测答案未能包含正确的关键信息。
"In Batman Under the Red Hood, who does the actor of Barney Stinson from How I Met Your Mother play?",Nightwing / Dick Grayson,"Tracy McConnell (""The Mother"")",0.0,0.0,False,预测答案给出的角色是Tracy McConnell，而标准答案是Nightwing / Dick Grayson。两者完全不一致，且Tracy McConnell是《寻妈记》中的角色，并非《蝙蝠侠：红头罩之下》中的角色，因此预测答案未能正确回答问题。
"What did the singer of ""Moon River"" in the movie Breakfast at Tiffany win a Tony for?",for Best Performance by a Leading Actress in a Play in Ondine,Best Actor in a Leading Role,0.0,0.26666666666666666,False,预测答案“Best Actor in a Leading Role”与标准答案不符。标准答案明确指出她凭借戏剧《Ondine》获得了“Best Performance by a Leading Actress in a Play”奖项，而预测答案不仅遗漏了剧名《Ondine》，还错误地将奖项类别写成了“Best Actor”（最佳男主角），而非女主角。因此，预测答案未能包含关键信息且语义不一致。
Where is the headquarter of the Radio Television of the country whose co-official language is the same as the one Politika is written in?,Pristina,Belgrade,0.0,0.0,False,预测答案“Belgrade”与标准答案“Pristina”在语义上并不等价，且未包含标准答案的关键信息。两者是不同的地理位置，因此预测答案未能正确回答问题。
What is the source of the river of which Kraai River is a tributary?,Thaba Putsoa,Orange River,0.0,0.0,False,预测答案给出的河流源头是Orange River，而标准答案明确指出源头应为Thaba Putsoa。两者在核心实体信息上不一致，且不存在语义等价关系，因此预测答案未能正确回答问题。
Who played the girlfriend of Chance's voice actor in Homeward Bound in Back to the Future?,Claudia Wells,Lea Thompson,0.0,0.0,False,预测答案给出的名字是Lea Thompson，而标准答案是Claudia Wells。两者不仅名字不同，且指代的是完全不同的人，预测答案未包含标准答案的关键信息，语义上也不等价，因此判断为错误。
Who is the voice of the character in Spongebob Squarepants with the same name as the creature that annelid larvae live like?,Mr. Lawrence,Mary Jo Catlett,0.0,0.0,False,预测答案“Mary Jo Catlett”与标准答案“Mr. Lawrence”完全不同。Mary Jo Catlett是为《海绵宝宝》中“泡芙老师”配音的演员，而Mr. Lawrence才是为“Larry the Lobster”（龙虾拉里）配音的演员，预测答案未包含标准答案的关键信息。
Between which years did war with the person for whom Pyrrhic victory is named occur?,323–272 BC,280 BC to 272 BC,0.0,0.5,False,预测答案给出的年份范围是“280 BC to 272 BC”，而标准答案为“323–272 BC”。预测答案遗漏了323 BC至281 BC这一时间段，未能包含标准答案的全部关键信息，两者在语义上并不等价，因此判断为错误。
MV Miralda's owner announced it was in the process of doing what in April 2010?,trying to find a potential buyer for all of its operations in Finland,selling its entire retail and commercial fuels business in Ireland,0.0,0.2727272727272727,False,预测答案提到的是在爱尔兰出售零售和商业燃料业务，而标准答案指出的是在芬兰为其所有业务寻找潜在买家。两者涉及的国家（爱尔兰与芬兰）和业务范围完全不同，语义上不一致，因此预测答案未能正确回答问题。
When did the Battle at Choo Hoey's birthplace end?,15 February 1942,1862,0.0,0.18181818181818182,False,预测答案“1862”与标准答案“15 February 1942”完全不符，两者在时间上相差了80年，没有包含标准答案的任何关键信息，因此未能正确回答问题。
Who is the president of the newly declared independent country that is part of the Commission of Truth and Friendship with the country where Sumardi was born?,Francisco Guterres,Xanana Gusmão,0.0,0.0,False,预测答案“Xanana Gusmão”与标准答案“Francisco Guterres”是两个不同的人名，预测答案未包含标准答案的关键信息，两者在语义上也不等价，因此判断为错误。
Who wrote the song The Story sung by the performer of Give Up the Ghost?,Phil Hanseroth,Brandi Carlile,0.0,0.0,False,预测答案“Brandi Carlile”是演唱歌曲《Give Up the Ghost》和《The Story》的表演者，但问题询问的是谁“写了”这首歌。标准答案明确指出歌曲的创作者是Phil Hanseroth，预测答案与标准答案完全不符，因此判断为错误。
Where did they film The Beach in the country where Siddhi Savetsila was born?,Ko Phi Phi Leh,"The Beach was filmed in Thailand, the country where Siddhi Savetsila was born.",0.0,0.0,False,预测答案只回答了电影《The Beach》的拍摄国家（泰国），而没有给出标准答案所要求的具体拍摄地点（Ko Phi Phi Leh）。因此，预测答案缺失了关键信息，未能正确回答问题。
Who is the author of Growing Up this nationality of the creator MacGruder and Loud?,Min Zhou,American,0.0,0.0,False,预测答案“American”回答的是国籍，而标准答案“Min Zhou”是一个具体的人名。两者在语义上完全不同，预测答案未包含标准答案的关键信息，因此判断为错误。
In which county did Snappy Tomato Pizza form?,Kenton County,Kentucky,0.0,0.0,False,问题询问的是Snappy Tomato Pizza在哪个县成立，标准答案明确给出的是“Kenton County”。而预测答案“Kentucky”是一个州，并非县，两者在地理行政级别和具体信息上均不一致，因此预测答案不正确。
What other recognition did the Oscar winner for Best Actor in 2006 receive?,nominated for an Academy Award for Best Supporting Actor,the Silver Bear for Best Actor,0.0,0.5,False,预测答案给出的认可是“the Silver Bear for Best Actor”，而标准答案是“nominated for an Academy Award for Best Supporting Actor”。两者指代的是完全不同的奖项与荣誉，预测答案未包含标准答案的关键信息，语义上也不等价。
What is the Smile performer's birthday?,1 January 1986,1 January 1986,1.0,1.0,True,预测答案“1 January 1986”与标准答案完全一致，包含了标准答案的关键信息，且在语义上完全等价，准确地回答了关于Smile表演者生日的问题。
What record label does the performer of Emotional Rain belong to?,Attic Records,A&M Records,0.0,0.6666666666666666,False,预测答案给出的唱片公司是“A&M Records”，而标准答案为“Attic Records”。两者是不同的唱片公司名称，在语义上不等价，因此预测答案未能正确回答问题。
When did the majority party in the House of Representatives gain control of the body which approves members of the Cabinet?,January 2015,2014,0.0,0.4444444444444444,False,预测答案给出的时间是2014年，而标准答案明确指出是January 2015。两者在具体时间点上存在明显差异，年份并不匹配，因此预测答案未能包含标准答案的关键信息，属于错误回答。
What is the manufacturer of the Kentucky Tavern headquarters location saints symbol called?,fleur - de-lis,Sazerac Company,0.0,0.0,False,预测答案“Sazerac Company”是制造商的名称，而问题询问的是其总部所在地的象征符号名称，标准答案为“fleur-de-lis”。两者语义完全不同，未包含标准答案的关键信息。
In which county was Zhu Qinan born?,Yongjia County,"Wenzhou, Zhejiang",0.0,0.0,False,"问题询问的是朱启南出生在哪个县，标准答案明确给出“永嘉县”。预测答案“Wenzhou, Zhejiang”给出的是地级市和省份，虽然包含永嘉县的地理上级区域，但并未直接回答“县”这一具体行政级别，缺少标准答案的关键信息，因此判断为错误。"
Who sings Home Alone Tonight with the Rain is a Good Thing singer?,Karen Fairchild,Karen Fairchild,1.0,1.0,True,预测答案“Karen Fairchild”与标准答案完全一致，包含了标准答案的全部关键信息，且在语义上完全等价，准确地回答了问题。
What is the name of the castle in the city where the performer of Never Too Loud was formed?,Casa Loma,Danko Jones,0.0,0.0,False,预测答案“Danko Jones”是表演该歌曲的乐队名称，而不是问题所问的城堡名称。标准答案应为“Casa Loma”，预测答案未包含标准答案的关键信息，两者语义完全不同。
Who is the sibling of the actress that played the little girl in Miracle on 34th street 1947?,Lana Wood,Lucy Kellaway,0.0,0.0,False,预测答案“Lucy Kellaway”与标准答案“Lana Wood”完全不一致。在1947年版《34街的奇迹》中饰演小女孩的演员是娜塔莉·伍德，她的兄弟姐妹是拉娜·伍德，预测答案未包含标准答案的关键信息。
What city is the star of 'Three Strangers in Rome' from?,La Goulette,Rome,0.0,0.0,False,预测答案“Rome”与标准答案“La Goulette”完全不同。问题询问的是该明星具体来自哪个城市，标准答案明确为La Goulette，而预测答案给出了错误的地点信息，未能包含标准答案的关键信息，语义上也不等价。
What else happened in the northern part of Erich Zakowski's birthplace in the now Russian area?,names were replaced by new Russian names,"The northern part of Erich Zakowski's birthplace, East Prussia, was annexed by the Soviet Union after World War II and became the Kaliningrad Oblast. The city of Königsberg, where Zak",0.0,0.04347826086956522,False,预测答案虽然提到了该地区被苏联吞并并成为加里宁格勒州，但并未包含标准答案中的核心信息，即“地名被新的俄罗斯名字所取代”。两者在语义上不等价，且预测答案句子未完整，因此判断为错误。
In which county is Southern Maryland Electric Cooperative headquartered?,Charles County,Charles County,1.0,1.0,True,预测答案“Charles County”与标准答案完全一致，准确地包含了问题所要求的关键信息，语义上完全等价，正确地回答了南方马里兰电力合作社总部所在县的问题。
When did the party that controls the House of Representatives take control of the branch who determines the rules of the US house and Senate?,January 2015,2014,0.0,0.4444444444444444,False,预测答案“2014”与标准答案“January 2015”在时间指代上不一致。问题询问的是具体何时取得控制权，标准答案明确为2015年1月，而预测答案给出的2014年与标准答案的关键信息不符，因此判断为错误。
What series of wins did the sports team that the all time highest goal scorer in spain national team was a member or achieve in 2009?,continental treble,"World Cup winners: 2010  
Most consecutive wins including friendlies: 15 (2008–09)  
Most consecutive wins achieved by an international coach from debut: 13 –",0.0,0.0,False,预测答案列举了世界杯冠军、连胜场次等记录，并未包含标准答案中的关键信息“continental treble”（洲际三冠王）。两者在语义上不等价，因此预测答案未能正确回答问题。
"In Grown Ups, who plays the wife of the actor who produced The Chosen One?",Joyce Van Patten,Answer: Salma Hayek,0.0,0.0,False,预测答案“Salma Hayek”与标准答案“Joyce Van Patten”完全不一致。在电影《Grown Ups》中，Salma Hayek饰演的是Adam Sandler角色的妻子，而Joyce Van Patten才是该问题所指的演员的妻子，因此预测答案未能包含标准答案的关键信息。
Who does the performer of Don't Be Cruel play in the wire?,a Western District uniformed officer,Bobby Reed,0.0,0.28571428571428575,False,预测答案“Bobby Reed”给出的是演员的名字，而标准答案“a Western District uniformed officer”是该演员在剧中所扮演的角色。两者在语义上完全不同，预测答案未能包含标准答案的关键信息。
When did Burroughs Corporation merge to form a new corporation?,1986,1986,1.0,1.0,True,预测答案“1986”与标准答案完全一致，准确地给出了Burroughs Corporation合并成立新公司的时间，包含了标准答案的关键信息，语义完全等价。
"When did the country, whose co-official language was used by the director of Group Portrait with a Lady, first attend the Olympics as an independent team?",2016,1920,0.0,0.3333333333333333,False,预测答案给出的年份是1920年，而标准答案明确指出该国家首次作为独立队伍参加奥运会的年份是2016年。两者在关键信息上完全不一致，因此预测答案未能正确回答问题。
Who followed Menucha Rochel Slonim's father?,Menachem Mendel Schneersohn,"Rebbetzin Menucha Rochel Slonim's father was Rabbi Dovber Schneuri, the second Rebbe of the Chabad Hasidic dynasty. After his passing, his role as the Rebbe",0.0,0.13043478260869565,False,预测答案虽然指出了Menucha Rochel Slonim的父亲是谁，但在回答“谁接替了她的父亲”时，句子被截断，没有给出具体的人名。它未能包含标准答案中的关键信息“Menachem Mendel Schneerson”，因此未能正确回答问题。
Who started out his career on adult contemporary radio along with the performer of All That Echoes?,Michael Bublé,Josh Groban,0.0,0.0,False,预测答案“Josh Groban”与标准答案“Michael Bublé”不一致。虽然Josh Groban是专辑《All That Echoes》的表演者，但问题询问的是与他一样在成人当代电台开始职业生涯的另一位艺人，即Michael Bublé。因此预测答案未能包含标准答案的关键信息。
Who is the head of the developer of Simon?,ADM Michael S. Rogers,National Security Agency (NSA),0.0,0.0,False,预测答案“National Security Agency (NSA)”给出的是开发Simon的机构名称，而问题询问的是该机构负责人的名字。标准答案明确指出负责人是“ADM Michael S. Rogers”，预测答案未包含这一关键人物信息，因此未能正确回答问题。
When was the last time the team that Terry Twell was a member of beat the 194-95 winner of the FA Cup?,1 December 2010,1985,0.0,0.0,False,预测答案给出的时间是1985年，而标准答案明确指出是2010年12月1日。两者在时间信息上完全不一致，预测答案未能包含标准答案的关键信息，语义上也不等价，因此判断为错误。
Who is the father of the artist who painted Head I?,Nicholas Bacon,Francis Bacon,0.0,0.3333333333333333,False,预测答案“Francis Bacon”是画作《Head I》的画家本人，而问题询问的是该画家的父亲。标准答案明确指出其父亲是“Nicholas Bacon”，两者在语义上完全不同，因此预测答案未能正确回答问题。
Where is the origin of the river Augrabies Falls is part of?,Thaba Putsoa,Orange River,0.0,0.0,False,预测答案“Orange River”与标准答案“Thaba Putsoa”在信息内容上完全不同，且不包含标准答案的关键信息，两者在语义上不等价，因此未能正确回答问题。
The BBC Footballer of the Year is a member of which team?,Egypt national football team,Manchester United,0.0,0.0,False,预测答案给出的球队是“Manchester United”（曼彻斯特联队），而标准答案是“Egypt national football team”（埃及国家足球队）。两者在语义上完全不同，预测答案没有包含标准答案的关键信息，因此判断为错误。
Where was the person who acted in the film Sous les pieds des femmes born?,La Goulette,"Angers, France",0.0,0.0,False,"预测答案给出的出生地是“Angers, France”，而标准答案为“La Goulette”。两者在语义上完全不同，且预测答案未包含标准答案的任何关键信息，因此判断为错误。"
How many people were in British Colonies where does the london broil cut come from ?,2 million,1.5 million,0.0,0.6666666666666666,False,预测答案给出的数值是1.5 million，而标准答案明确指出为2 million。两者在具体数值上存在明显差异，且语义上不等价，因此预测答案未能正确回答问题。
Who is the spouse of the person who voices Jarvis in the Avengers Age of Ultron?,Jennifer Connelly,Lorraine Ashbourne,0.0,0.0,False,预测答案“Lorraine Ashbourne”与标准答案“Jennifer Connelly”完全不同。在《复仇者联盟2：奥创纪元》中为贾维斯（J.A.R.V.I.S.）配音的演员是保罗·贝坦尼，他的配偶是詹妮弗·康纳利，而非预测答案中给出的名字。因此，预测答案未能包含标准答案的关键信息，属于错误回答。
Which county shares a border with the county where the most populous city in the state where Redan High School is located?,Presque Isle County,Fulton County,0.0,0.3333333333333333,False,预测答案给出的“Fulton County”与标准答案“Presque Isle County”完全不一致，两者在语义上并不等价，且未包含标准答案的关键信息，因此判定为错误。
The rapper who owns Aspiro was inspired by what when writing Song Cry?,three different relationships he had in the past,"Jay-Z was inspired by three different relationships he had in the past when writing ""Song Cry.""",0.0,0.5714285714285715,True,预测答案不仅包含了标准答案的核心信息“three different relationships he had in the past”，还补充了具体的对象“Jay-Z”，在语义上与标准答案完全等价，准确回答了问题。
What administrative territorial entity includes the place that KTRP is licensed to broadcast to?,Canyon County,"Notus, Idaho",0.0,0.0,False,"预测答案“Notus, Idaho”与标准答案“Canyon County”在语义上并不等价，且未包含标准答案的关键信息。Notus是位于爱达荷州的一个城市，而Canyon County是包含该城市的行政区划，两者所指的地理实体层级不同，因此预测答案未能正确回答问题。"
"In A League of Their Own, who played the husband of the actress who played Thelma in Thelma and Louise?",Bill Pullman,Christopher McDonald played the husband of the actress who played Thelma in *Thelma & Louise*.,0.0,0.0,False,预测答案给出了Christopher McDonald，而标准答案是Bill Pullman。虽然Christopher McDonald在《末路狂花》中饰演了Thelma的丈夫，但问题问的是在《红粉联盟》中饰演该女演员丈夫的演员，正确答案应为Bill Pullman。因此预测答案错误。
What is the former name of the country where Atika Suri studied?,Dutch East Indies,Indonesia,0.0,0.0,False,预测答案“Indonesia”是该国现在的名称，而问题明确询问的是“former name”（旧称）。标准答案“Dutch East Indies”才是其历史旧称，两者在语义上并不等价，因此预测答案未能正确回答问题。
