Question,Real Answer,Pred Answer,em,f1,glm_correct,glm_reason
What province shares a border with the province where Lago District is located?,Cabo Delgado Province,"Lago District is located in the Republic of Dagestan, Russia. The province that shares a border with the province where Lago District is located is the Chechen Republic.",0.0,0.0625,False,预测答案错误地指出Lago District位于俄罗斯达吉斯坦共和国，并给出了相邻省份为车臣共和国。实际上，Lago District位于莫桑比克的德尔加杜角省，与标准答案完全不符，因此预测答案是错误的。
Who published Communications of the organization that Andries van Dam is a member of?,Association for Computing Machinery,Association for Computing Machinery (ACM),0.0,0.7499999999999999,True,预测答案“Association for Computing Machinery (ACM)”不仅完整包含了标准答案“Association for Computing Machinery”的所有关键信息，而且在语义上完全等价。括号中的“ACM”仅仅是该组织的常用缩写，不影响核心意思的表达，符合允许措辞细微差异的评判标准。
What county shares a border with Cedar Springs?,Bell County,Guadalupe County,0.0,0.4,False,预测答案给出的县名是“Guadalupe County”，而标准答案是“Bell County”。两者在语义和信息内容上完全不同，预测答案没有包含标准答案的关键信息，因此判断为错误。
What administrative territorial entity is the owner of Ciudad Deportiva located?,Tamaulipas,Nuevo Laredo,0.0,0.0,False,预测答案“Nuevo Laredo”与标准答案“Tamaulipas”不一致。Nuevo Laredo是位于Tamaulipas州内的一个城市，两者属于不同层级的行政领土实体，预测答案未包含标准答案的关键信息，语义上也不等价。
Who is the son of the Italian navigator who explored the eastern coast of the continent Ulises Solís' birthplace is located in for England?,Sebastian Cabot,Sebastian Cabot,1.0,1.0,True,预测答案“Sebastian Cabot”与标准答案完全一致，包含了标准答案的关键信息，且在语义上完全等价，正确地回答了问题。
Who played the monarch at the end of WW2 in The King's Speech?,Colin Firth,Colin Firth,1.0,1.0,True,预测答案“Colin Firth”与标准答案完全一致，准确包含了回答该问题所需的关键信息，语义上完全等价，正确回答了在电影《国王的演讲》中饰演二战结束时的君主的演员是谁。
What is the place of birth of who does the voice of stan on the series that Insecurity is part of?,Denver,South Park,0.0,0.0,False,预测答案“South Park”是剧集的名称，而不是配音演员的出生地。问题询问的是为Stan配音的演员的出生地，标准答案明确指出是“Denver”。因此，预测答案与标准答案在语义上不一致，未包含正确信息。
Where did they film The Beach in the country where Pao Sarasin was born?,Ko Phi Phi Leh,Thailand,0.0,0.0,False,预测答案“Thailand”回答的是电影《海滩》的拍摄所在国家，而问题询问的是在该国家内具体的拍摄地点。标准答案“Ko Phi Phi Leh”是具体的岛屿名称，预测答案并未包含这一关键信息，两者在语义上不等价。
What is the competition that the 1965 Federation Cup is part of named after?,International Tennis Federation,Billie Jean King,0.0,0.0,False,预测答案“Billie Jean King”与标准答案“International Tennis Federation”完全不一致。问题询问的是1965年联合会杯所属赛事的命名来源，标准答案为国际网球联合会，而预测答案给出的是人名，未包含任何关键信息。
Who is the president of the newly declared independent country that is part of the Commission of Truth and Friendship with the country where Kotamadya is located?,Francisco Guterres,Anies Baswedan,0.0,0.0,False,预测答案“Anies Baswedan”与标准答案“Francisco Guterres”完全不同。问题询问的是参与真相与友谊委员会的独立国家（东帝汶）的总统，正确答案应为东帝汶总统Francisco Guterres，而Anies Baswedan是印尼雅加达特区省长，因此预测答案错误。
"In the King's Speech, who played the person who was the King of England in 1950?",Colin Firth,Colin Firth,1.0,1.0,True,预测答案“Colin Firth”与标准答案完全一致，准确地给出了在电影《国王的演讲》中饰演1950年英格兰国王的演员名字，包含了标准答案的关键信息，语义完全等价。
What is the body of water by the area where Athlete was formed?,River Thames,Deptford Creek,0.0,0.0,False,预测答案“Deptford Creek”与标准答案“River Thames”是两个不同的水体名称，不包含标准答案的关键信息，且两者在语义上并不等价，因此未能正确回答问题。
What award did the author of The Happy Journey to Trenton and Camden receive?,Pulitzer Prize for Drama,Thornton Wilder received the Pulitzer Prize for Drama.,0.0,0.5333333333333333,True,预测答案明确指出了《The Happy Journey to Trenton and Camden》的作者Thornton Wilder获得了普利策戏剧奖，包含了标准答案的核心信息，语义上完全等价，正确回答了问题。
Where was the designer of the Lap Engine educated?,University of Glasgow,City College of New York,0.0,0.22222222222222224,False,预测答案“City College of New York”与标准答案“University of Glasgow”完全不同，两者在语义上不等价，且预测答案未包含标准答案的任何关键信息，因此未能正确回答该问题。
Who is the father of the Labo M performer?,Louis Chedid,Louis Chedid,1.0,1.0,True,预测答案“Louis Chedid”与标准答案完全一致，准确地包含了标准答案的关键信息，语义上完全等价，因此正确地回答了问题。
Why did Roncalli leave the place of death of the maker of The Gozzi Altarpiece?,for the conclave in Rome,Roncalli left the place of death of the maker of The Gozzi Altarpiece because he was summoned to the final ballot of the conclave and was elected pope at 4:30 pm.,0.0,0.15,True,预测答案明确指出了Roncalli离开的原因是为了参加教皇选举会议的最终投票，这与标准答案“for the conclave in Rome”在语义上完全一致，包含了核心关键信息，且提供了更具体的细节，符合正确回答的标准。
Who gives out the award named after the person who argued that colonies were redundant?,University of Cambridge,British Empire Part 14,0.0,0.0,False,预测答案“British Empire Part 14”与标准答案“University of Cambridge”在语义上完全不一致，且未包含标准答案的任何关键信息，因此未能正确回答问题。
"In 1990, who became the president of the country that Germany invaded?",Lech Wałęsa,Lech Wałęsa,1.0,1.0,True,预测答案与标准答案完全一致，均为“Lech Wałęsa”。预测答案准确包含了标准答案的关键信息，且在语义上完全等价，正确回答了关于1990年德国入侵的国家（波兰）总统是谁的问题。
What is the name for the mouth of the watercourse of the body of water by Rotterdam Centrum?,Het Scheur,Nieuwe Maas River,0.0,0.0,False,预测答案给出的“Nieuwe Maas River”与标准答案“Het Scheur”在地理实体名称上并不相同。预测答案未能包含标准答案的关键信息，两者在语义上不等价，因此判定为错误。
"Who sings Home Alone Tonight with the singer of ""I Don't Want This Night to End""?",Karen Fairchild,Kurt Russell,0.0,0.0,False,预测答案“Kurt Russell”与标准答案“Karen Fairchild”完全不一致。问题询问的是与Luke Bryan合唱《Home Alone Tonight》的歌手，正确答案应为Little Big Town乐队的Karen Fairchild，而Kurt Russell是一名演员，并非该歌曲的合作者，因此预测答案未能包含正确信息。
What company is the school where Lawrence Landweber was educated a part of?,City University of New York,Purdue University,0.0,0.28571428571428575,False,预测答案“Purdue University”与标准答案“City University of New York”完全不一致。问题询问的是Lawrence Landweber所就读学校所属的公司或机构，预测答案给出了一个错误的机构名称，未能包含标准答案的关键信息，因此判断为错误。
What is the capital of the county that shares a border with the county where WAPL is licensed to broadcast?,Green Bay,Oshkosh,0.0,0.0,False,预测答案“Oshkosh”与标准答案“Green Bay”完全不同，两者在语义上不等价，且预测答案未包含标准答案的任何关键信息，因此判定为错误。
Who was the first black student admitted to where Robert Khayat was educated?,James Howard Meredith,"James Meredith was the first black student admitted to the University of Mississippi, where Robert Khayat was educated.",0.0,0.24,True,预测答案明确指出了“James Meredith”是第一位被录取的黑人学生，这与标准答案“James Howard Meredith”是同一人物。预测答案还补充说明了Robert Khayat毕业的院校，语义与标准答案完全等价，准确回答了问题。
Who did the original voice of the character played by mila kunis in the cleveland show?,Lacey Chabert,Lacey Chabert,1.0,1.0,True,预测答案与标准答案完全一致，均为“Lacey Chabert”。预测答案准确包含了标准答案的关键信息，语义完全等价，正确地回答了关于《克利夫兰秀》中米拉·库尼斯饰演角色的原配音演员是谁的问题。
What is the record label of the co-writer and recording artist of Permission to Fly?,Hollywood Records,Hollywood Records,1.0,1.0,True,预测答案“Hollywood Records”与标准答案完全一致，包含了标准答案的所有关键信息，且在语义上完全等价，准确地回答了关于“Permission to Fly”合作创作者及演唱者所属唱片公司的问题。
What record label is the performer who released All Your Faded Things on?,Kill Rock Stars,Cold Crush Records,0.0,0.0,False,预测答案给出的唱片公司是“Cold Crush Records”，而标准答案是“Kill Rock Stars”。两者在语义上完全不同，预测答案没有包含标准答案的关键信息，因此判断为错误。
What is another notable work made by the author of Miss Sara Sampson?,Emilia Galotti,Emilia Galotti,1.0,1.0,True,预测答案“Emilia Galotti”与标准答案完全一致，准确包含了标准答案的关键信息，且在语义上完全等价，正确地回答了关于《萨拉·萨姆逊小姐》作者另一部著名作品的问题。
When did the majority party in the body which determines rules of the US House and US Senate gain control of the House?,the 2010 election,2010,0.0,0.8571428571428571,True,预测答案“2010”包含了标准答案“the 2010 election”的核心时间信息。两者在语义上完全等价，均准确指出了该政党获得众议院控制权的具体时间，符合允许措辞细微差异的评判标准。
In what year did Margaret Knox's spouse pass away?,1572,1572,1.0,1.0,True,预测答案“1572”与标准答案完全一致，准确地给出了Margaret Knox配偶去世的年份，包含了标准答案的关键信息，语义完全等价，因此判断为正确。
The city where Dmitry Borisovich was born is located where in Russia?,Yaroslavl Oblast,Rostov,0.0,0.0,False,预测答案给出的地点是“Rostov”，而标准答案为“Yaroslavl Oblast”。两者在地理信息和语义上均不一致，预测答案未能包含标准答案的关键信息，因此判断为错误。
What league includes the operating group of Al Janoub Stadium?,Qatar Stars League,Major League Baseball,0.0,0.4,False,预测答案“Major League Baseball”与标准答案“Qatar Stars League”完全不一致。问题询问的是包含Al Janoub Stadium运营团队的联赛，标准答案明确是卡塔尔星级足球联赛，而预测答案给出的是美国职业棒球大联盟，属于完全无关的信息，因此判断为错误。
When was the kingdom that Heptarchy was part of abolished?,918,1974,0.0,0.0,False,预测答案给出的年份是1974，而标准答案为918。两者在数值上完全不同，且在语义上没有任何等价关系，未能包含标准答案的关键信息，因此判断为错误。
What is the average salary of a working person with the same nationality as the producer of The Wild Women of Chastity Gulch?,"$59,039","$47,807",0.0,0.25,False,"预测答案给出的数值为$47,807，而标准答案为$59,039。两者在数值上完全不同，且不存在语义等价关系，因此预测答案未能正确回答问题。"
The city that Psycho Donuts is located in is in which county?,Santa Clara County,Santa Clara County,1.0,1.0,True,预测答案“Santa Clara County”与标准答案完全一致，包含了问题所需的关键信息，语义上完全等价，准确地回答了Psycho Donuts所在城市属于哪个县的问题。
