Question,Real Answer,Pred Answer
Who plays the wife of the producer of Here Comes the Boom in Grown Ups?,Maria Bello,Maggie Gyllenhaal
What was the person who provided evidence to suggest the existence of the neutron a participant of?,Manhattan Project,Manhattan Project
In which borough was Callum McManaman born?,Knowsley,"Whiston, Merseyside"
Who is the child of the Italian navigator who sailed for England and explored the eastern coast of the continent Francisco Bojado's birthplace is located?,Sebastian Cabot,Sebastian Cabot
Who is the spouse of the actor who played hannibal smith in the a team?,Sherry Boucher,George Peppard
When was the last time Peter Till's sports team beat the winner of the 1894-95 FA Cup?,1 December 2010,1982
Who is the child of the cast member of Green Ice?,Tatum O'Neal,Answer: Stuart Epps
How many times did plague occur in the birthplace of La Silvia's composer?,22,1
When did military instruction start at the place where Larry Alcala was educated?,1912,1912
What is the experimental satellite being forerunner to communication satellite of INSAT-4CR's manufacturer called?,ATS - 6 (Applications Technology Satellite - 6),ATS-6
Who was the first African American student at the university Robert Khayat was educated at?,James Howard Meredith,James Meredith
Who gives out the prize named after the author of Lectures on Jurisprudence?,University of Cambridge,The Adam Smith Prize is given out by the Royal Society of Chemistry.
Who is Frances Freeling Broderip's sibling?,Tom Hood,Frances Freeling Broderip's sibling is Tom Hood.
Who is the spouse of the person who voices Jarvis in Iron Man?,Jennifer Connelly,LaTanya Richardson Jackson
What is the source of the river that is the mouth of the Caledon River?,Thaba Putsoa,"The source of the river that is the mouth of the Caledon River is the Lesotho Highlands Water Project delivery tunnel, which discharges into the Ash River."
What is the name of the famous bridge located in the birthplace of the composer of Nulla in mundo pax sincera?,Rialto Bridge,Royal Albert Bridge
When did the party that gained control of Congress in the midterm elections in 1946 take control of the government branch that determines the rules of the US House?,January 2015,1946
Where did the producer of Julius Caesar study or work?,Clifton College,"John Houseman, the producer of Julius Caesar, studied or worked at The Juilliard School, where he became the founding director of the Drama Division and held this position from 1968 until 197"
Mehmet Hayri Tarhan's birthplace is the capital of what municipality?,Malko Tarnovo Municipality,Malko Tarnovo
What is the performer of Heartbeat named after?,Natalie Albino,Nina Sky
The author of Elizabeth and After attended which university?,University of Toronto,University of Toronto
What year did the publisher of Labyrinth end?,1986,1999
The food safety system of the agency that has the authority to decide if a drug is marketed otc or prescription is known as?,Food Safety Modernization Act (FSMA),FDA
Who is the president of the newly declared independent country that has a Commission of Truth and Friendship with the country where Ambelau is located?,Francisco Guterres,José Ramos-Horta
Who was the British general in the battle named after the birth city of the person who recorded Mother-in-Law?,General Edward Pakenham,Edward Pakenham
Where is Sean Hampton's birth place in the state of Florida?,in Northern Florida,Ocala
Who is the president of the group Kim Un-yong is a member of?,Thomas Bach,Thomas Bach
"During the war in which The Things They Carried is set, when was conscription introduced by the country where the film Grievous Bodily Harm was later released?",1964,1964
Who is the president of the new country who has jointly established a Commission on Truth and Friendship with the birth country of Satyo Husodo?,Francisco Guterres,Xanana Gusmão
Who is the spouse of the current queen of England?,Philip Mountbatten,King Charles III
In which year did Taifa of Francisco Giner de los Rios' birthplace cease to exist?,1065,1915
What did M. King Hubbert's employer announce it was in the process of doing in April 2010?,trying to find a potential buyer for all of its operations in Finland,selling its operations in Finland and conducting market research for its operations in Sweden
Who did the person considered the founder of three major monotheistic religions marry after the death of Sarah?,Keturah,Abraham married Keturah after the death of Sarah.
In what region of the country of S-Fone is The place of birth of John Phan located?,South Central Coast,South Central Coast region of Vietnam
"Along with the Closer performer, what notable pop artist started out his career on adult contemporary radio?",Michael Bublé,Josh Groban
The Live Life Loud album's band signed to which label?,Fair Trade Services,BEC Recordings
Who is the child of Sigrid Eskilsdotter's child?,Svante Stensson Sture,Gustav Vasa
What is the record label of the Metalworks Studio founder?,TML Entertainment,Metalworks Institute
Who is the president of the new country that jointly established a Commission of Truth and Friendship with the country that broadcasts Dahsyat?,Francisco Guterres,Susilo Bambang Yudhoyono
How many times did the plague occur in the city where Flora's painter died?,22,3
What is the seat of the county sharing a border with the county in which Valley New School is located?,Green Bay,Appleton
What is the highest city in the state where Dell ranks sixth by revenue?,Fort Davis,Fort Davis
Who played the girlfriend of who plays marty mcfly's daughter in back to the future 2?,Claudia Wells,"Leslie ""Spike"" O'Malley, portrayed by Darlene Vogel, played the girlfriend of Marty McFly's daughter in Back to the Future 2."
"What specific part of the book where the quote ""by the skin of your teeth"" comes from document reference for Mary?",Genesis 3:15,The Gospel of James
What is the seat of the county sharing a border with the county in which J. P. Hayes was born?,Green Bay,Appleton
How many times did plague occur in the place where Venus with a Mirror's creator died?,22,3
What is the source of the river Orlam clans crossed to migrate to Namibia?,Thaba Putsoa,Cape Colony
"Why was Common Sense, by the same author as Rights of Man, an important work?",crystallized the rebellious demand for independence from Great Britain,"Common Sense was an important work because it crystallized sentiment for independence in 1776, contributed significantly to spreading the idea of republicanism, bolstered enthusiasm for separation from Britain, and encouraged recruitment for the Continental Army"
In which county was Larkin I. Smith born?,Pearl River County,Pearl River County
What movie did the person who acted in the comedy film Crime School win his only Oscar for?,The African Queen,The African Queen
with what movie did Mary Philips' husband win his only oscar?,The African Queen,The African Queen
The all time top goal scorer in premier league in one season is a member of what team?,Egypt national football team,Manchester City
Where is the province of Gonbad-e Qabus County located?,in the north-east of the country south of the Caspian Sea,"Golestan Province, Iran."
Who wrote the song turn me on that is performed by performer of Feelin' the Same Way?,John D. Loudermilk,John D. Loudermilk
What institute did the actor playing the voice of John Smith in Pocahontas attend?,National Institute of Dramatic Art,National Institute of Dramatic Art (NIDA)
Who led the muslim forces to retake the proposed embassy destination?,Abu Ubaidah,Abu Ubayda
Which is the body of water near George Mills' place of birth?,River Thames,Deptford
When did the party who gained control of congress in the midterm elections in 1946 take control of the determiner of rules of the US House and US Senate?,January 2015,1946
Who does the Nothing Suits Me Like a Suit artist play in Batman Under the Red Hood?,Nightwing / Dick Grayson,Jared Padalecki
When was the death penalty abolished in the country near the country where the writer of The Book Thief is a citizen of?,1989,1989
What is the seat of the county sharing a border with the county in which Miller Electric is headquartered?,Green Bay,Pécs
Who is the brother of the Nothin' My Love Can't Fix performer?,Matthew Lawrence,Joey Lawrence
Who is the brother of the Melissa and Joey Theme Song singer?,Matthew Lawrence,Matthew Lawrence
When was the last time the team that Arthur James was a member of beat the 1894-95 FA cup winner?,1 December 2010,1986
Who started the foundation that developed the Free Software Directory?,Richard Stallman,Free Software Foundation (FSF)
What pantheon is the God of the underworld in ancient Egypt a part of?,ancient Egyptian religion,Egyptian
Where was the president born on the fourth of July born?,Plymouth Notch,"Answer: La Rioja, Argentina"
Who play's Marty's girlfriend in back to the future?,Claudia Wells,Claudia Wells
What is the record label for the band which performed Pythons?,Kanine Records,Sire Records
Who is the employer of the person Mach's principle was named after?,Charles University,The employer of the person Mach's principle was named after is the Confederation of Finnish Industries.
What is the life expectancy of the type of retriever named after the body of water the Patuxent River turns into?,average lifespan at 9.4 years,12 to 13 years
Who is the president of the newly declared independent country that is part of the Commission of Truth and Friendship with the country where Sambas is located?,Francisco Guterres,Xanana Gusmão
What is the capital of the country it is about?,Aden,Georgetown
The league playing in the Thursday night football game is a type of what?,sports league,American football
A participant of the Battle of Brechin is an instance of?,Scottish clan,Clan Gordon
What is the symbol of the Saints from the city that is the location of Blanton's manufacturer's headquarters called?,fleur - de-lis,fleur-de-lis
What mythology is the city where Eutychides was born in a part of?,Greek mythology,Greek mythology
What is the oldest college in the state that contains Borough House Plantation?,College of Charles Towne,College of Charleston
"What county shares a border with the other county, that contains the city, that is the birthplace of the performer of Never Gonna Fall in Love Again?",Cabarrus County,"Cleveland County, North Carolina shares a border with the county that contains the city of Cleveland, Ohio, which is the birthplace of Eric Carmen, the performer of ""Never Gonna Fall in Love Again."""
What city was the author of What We Talk About When We Talk About love born in?,Clatskanie,"Clatskanie, Oregon"
What undertaking included the person who discovered that the number of protons in each element's atoms is unique?,Manhattan Project,Manhattan Project
What was the story of the character from The Bourne Deception based on?,the novel of the same name by Robert Ludlum,the legendary Bavarian prophet Mühlhiasl
Which two features were played up the person who had the biggest net worth in 2017?,ease of use and enhanced support for Plug and Play,Bill Gates was the person with the biggest net worth in 2017. The two features played up were his position as the richest man in the world for the fourth consecutive year and his long-standing dominance in the list
"Who is one of the members of the music group that performed ""Good Little Girls""?",Aaron Benward,Aaron Benward
How many times did plague occur in the place where Bajazet's composer was born?,22,0
What year did the company that published Starship Command end?,1986,1999
Who is the spouse of the child of Peter Andreas Heiberg?,Johanne Luise Heiberg,Johanne Luise Pätges
What character in A League of their Own was played by the actress who played Thelma in the movie Thelma and Louise?,Dottie Hinson,Dottie Hinson
What is the abbreviated name of the exclusive platform of the video game named for the league with a halftime event just before the publishers clearing house sweepstakes drawing.,NES,NFL
When was the last time the sports team Alan O'Neil was a member of beat the winner of the 1894-95 FA cup?,1 December 2010,1993–94 season
Who is the spouse of the person who plays Batman in the Lego Batman Movie?,Amy Poehler,"<think>
Okay, let's see. The question is asking about the spouse of the person who plays Batman in The Lego Batman Movie. 

First, I need to figure out who voices Batman in that movie. From the passages provided, specifically Passage"
By how much of the population of the region where Baton a feu originated reduced by the black death?,30% to 65%,The Bâton à feu originated in Western Europe. The Black Death reduced the population of Western Europe by an estimated one-third to one-half during the 1347–1351 period. In some of
When did the explorer reach the headquarters location of the group Con-Test's record label is part of?,"August 3, 1769",1769
What is the name of the castle in the city where the performers of Spirit If.. became a band?,Casa Loma,Casa Loma
Who wrote a book about growing up in the same nationality as the man who produced The Wild Women of Chastity Gulch?,Min Zhou,Min Zhou and Carl L. Bankston III
Who is the spouse of the actor of Ethan in A Dog's Purpose?,Meg Ryan,Al
Who is the federal leader of the party that Pierre-Hugues Boisvenu is a member of?,Andrew Scheer,Answer: The federal leader of the party that Pierre-Hugues Boisvenu is a member of is Andrew Scheer.
At what local time does the country where Fuser and Alberto meet the indigenous couple traveling to look for work change their clocks for DST?,24:00,12:00 midnight
When did the place of birth of the performer of Mother-in-Law elect its first black Mayor?,1970s,2008
When was the last time Ken Faulkner's team beat the 1894-95 FA Cup winner?,1 December 2010,1944–45 season
In what year was Twilight Princess from the game series on which The Legend of Neil was based originally planned for release?,2005,2005
What is the mascot of the school that owns Goss Stadium at Coleman Field?,Benny Beaver,"The mascot of the school that owns Goss Stadium at Coleman Field is the ""Beaver."""
Who is the spouse of the actor that plays vision in avengers age of ultron?,Jennifer Connelly,Jennifer Connelly
Who was the spouse of the leading lady in Gone With the wind?,Laurence Olivier,Clark Gable
Who was the mother of the person who found the sacred writings that became the Book of Mormon?,Lucy Mack Smith,Lucy Mack Smith
Who is the mayor presiding now where Merrill Elam was born?,Lance Bottoms,Jacek Majchrowski
What county shares a border with the county where She Did It's performer was born?,Cabarrus County,Rowan County
What is the experimental satellite which was the forerunner to the communication satellite of the operator of GSAT-7 called?,ATS - 6 (Applications Technology Satellite - 6),ATS-6
What watercourse is the river on which the Lostock Dam is located the mouth of?,Hunter River,Paterson River
There is a state A where Storm of the Century was filmed based on the book by the author who wrote a short story featuring the author of This Is My God. What is the population of state A?,"1,335,907","1,362,359"
What is the capital of the county that shares a border with the county where KRSU is licensed to broadcast?,Green Bay,Rochester
Kiwil's birth country participated in a Commission of Truth and Friendship. Who is the president of the other country that participated?,Francisco Guterres,Xanana Gusmão
Who is the child of the male star of the 1921 film Money?,Anthony Ainley,Aiden Lucas
What is the symbol of the Saints from the headquarters location of Ten High's manufacturer called?,fleur - de-lis,fleur-de-lis
Which country has a body of water that was inspiration for the name of the Mara Region?,Tanzania,Tanzania
"Along with the subject of The One That Got Away, what notable pop artist started out his career on adult contemporary radio?",Michael Bublé,Josh Groban
Who is the federal leader of the political party Ken Epp belongs to?,Andrew Scheer,Andrew Scheer
Where is the country with ISO code ISO 3166-2:CV located?,central Atlantic Ocean,"Cape Verde is located in the central Atlantic Ocean, approximately 570 kilometres (350 mi) off the western coast of the African continent, near Senegal, The Gambia, and Mauritania."
Who did the person portraying Batman in the Justice League movie play in Dazed and Confused?,Fred O'Bannion,"Ben Affleck played the role of Randall ""Pink"" Floyd in *Dazed and Confused*."
"In Batman Under the Red Hood, who does the actor of Barney Stinson from How I Met Your Mother play?",Nightwing / Dick Grayson,Jason Todd / Red Hood
"What did the singer of ""Moon River"" in the movie Breakfast at Tiffany win a Tony for?",for Best Performance by a Leading Actress in a Play in Ondine,Best Actor in 1950
Where is the headquarter of the Radio Television of the country whose co-official language is the same as the one Politika is written in?,Pristina,Belgrade
What is the source of the river of which Kraai River is a tributary?,Thaba Putsoa,Orange River
Who played the girlfriend of Chance's voice actor in Homeward Bound in Back to the Future?,Claudia Wells,Lea Thompson
Who is the voice of the character in Spongebob Squarepants with the same name as the creature that annelid larvae live like?,Mr. Lawrence,Mary Jo Catlett
Between which years did war with the person for whom Pyrrhic victory is named occur?,323–272 BC,280 BC to 272 BC
MV Miralda's owner announced it was in the process of doing what in April 2010?,trying to find a potential buyer for all of its operations in Finland,selling its operations in Finland and conducting market research for its operations in Sweden
When did the Battle at Choo Hoey's birthplace end?,15 February 1942,The Battle of Palembang ended on 15 February 1942.
Who is the president of the newly declared independent country that is part of the Commission of Truth and Friendship with the country where Sumardi was born?,Francisco Guterres,Juscelino de Figueiredo (acting)
Who wrote the song The Story sung by the performer of Give Up the Ghost?,Phil Hanseroth,Brandi Carlile
