example_id,query_idx,query_type,source_example,source_sub,query,doc_len,selected_count
17,0,related,17,-1,"In the King's Speech, who played the person who was the King of England in 1950?",2098,314
17,1,related,17,0,Who was the King of England in 1950?,2098,314
17,2,related,17,1,Which actor played King George VI in the film 'The King's Speech'?,2098,314
17,3,unrelated,37,1,"Based on Nannina de' Medici's parents Piero di Cosimo de' Medici and Lucrezia Tornabuoni, who were her siblings?",2098,314
17,4,unrelated,12,1,Which company did Compaq merge with in 2002?,2098,314
17,5,unrelated,38,0,Where is NRHEG High School located?,2098,314
17,6,unrelated,47,3,Jennifer Saunders married to,2098,314
17,7,unrelated,78,1,What award did Patrick Modiano receive?,2098,314
17,8,unrelated,4,1,When was King Henry III of England crowned?,2098,314
17,9,unrelated,55,-1,"What is the movie starring Preity Zinta, Madhuri Dixit and the spouse of Kajol?",2098,314
17,10,unrelated,58,0,Where was James Finch born?,2098,314
17,11,unrelated,62,2,Birthplace of Saint Joseph biblical figure,2098,314
17,12,unrelated,4,0,"Who were the siblings of Alice de Lusignan, Countess of Surrey?",2098,314
17,13,unrelated,38,1,"Which county is New Richland, Minnesota located in?",2098,314
17,14,unrelated,76,0,Who is a former member of The Sunnyboys?,2098,314
17,15,unrelated,14,-1,Who is the sibling of the actress that played the little girl in Miracle on 34th street 1947?,2098,314
17,16,unrelated,29,3,What is Adam Hammill's most recent team?,2098,314
17,17,unrelated,39,1,Who founded the Janatha Vimukthi Peramuna political party?,2098,314
17,18,unrelated,49,1,Where did Malcolm Graham die?,2098,314
17,19,unrelated,45,1,Who was the father of Yang Pu (Emperor Rui of Wu)?,2098,314
17,20,unrelated,16,1,What company did Compaq merge with in 2002?,2098,314
17,21,unrelated,1,-1,What district is the headquarter of Julia's House located?,2098,314
17,22,unrelated,5,1,What company did Compaq merge with in 2002?,2098,314
17,23,unrelated,62,-1,What is the birthplace of the person after whom São José dos Campos was named?,2098,314
17,24,unrelated,5,0,What does CEMM stand for?,2098,314
17,25,unrelated,8,0,Who performed the song 'The Place and the Time'?,2098,314
17,26,unrelated,28,0,Who played the fairy godmother in Shrek 2?,2098,314
17,27,unrelated,58,1,"Which county is Lynn Haven, Florida located in?",2098,314
17,28,unrelated,73,1,Is the animated series 'Steven Universe' currently ongoing with scheduled future episodes?,2098,314
17,29,unrelated,26,-1,Who played the monarch at the end of WW2 in The King's Speech?,2098,314
17,30,unrelated,37,0,Who were the parents of Nannina de' Medici?,2098,314
17,31,unrelated,50,2,When was John's eldest son crowned?,2098,314
17,32,unrelated,10,1,Which organization did George Packer volunteer for?,2098,314
17,33,unrelated,77,0,Where did Richard Feynman work on the Water Boiler reactor?,2098,314
17,34,unrelated,22,0,Who performed the song 'Be the One'?,2098,314
18,0,related,18,-1,Whose sister played Susie in miracle on 34th street?,1546,231
18,1,related,18,0,Who played Susie in Miracle on 34th Street?,1546,231
18,2,related,18,1,Who is Natalie Wood's brother?,1546,231
18,3,unrelated,41,3,Which football players have played for West Ham United?,1546,231
18,4,unrelated,7,1,Who was Ernst Mach's employer or academic institution during his career?,1546,231
18,5,unrelated,57,-1,In which district was Ernie Watts born?,1546,231
18,6,unrelated,71,-1,Who is the voice of the character in Spongebob Squarepants with the same name as the creature that annelid larvae live like?,1546,231
18,7,unrelated,51,-1,What character in A League of their Own was played by the actress who played Thelma in the movie Thelma and Louise?,1546,231
18,8,unrelated,17,0,Who was the King of England in 1950?,1546,231
18,9,unrelated,78,1,What award did Patrick Modiano receive?,1546,231
18,10,unrelated,48,2,Where did Ernst Mach work as a professor?,1546,231
18,11,unrelated,79,2,What is the cast list for the movie 'Yeh Raaste Hain Pyaar Ke'?,1546,231
18,12,unrelated,41,-1,Who has played for West Ham Ajax and the team that David Currie plays for?,1546,231
18,13,unrelated,39,0,What is the name of the political party of Dimuthu Bandara Abayakoon?,1546,231
18,14,unrelated,67,3,Rabat Ajax F.C. Maltese Premier League current,1546,231
18,15,unrelated,20,-1,What is the record label for the singer who originally sang You Belong To Me.,1546,231
18,16,unrelated,42,3,Who is the spouse of the creator of Absolutely Fabulous?,1546,231
18,17,unrelated,23,1,"When did Richard I, King of England, depart for the Holy Land on the Third Crusade?",1546,231
18,18,unrelated,11,1,Who is the lead singer of the band Art Brut?,1546,231
18,19,unrelated,22,1,Which artists have performed a song titled 'Be the One'?,1546,231
18,20,unrelated,24,-1,What record label does the artist who sang you belong to me belong to?,1546,231
18,21,unrelated,48,-1,Who is the employer of the person Mach's principle was named after?,1546,231
18,22,unrelated,11,-1,Who is the lead singer of the band performing Bang Bang Rock & Roll?,1546,231
18,23,unrelated,6,-1,Which university employed the person that Mach bands are named after?,1546,231
18,24,unrelated,62,-1,What is the birthplace of the person after whom São José dos Campos was named?,1546,231
18,25,unrelated,9,1,What specific naval expedition or fleet did King Richard I lead that was dispersed by a storm?,1546,231
18,26,unrelated,54,-1,"The actor who played Thelma in ""Thelma and Louise"" also played which character in ""A League of Their Own""?",1546,231
18,27,unrelated,52,0,Who played Thelma in Thelma and Louise?,1546,231
18,28,unrelated,67,1,What league does Rabat Ajax F.C. currently compete in?,1546,231
18,29,unrelated,19,1,What team did Kris Benson play for in Major League Baseball?,1546,231
18,30,unrelated,62,1,Where was Saint Joseph (São José) born?,1546,231
18,31,unrelated,54,1,Which character did Geena Davis play in the movie 'A League of Their Own'?,1546,231
18,32,unrelated,23,-1,What month did the person who retained trust in Longchamp go away to the Holy Land?,1546,231
18,33,unrelated,63,0,Where was Snappy Tomato Pizza founded?,1546,231
18,34,unrelated,23,0,Who was the person who retained trust in Longchamp and went to the Holy Land?,1546,231
19,0,related,19,-1,What team was Anna Benson's husband on?,2150,322
19,1,related,19,0,Who is Anna Benson's husband?,2150,322
19,2,related,19,1,What team did Kris Benson play for in Major League Baseball?,2150,322
19,3,unrelated,45,-1,Who is the father of Empress Wang's husband?,2150,322
19,4,unrelated,62,3,Who was the person São José dos Campos was named after?,2150,322
19,5,unrelated,65,1,Which character did Geena Davis play in the movie A League of Their Own?,2150,322
19,6,unrelated,18,0,Who played Susie in Miracle on 34th Street?,2150,322
19,7,unrelated,8,-1,What record label did the performer of The Place and the Time belong to?,2150,322
19,8,unrelated,34,-1,Who is the child of the person who followed Tihomir of Serbia?,2150,322
19,9,unrelated,50,1,When was John's eldest son crowned?,2150,322
19,10,unrelated,50,2,When was John's eldest son crowned?,2150,322
19,11,unrelated,28,1,Who is Jennifer Saunders' spouse?,2150,322
19,12,unrelated,51,0,Who played Thelma in Thelma and Louise?,2150,322
19,13,unrelated,66,-1,What political party was the socialist candidate part of who ran for president in 1912?,2150,322
19,14,unrelated,1,-1,What district is the headquarter of Julia's House located?,2150,322
19,15,unrelated,73,1,Is the animated series 'Steven Universe' currently ongoing with scheduled future episodes?,2150,322
19,16,unrelated,12,0,Which company initiated a successful price war among PC manufacturers in 1994?,2150,322
19,17,unrelated,28,3,Who is the spouse of the actress who played the fairy god mother in Shrek 2?,2150,322
19,18,unrelated,54,1,Which character did Geena Davis play in the movie 'A League of Their Own'?,2150,322
19,19,unrelated,29,2,What teams did Adam Hammill play for after 2013?,2150,322
19,20,unrelated,15,-1,What is the capital of the county that Pine Springs is located in?,2150,322
19,21,unrelated,14,0,Who played the little girl in the 1947 film Miracle on 34th Street?,2150,322
19,22,unrelated,49,2,Where did Malcolm Graham die?,2150,322
19,23,unrelated,20,-1,What is the record label for the singer who originally sang You Belong To Me.,2150,322
19,24,unrelated,9,0,Which English king trusted William de Longchamp?,2150,322
19,25,unrelated,47,0,Who sang Holding Out for a Hero in Shrek 2?,2150,322
19,26,unrelated,28,0,Who played the fairy godmother in Shrek 2?,2150,322
19,27,unrelated,14,1,Who is the sibling of actress Natalie Wood?,2150,322
19,28,unrelated,72,-1,Who is part of the band that performed Full Cooperation?,2150,322
19,29,unrelated,7,0,Who is the physicist that the Mach number is named after?,2150,322
19,30,unrelated,68,1,"Which county does Eldon, Missouri belong to?",2150,322
19,31,unrelated,50,3,When was John's eldest son crowned?,2150,322
19,32,unrelated,73,3,Has the series Steven Universe ended?,2150,322
19,33,unrelated,0,-1,What is the network which National Cycle Route 57 is part of an example of?,2150,322
19,34,unrelated,5,0,What does CEMM stand for?,2150,322
