example_id,query_idx,query_type,source_example,source_sub,query,doc_len,selected_count
0,0,related,0,-1,What is the network which National Cycle Route 57 is part of an example of?,1171,175
0,1,related,0,0,What network is National Cycle Route 57 part of?,1171,175
0,2,unrelated,36,1,"Which county is Greenfield, Indiana located in?",1171,175
0,3,unrelated,4,1,When was King Henry III of England crowned?,1171,175
0,4,unrelated,49,2,Where did Malcolm Graham die?,1171,175
0,5,unrelated,22,-1,What group was the performer of Be the One a member of?,1171,175
0,6,unrelated,3,0,Who is the child of Peter Andreas Heiberg?,1171,175
0,7,unrelated,28,-1,Who is the spouse of the actress who played the fairy god mother in Shrek 2?,1171,175
0,8,unrelated,73,-1,When is the next episode of the series that Steven the Sword Fighter is a part of being released?,1171,175
0,9,unrelated,78,-1,What award was received by the person who authored Missing Person?,1171,175
0,10,unrelated,17,-1,"In the King's Speech, who played the person who was the King of England in 1950?",1171,175
0,11,unrelated,19,-1,What team was Anna Benson's husband on?,1171,175
0,12,unrelated,42,2,Who is the spouse of Jennifer Saunders?,1171,175
0,13,unrelated,2,0,Where is Coffee Swamp located?,1171,175
0,14,unrelated,77,0,Where did Richard Feynman work on the Water Boiler reactor?,1171,175
0,15,unrelated,11,1,Who is the lead singer of the band Art Brut?,1171,175
0,16,unrelated,31,0,Which university did Paulo Manalo attend?,1171,175
0,17,unrelated,67,2,Rabat Ajax F.C. current league,1171,175
0,18,unrelated,33,-1,What administrative territorial entity contains the place where KPRM is licensed to broadcast to?,1171,175
0,19,unrelated,71,-1,Who is the voice of the character in Spongebob Squarepants with the same name as the creature that annelid larvae live like?,1171,175
0,20,unrelated,37,-1,Who was the sibling of Nannina de' Medici?,1171,175
0,21,unrelated,64,0,Who is the publisher of In the Shadow of Greatness?,1171,175
0,22,unrelated,65,0,Who played Thelma in the movie Thelma and Louise?,1171,175
0,23,unrelated,62,-1,What is the birthplace of the person after whom São José dos Campos was named?,1171,175
0,24,unrelated,27,1,Who is Harry Hamlin's spouse?,1171,175
0,25,unrelated,30,-1,Who is the spouse of Young Man Luther's author?,1171,175
0,26,unrelated,25,0,What is the administrative territorial entity that contains Juba?,1171,175
0,27,unrelated,61,0,Who is the spouse of Frances Tupper?,1171,175
0,28,unrelated,43,-1,What county shares a border with Cedar Springs?,1171,175
0,29,unrelated,39,1,Who founded the Janatha Vimukthi Peramuna political party?,1171,175
0,30,unrelated,49,0,In which city did Malcolm Graham die?,1171,175
0,31,unrelated,77,-1,Who was the US physicist who directed the project that developed the first atomic bomb at the same place where Feynman worked on Water Boiler?,1171,175
0,32,unrelated,58,0,Where was James Finch born?,1171,175
0,33,unrelated,36,0,Where was Mark Dismore born?,1171,175
1,0,related,1,-1,What district is the headquarter of Julia's House located?,1205,180
1,1,related,1,0,Where is the headquarters of Julia's House located?,1205,180
1,2,unrelated,75,0,Who was the candidate that received a million votes in the 1920 election while in prison?,1205,180
1,3,unrelated,52,1,Which character did Geena Davis play in the film A League of Their Own?,1205,180
1,4,unrelated,22,2,Was Jackie Jackson a member of a musical group?,1205,180
1,5,unrelated,47,-1,Who is the spouse of the person who sang holding out for a hero in shrek 2?,1205,180
1,6,unrelated,11,-1,Who is the lead singer of the band performing Bang Bang Rock & Roll?,1205,180
1,7,unrelated,69,1,Which record label is Zendaya signed to?,1205,180
1,8,unrelated,56,-1,The territory containing Bansaan Island is located at which island?,1205,180
1,9,unrelated,66,-1,What political party was the socialist candidate part of who ran for president in 1912?,1205,180
1,10,unrelated,13,0,Who is Katherine of England?,1205,180
1,11,unrelated,13,-1,What year was the father of Katherine of England crowned?,1205,180
1,12,unrelated,45,-1,Who is the father of Empress Wang's husband?,1205,180
1,13,unrelated,36,-1,In which county is Mark Dismore's birthplace located?,1205,180
1,14,unrelated,27,0,Who are the cast members of King of the Mountain?,1205,180
1,15,unrelated,32,1,Who played King George VI in the film 'The King's Speech'?,1205,180
1,16,unrelated,35,1,What year did Andrew Lang die?,1205,180
1,17,unrelated,19,0,Who is Anna Benson's husband?,1205,180
1,18,unrelated,4,0,"Who were the siblings of Alice de Lusignan, Countess of Surrey?",1205,180
1,19,unrelated,44,2,Which counties border Hastings County in Ontario?,1205,180
1,20,unrelated,51,-1,What character in A League of their Own was played by the actress who played Thelma in the movie Thelma and Louise?,1205,180
1,21,unrelated,78,-1,What award was received by the person who authored Missing Person?,1205,180
1,22,unrelated,72,-1,Who is part of the band that performed Full Cooperation?,1205,180
1,23,unrelated,48,-1,Who is the employer of the person Mach's principle was named after?,1205,180
1,24,unrelated,48,0,Who is Mach's principle named after?,1205,180
1,25,unrelated,52,0,Who played Thelma in Thelma and Louise?,1205,180
1,26,unrelated,27,-1,Who is the spouse of a cast member from King of the Mountain?,1205,180
1,27,unrelated,60,-1,Who is the other child of Chian Hsiao-chang's father?,1205,180
1,28,unrelated,13,1,What year was King Henry III of England crowned?,1205,180
1,29,unrelated,53,-1,Who is the child of Chiang Hsiao-wen's father?,1205,180
1,30,unrelated,57,0,Where was Ernie Watts born?,1205,180
1,31,unrelated,14,-1,Who is the sibling of the actress that played the little girl in Miracle on 34th street 1947?,1205,180
1,32,unrelated,49,-1,Who has played for West Ham Ajax and the team from the city where Malcolm Graham died?,1205,180
1,33,unrelated,73,0,What series is Steven the Sword Fighter a character in?,1205,180
2,0,related,2,-1,What body of water includes the terrain feature where Coffee Swamp is located?,1377,206
2,1,related,2,0,Where is Coffee Swamp located?,1377,206
2,2,unrelated,61,-1,Where was the spouse of Frances Tupper born?,1377,206
2,3,unrelated,67,0,Which team uses the Rabat Ajax Football Ground?,1377,206
2,4,unrelated,24,1,What record label is Joni James signed to?,1377,206
2,5,unrelated,5,1,What company did Compaq merge with in 2002?,1377,206
2,6,unrelated,49,3,Where did Malcolm Graham die?,1377,206
2,7,unrelated,51,-1,What character in A League of their Own was played by the actress who played Thelma in the movie Thelma and Louise?,1377,206
2,8,unrelated,18,1,Who is Natalie Wood's brother?,1377,206
2,9,unrelated,51,0,Who played Thelma in Thelma and Louise?,1377,206
2,10,unrelated,36,-1,In which county is Mark Dismore's birthplace located?,1377,206
2,11,unrelated,25,0,What is the administrative territorial entity that contains Juba?,1377,206
2,12,unrelated,46,0,Who was the king of England in 1951?,1377,206
2,13,unrelated,17,1,Which actor played King George VI in the film 'The King's Speech'?,1377,206
2,14,unrelated,39,0,What is the name of the political party of Dimuthu Bandara Abayakoon?,1377,206
2,15,unrelated,46,-1,Who played the king that was king of england in 1951 in the king's speech?,1377,206
2,16,unrelated,73,2,Is Steven Universe still ongoing with new episodes planned?,1377,206
2,17,unrelated,28,3,Who is the spouse of the actress who played the fairy god mother in Shrek 2?,1377,206
2,18,unrelated,19,1,What team did Kris Benson play for in Major League Baseball?,1377,206
2,19,unrelated,62,1,Where was Saint Joseph (São José) born?,1377,206
2,20,unrelated,15,0,In which county is Pine Springs located?,1377,206
2,21,unrelated,35,0,Who is the author of Prince Prigio?,1377,206
2,22,unrelated,79,1,Which Bollywood movies feature both Preity Zinta and Madhuri Dixit in their cast?,1377,206
2,23,unrelated,37,-1,Who was the sibling of Nannina de' Medici?,1377,206
2,24,unrelated,18,-1,Whose sister played Susie in miracle on 34th street?,1377,206
2,25,unrelated,48,1,Who was Ernst Mach's employer during the period when he was associated with Mach's principle?,1377,206
2,26,unrelated,16,0,Who was the top PC manufacturer in 1994?,1377,206
2,27,unrelated,50,3,When was John's eldest son crowned?,1377,206
2,28,unrelated,3,0,Who is the child of Peter Andreas Heiberg?,1377,206
2,29,unrelated,12,1,Which company did Compaq merge with in 2002?,1377,206
2,30,unrelated,67,3,Rabat Ajax F.C. Maltese Premier League current,1377,206
2,31,unrelated,29,0,What team does Adam Hammill currently play for?,1377,206
2,32,unrelated,15,-1,What is the capital of the county that Pine Springs is located in?,1377,206
2,33,unrelated,42,-1,Who is the spouse of the creator of Absolutely Fabulous?,1377,206
3,0,related,3,-1,Who is the spouse of the child of Peter Andreas Heiberg?,1243,186
3,1,related,3,0,Who is the child of Peter Andreas Heiberg?,1243,186
3,2,related,3,1,Who is the spouse of Johan Ludvig Heiberg?,1243,186
3,3,unrelated,43,-1,What county shares a border with Cedar Springs?,1243,186
3,4,unrelated,5,1,What company did Compaq merge with in 2002?,1243,186
3,5,unrelated,14,-1,Who is the sibling of the actress that played the little girl in Miracle on 34th street 1947?,1243,186
3,6,unrelated,70,-1,What is the record label for the band which performed Pythons?,1243,186
3,7,unrelated,20,0,Who originally sang the song You Belong To Me?,1243,186
3,8,unrelated,54,0,Who played Thelma in the movie 'Thelma and Louise'?,1243,186
3,9,unrelated,5,-1,What company merged in 2002 with the CEMM developer?,1243,186
3,10,unrelated,21,1,When was Henry III crowned?,1243,186
3,11,unrelated,42,3,Who is the spouse of the creator of Absolutely Fabulous?,1243,186
3,12,unrelated,28,3,Who is the spouse of the actress who played the fairy god mother in Shrek 2?,1243,186
3,13,unrelated,57,-1,In which district was Ernie Watts born?,1243,186
3,14,unrelated,29,0,What team does Adam Hammill currently play for?,1243,186
3,15,unrelated,60,-1,Who is the other child of Chian Hsiao-chang's father?,1243,186
3,16,unrelated,44,1,"Which county is Bancroft, Ontario located in?",1243,186
3,17,unrelated,13,-1,What year was the father of Katherine of England crowned?,1243,186
3,18,unrelated,30,2,Who is Joan Erikson?,1243,186
3,19,unrelated,29,3,What is Adam Hammill's most recent team?,1243,186
3,20,unrelated,49,2,Where did Malcolm Graham die?,1243,186
3,21,unrelated,34,1,Who was the child of Stefan Nemanja?,1243,186
3,22,unrelated,37,1,"Based on Nannina de' Medici's parents Piero di Cosimo de' Medici and Lucrezia Tornabuoni, who were her siblings?",1243,186
3,23,unrelated,15,-1,What is the capital of the county that Pine Springs is located in?,1243,186
3,24,unrelated,76,0,Who is a former member of The Sunnyboys?,1243,186
3,25,unrelated,54,-1,"The actor who played Thelma in ""Thelma and Louise"" also played which character in ""A League of Their Own""?",1243,186
3,26,unrelated,22,-1,What group was the performer of Be the One a member of?,1243,186
3,27,unrelated,72,-1,Who is part of the band that performed Full Cooperation?,1243,186
3,28,unrelated,73,-1,When is the next episode of the series that Steven the Sword Fighter is a part of being released?,1243,186
3,29,unrelated,40,-1,When did military instruction start at the place where Larry Alcala was educated?,1243,186
3,30,unrelated,47,-1,Who is the spouse of the person who sang holding out for a hero in shrek 2?,1243,186
3,31,unrelated,14,1,Who is the sibling of actress Natalie Wood?,1243,186
3,32,unrelated,39,1,Who founded the Janatha Vimukthi Peramuna political party?,1243,186
3,33,unrelated,11,-1,Who is the lead singer of the band performing Bang Bang Rock & Roll?,1243,186
3,34,unrelated,9,-1,When did a storm disperse the fleet led by the English king who trusted William de Longchamp?,1243,186
4,0,related,4,-1,"When was the sibling of Alice de Lusignan, Countess of Surrey crowned?",2605,390
4,1,related,4,0,"Who were the siblings of Alice de Lusignan, Countess of Surrey?",2605,390
4,2,related,4,1,When was King Henry III of England crowned?,2605,390
4,3,unrelated,62,1,Where was Saint Joseph (São José) born?,2605,390
4,4,unrelated,9,0,Which English king trusted William de Longchamp?,2605,390
4,5,unrelated,23,1,"When did Richard I, King of England, depart for the Holy Land on the Third Crusade?",2605,390
4,6,unrelated,9,1,What specific naval expedition or fleet did King Richard I lead that was dispersed by a storm?,2605,390
4,7,unrelated,15,-1,What is the capital of the county that Pine Springs is located in?,2605,390
4,8,unrelated,8,0,Who performed the song 'The Place and the Time'?,2605,390
4,9,unrelated,50,3,When was John's eldest son crowned?,2605,390
4,10,unrelated,12,-1,What company did the company that initiated a successful price war among PC manufacturers in 1994 merge with in 2002?,2605,390
4,11,unrelated,59,0,Who starred in the movie No Escape?,2605,390
4,12,unrelated,73,0,What series is Steven the Sword Fighter a character in?,2605,390
4,13,unrelated,24,0,Who sang the song 'You Belong to Me'?,2605,390
4,14,unrelated,32,0,What was the regnal name adopted by King George VI?,2605,390
4,15,unrelated,41,-1,Who has played for West Ham Ajax and the team that David Currie plays for?,2605,390
4,16,unrelated,52,0,Who played Thelma in Thelma and Louise?,2605,390
4,17,unrelated,0,0,What network is National Cycle Route 57 part of?,2605,390
4,18,unrelated,33,0,Where is KPRM licensed to broadcast?,2605,390
4,19,unrelated,51,1,What character did Geena Davis play in the movie A League of Their Own?,2605,390
4,20,unrelated,38,0,Where is NRHEG High School located?,2605,390
4,21,unrelated,67,-1,What league does the team that occupies the Rabat Ajax Football Ground belong to?,2605,390
4,22,unrelated,24,-1,What record label does the artist who sang you belong to me belong to?,2605,390
4,23,unrelated,34,0,Who succeeded Tihomir of Serbia?,2605,390
4,24,unrelated,39,0,What is the name of the political party of Dimuthu Bandara Abayakoon?,2605,390
4,25,unrelated,14,0,Who played the little girl in the 1947 film Miracle on 34th Street?,2605,390
4,26,unrelated,49,-1,Who has played for West Ham Ajax and the team from the city where Malcolm Graham died?,2605,390
4,27,unrelated,50,0,Who is John's eldest son?,2605,390
4,28,unrelated,73,-1,When is the next episode of the series that Steven the Sword Fighter is a part of being released?,2605,390
4,29,unrelated,25,-1,What place does the administrative territorial entity that Juba is located in share a border with?,2605,390
4,30,unrelated,61,2,Sir Charles Tupper birthplace,2605,390
4,31,unrelated,44,2,Which counties border Hastings County in Ontario?,2605,390
4,32,unrelated,71,-1,Who is the voice of the character in Spongebob Squarepants with the same name as the creature that annelid larvae live like?,2605,390
4,33,unrelated,35,-1,What year did the author of Prince Prigio die?,2605,390
4,34,unrelated,19,1,What team did Kris Benson play for in Major League Baseball?,2605,390
5,0,related,5,-1,What company merged in 2002 with the CEMM developer?,2727,409
5,1,related,5,0,What does CEMM stand for?,2727,409
5,2,related,5,1,What company did Compaq merge with in 2002?,2727,409
5,3,unrelated,20,0,Who originally sang the song You Belong To Me?,2727,409
5,4,unrelated,58,0,Where was James Finch born?,2727,409
5,5,unrelated,40,-1,When did military instruction start at the place where Larry Alcala was educated?,2727,409
5,6,unrelated,32,-1,Who played king whose regal Name did Albert Adopt in the king's speech?,2727,409
5,7,unrelated,35,-1,What year did the author of Prince Prigio die?,2727,409
5,8,unrelated,54,0,Who played Thelma in the movie 'Thelma and Louise'?,2727,409
5,9,unrelated,36,0,Where was Mark Dismore born?,2727,409
5,10,unrelated,76,0,Who is a former member of The Sunnyboys?,2727,409
5,11,unrelated,28,1,Who is Jennifer Saunders' spouse?,2727,409
5,12,unrelated,56,-1,The territory containing Bansaan Island is located at which island?,2727,409
5,13,unrelated,18,-1,Whose sister played Susie in miracle on 34th street?,2727,409
5,14,unrelated,11,-1,Who is the lead singer of the band performing Bang Bang Rock & Roll?,2727,409
5,15,unrelated,62,0,Who is São José dos Campos named after?,2727,409
5,16,unrelated,79,1,Which Bollywood movies feature both Preity Zinta and Madhuri Dixit in their cast?,2727,409
5,17,unrelated,61,3,Sir Charles Tupper biography,2727,409
5,18,unrelated,42,-1,Who is the spouse of the creator of Absolutely Fabulous?,2727,409
5,19,unrelated,30,3,Was Joan Erikson the spouse of Erik Erikson?,2727,409
5,20,unrelated,4,0,"Who were the siblings of Alice de Lusignan, Countess of Surrey?",2727,409
5,21,unrelated,48,0,Who is Mach's principle named after?,2727,409
5,22,unrelated,16,-1,"In 2002, what company merged with the top PC manufacturer from 1994?",2727,409
5,23,unrelated,74,-1,What film features Anil Devgan's sibling?,2727,409
5,24,unrelated,61,2,Sir Charles Tupper birthplace,2727,409
5,25,unrelated,43,0,Where is Cedar Springs located?,2727,409
5,26,unrelated,47,3,Jennifer Saunders married to,2727,409
5,27,unrelated,67,2,Rabat Ajax F.C. current league,2727,409
5,28,unrelated,64,0,Who is the publisher of In the Shadow of Greatness?,2727,409
5,29,unrelated,75,-1,"What political party was the candidate who garnered a million votes during the 1920 election despite being in prison, a member of?",2727,409
5,30,unrelated,15,1,"What is the county seat of Culberson County, Texas?",2727,409
5,31,unrelated,40,1,When did military instruction begin at the University of the Philippines?,2727,409
5,32,unrelated,67,0,Which team uses the Rabat Ajax Football Ground?,2727,409
5,33,unrelated,57,0,Where was Ernie Watts born?,2727,409
5,34,unrelated,1,0,Where is the headquarters of Julia's House located?,2727,409
6,0,related,6,-1,Which university employed the person that Mach bands are named after?,1404,210
6,1,related,6,0,Which university employed Ernst Mach?,1404,210
6,2,unrelated,77,-1,Who was the US physicist who directed the project that developed the first atomic bomb at the same place where Feynman worked on Water Boiler?,1404,210
6,3,unrelated,10,1,Which organization did George Packer volunteer for?,1404,210
6,4,unrelated,40,0,Where did Larry Alcala study?,1404,210
6,5,unrelated,17,1,Which actor played King George VI in the film 'The King's Speech'?,1404,210
6,6,unrelated,24,-1,What record label does the artist who sang you belong to me belong to?,1404,210
6,7,unrelated,46,1,Which actor played King George VI in the film 'The King's Speech'?,1404,210
6,8,unrelated,9,0,Which English king trusted William de Longchamp?,1404,210
6,9,unrelated,47,3,Jennifer Saunders married to,1404,210
6,10,unrelated,55,0,"Movies starring Preity Zinta, Madhuri Dixit, and Ajay Devgn",1404,210
6,11,unrelated,48,3,Where was Ernst Mach employed as a professor?,1404,210
6,12,unrelated,48,1,Who was Ernst Mach's employer during the period when he was associated with Mach's principle?,1404,210
6,13,unrelated,20,1,What record label was Joni James signed to when she released 'You Belong To Me' in 1952?,1404,210
6,14,unrelated,56,-1,The territory containing Bansaan Island is located at which island?,1404,210
6,15,unrelated,10,-1,The Unwinding author volunteered for which organisation?,1404,210
6,16,unrelated,25,1,What places share a border with Central Equatoria?,1404,210
6,17,unrelated,41,0,Which team does David Currie play for?,1404,210
6,18,unrelated,43,0,Where is Cedar Springs located?,1404,210
6,19,unrelated,7,0,Who is the physicist that the Mach number is named after?,1404,210
6,20,unrelated,60,0,Who is the father of Chian Hsiao-chang?,1404,210
6,21,unrelated,4,1,When was King Henry III of England crowned?,1404,210
6,22,unrelated,26,0,Who played King George VI in The King's Speech?,1404,210
6,23,unrelated,61,3,Sir Charles Tupper biography,1404,210
6,24,unrelated,49,1,Where did Malcolm Graham die?,1404,210
6,25,unrelated,3,0,Who is the child of Peter Andreas Heiberg?,1404,210
6,26,unrelated,35,0,Who is the author of Prince Prigio?,1404,210
6,27,unrelated,28,1,Who is Jennifer Saunders' spouse?,1404,210
6,28,unrelated,2,-1,What body of water includes the terrain feature where Coffee Swamp is located?,1404,210
6,29,unrelated,11,-1,Who is the lead singer of the band performing Bang Bang Rock & Roll?,1404,210
6,30,unrelated,18,-1,Whose sister played Susie in miracle on 34th street?,1404,210
6,31,unrelated,49,3,Where did Malcolm Graham die?,1404,210
6,32,unrelated,28,3,Who is the spouse of the actress who played the fairy god mother in Shrek 2?,1404,210
6,33,unrelated,5,-1,What company merged in 2002 with the CEMM developer?,1404,210
7,0,related,7,-1,Who is the employer of the physicist who Mach number is named after?,2140,321
7,1,related,7,0,Who is the physicist that the Mach number is named after?,2140,321
7,2,related,7,1,Who was Ernst Mach's employer or academic institution during his career?,2140,321
7,3,unrelated,67,2,Rabat Ajax F.C. current league,2140,321
7,4,unrelated,56,0,Where is Bansaan Island located?,2140,321
7,5,unrelated,21,-1,When did the crowning of the person under whom the Chapter House was built happen?,2140,321
7,6,unrelated,61,3,Sir Charles Tupper biography,2140,321
7,7,unrelated,20,-1,What is the record label for the singer who originally sang You Belong To Me.,2140,321
7,8,unrelated,30,-1,Who is the spouse of Young Man Luther's author?,2140,321
7,9,unrelated,58,1,"Which county is Lynn Haven, Florida located in?",2140,321
7,10,unrelated,42,0,Who created Absolutely Fabulous?,2140,321
7,11,unrelated,30,0,Who is the author of 'Young Man Luther'?,2140,321
7,12,unrelated,71,-1,Who is the voice of the character in Spongebob Squarepants with the same name as the creature that annelid larvae live like?,2140,321
7,13,unrelated,9,1,What specific naval expedition or fleet did King Richard I lead that was dispersed by a storm?,2140,321
7,14,unrelated,11,0,Which band performed the song 'Bang Bang Rock & Roll'?,2140,321
7,15,unrelated,41,-1,Who has played for West Ham Ajax and the team that David Currie plays for?,2140,321
7,16,unrelated,27,-1,Who is the spouse of a cast member from King of the Mountain?,2140,321
7,17,unrelated,5,0,What does CEMM stand for?,2140,321
7,18,unrelated,22,2,Was Jackie Jackson a member of a musical group?,2140,321
7,19,unrelated,79,1,Which Bollywood movies feature both Preity Zinta and Madhuri Dixit in their cast?,2140,321
7,20,unrelated,54,1,Which character did Geena Davis play in the movie 'A League of Their Own'?,2140,321
7,21,unrelated,43,0,Where is Cedar Springs located?,2140,321
7,22,unrelated,62,1,Where was Saint Joseph (São José) born?,2140,321
7,23,unrelated,44,2,Which counties border Hastings County in Ontario?,2140,321
7,24,unrelated,52,-1,"In A League of Their Own, who played the husband of the actress who played Thelma in Thelma and Louise?",2140,321
7,25,unrelated,77,0,Where did Richard Feynman work on the Water Boiler reactor?,2140,321
7,26,unrelated,65,0,Who played Thelma in the movie Thelma and Louise?,2140,321
7,27,unrelated,23,-1,What month did the person who retained trust in Longchamp go away to the Holy Land?,2140,321
7,28,unrelated,72,0,Who performed the song Full Cooperation?,2140,321
7,29,unrelated,60,-1,Who is the other child of Chian Hsiao-chang's father?,2140,321
7,30,unrelated,13,1,What year was King Henry III of England crowned?,2140,321
7,31,unrelated,79,0,Who are the cast members of the movie U Me Aur Hum?,2140,321
7,32,unrelated,76,1,Where was Jeremy Oxley born?,2140,321
7,33,unrelated,58,-1,In which county was James Finch born?,2140,321
7,34,unrelated,69,0,Who played the female lead in Spider-Man: Homecoming?,2140,321
8,0,related,8,-1,What record label did the performer of The Place and the Time belong to?,2419,362
8,1,related,8,0,Who performed the song 'The Place and the Time'?,2419,362
8,2,related,8,1,What record label is Moby Grape associated with?,2419,362
8,3,unrelated,5,0,What does CEMM stand for?,2419,362
8,4,unrelated,34,2,Children of Stefan Nemanja,2419,362
8,5,unrelated,4,0,"Who were the siblings of Alice de Lusignan, Countess of Surrey?",2419,362
8,6,unrelated,16,1,What company did Compaq merge with in 2002?,2419,362
8,7,unrelated,17,1,Which actor played King George VI in the film 'The King's Speech'?,2419,362
8,8,unrelated,74,-1,What film features Anil Devgan's sibling?,2419,362
8,9,unrelated,79,1,Which Bollywood movies feature both Preity Zinta and Madhuri Dixit in their cast?,2419,362
8,10,unrelated,51,1,What character did Geena Davis play in the movie A League of Their Own?,2419,362
8,11,unrelated,63,0,Where was Snappy Tomato Pizza founded?,2419,362
8,12,unrelated,10,0,Who is the author of The Unwinding?,2419,362
8,13,unrelated,14,1,Who is the sibling of actress Natalie Wood?,2419,362
8,14,unrelated,35,0,Who is the author of Prince Prigio?,2419,362
8,15,unrelated,64,1,Where are the headquarters of the United States Naval Institute located?,2419,362
8,16,unrelated,41,0,Which team does David Currie play for?,2419,362
8,17,unrelated,5,-1,What company merged in 2002 with the CEMM developer?,2419,362
8,18,unrelated,69,1,Which record label is Zendaya signed to?,2419,362
8,19,unrelated,34,0,Who succeeded Tihomir of Serbia?,2419,362
8,20,unrelated,69,-1,The actor who plays the girl in Spiderman Homecoming is signed to which record label?,2419,362
8,21,unrelated,62,3,Who was the person São José dos Campos was named after?,2419,362
8,22,unrelated,69,0,Who played the female lead in Spider-Man: Homecoming?,2419,362
8,23,unrelated,68,1,"Which county does Eldon, Missouri belong to?",2419,362
