Question,Real Answer,Pred Answer
Where was the wife of Francis I Rákóczi born?,Ozalj,1495–1531) was an English courtier. She was born at Herstmonceux Castle in Sussex in 1495.
Who is Sobe (Sister Of Saint Anne)'s grandchild?,John the Baptist,Elizabeth
Where does the director of film Man At Bath work at?,Cahiers du cinéma,"Christophe Honoré is the director of the film *Man at Bath*. Based on the provided information, he works as a French writer and film and theatre director."
Do both Beauty And The Bad Man and Wild Child (Film) films have the directors from the same country?,no,yes
"What is the date of birth of William Paulet, 3Rd Marquess Of Winchester's father?",1510,c. 1532
"Who is Edward Watson, Viscount Sondes's paternal grandfather?",Edward Watson,"Lewis Watson, 1st Earl of Rockingham"
"What is the date of death of Humphrey De Bohun, 7Th Earl Of Hereford's father?",16 September 1360,1275
Who is Helmichis's father-in-law?,Cunimund,Answer: Helmichis's father-in-law is James Armour.
Where did Helena Carroll's father study?,St Patrick's College,"St Patrick's College, Dublin"
Where does the director of film Wine Of Morning work at?,Bob Jones University,Bob Jones University
"Which film has the director who was born earlier, The Secret Invasion or The House Of The Seven Hawks?",The House Of The Seven Hawks,The Secret Invasion
"Who is the paternal grandmother of Marie Of Brabant, Queen Of France?",Marie of Hohenstaufen,"Henry VII, Holy Roman Emperor"
"Who is Renaud Ii, Count Of Soissons's uncle?","Guy II, Count of Soissons","John I, Count of Soissons"
When did William Le Poer Trench's father die?,26 April 1872,1839
Which country the director of film Renegade Force is from?,America,"Martin Kunert, the director of the film *Renegade Force*, is from Poland."
Who is the spouse of the director of film Emergency Wedding?,Ona Munson,Barbara Hale
"Which film came out earlier, Indradhanura Chhai or The Death Of Black King?",The Death Of Black King,The Death Of Black King
Do both films The Reincarnation Of Golden Lotus and I'Ll Get By (Film) have the directors from the same country?,no,no
"Are both villages, Rhosgoch and Qaleh-Ye Sahar, located in the same country?",no,yes
Where was the director of film Kanneshwara Rama born?,Mysore,"Mysore, India"
Where was the place of death of Randi Monsen's father?,Kristiania,"The place of death of Randi Monsen's father, Fredrik Monsen, is not explicitly mentioned in the provided passages."
Where did the performer of song I'Ll Say It graduate from?,Lee Strasberg Theatre and Film Institute,Kathy Griffin graduated from the Lee Strasberg Theatre and Film Institute in Los Angeles.
"Which film has the director who was born first, Hell Up In Harlem or The Soviet Story?",Hell Up In Harlem,Hell Up In Harlem
"Who was born first, Cipriano Castro or Damir Nikšić?",Cipriano Castro,Cipriano Castro
"Which film has the director who died first, The Year Of The Rabbit or Monster On The Campus?",Monster On The Campus,The Year of the Rabbit
"Who is younger, Guy Arvely Dolsin or Altuğ Çelikbilek?",Altuğ Çelikbilek,Altuğ Çelikbilek
"Which song came out first, Joel The Lump Of Coal or Jugband Blues?",Jugband Blues,Jugband Blues
Are both Open Mobile and Primestar located in the same country?,yes,yes
Who is the paternal grandfather of Baldwin I Rátót?,Leustach Rátót,Rathold Rátót
What is the place of birth of Ratna Malla's father?,Nepal,Belfast
"Who is Archibald Acheson, 4Th Earl Of Gosford's paternal grandfather?","Archibald Acheson, 2nd Earl of Gosford","Archibald Acheson, 4th Earl of Gosford's paternal grandfather is Arthur Acheson, 1st Earl of Gosford."
Who is the paternal grandfather of Mark Getty?,Jean Paul Getty,John Paul Getty Jr.
Where did the performer of song Fantasy (George Michael Song) die?,"Goring-on-Thames, Oxfordshire",Goring-on-Thames
Do director of film Betrayal (1932 Film) and director of film The Godsend (Film) share the same nationality?,yes,yes
"Which film whose director was born first, The Abduction Club or Wooden Crosses?",Wooden Crosses,Wooden Crosses
"Which film came out earlier, Above Rubies or The Magic Aster?",Above Rubies,The Magic Aster
"Which film has the director who is older than the other, Blue Blood And Red or The Longshot? ",Blue Blood And Red,Blue Blood and Red
What is the place of birth of the director of film Clowning Around?,"Castlemaine, Victoria, Australia","Castlemaine, Victoria, Australia"
"Who was born later, Paul De Scherff or Lyudmyla Olyanovska?",Lyudmyla Olyanovska,Lyudmyla Olyanovska
Where was the place of death of Kamures Kadın's husband?,Constantinople,"Eyüp Cemetery, Istanbul"
What is the place of birth of Bernard (Son Of Charles The Fat)'s father?,East Francia,Answer: The place of birth of Bernard (son of Charles the Fat)'s father is not explicitly mentioned in the provided passages.
"Which film has the director who died first, Tex And The Lord Of The Deep or Henry Goes Arizona?",Henry Goes Arizona,Tex and the Lord of the Deep
Which country the performer of song I Believe In Your Sweet Love is from?,United Kingdom,Welsh
"Which film whose producer was born first, All-American Co-Ed or Lagu Kenangan?",All-American Co-Ed,Lagu Kenangan
What is the place of birth of the director of film A Chrysanthemum Bursts In Cincoesquinas?,Buenos Aires,"Marshall, Indiana"
Who is the mother-in-law of Louise Of Mecklenburg-Güstrow?,Charlotte Amalie of Hesse-Kassel,Magdalena Sibylle of Holstein-Gottorp
Where was the place of death of Agnes Of Hohenstaufen's husband?,Brunswick,11 July 1302 at the Battle of the Golden Spurs
Who is Marcus Annius Libo's aunt?,Vibia Sabina,Annia Cornificia Faustina
"Which film was released more recently, Bajo Otro Sol or Riding The California Trail?",Bajo Otro Sol,Bajo Otro Sol
Who is the mother of the director of film Dalida (2017 Film)?,Marie Laforêt,Susan B. Nelson
Who is the spouse of the director of film Streets Of Blood?,Sandra Nelson,Sharon Stone
When is Henrietta Maria Of Brandenburg-Schwedt's father's birthday?,"May 19, 1669",1669
"Where was the place of death of Sancha Of Castile, Queen Of Navarre's mother?",Palencia,"Sancha of Castile, Queen of Navarre's mother was Berengaria of Barcelona. Berengaria died in Palencia."
"Which film was released more recently, Dance With A Stranger or Miley Naa Miley Hum?",Miley Naa Miley Hum,Dance with a Stranger
"Which film has the director who is older, Space Probe Taurus or Tom Mix In Arabia?",Tom Mix In Arabia,Tom Mix in Arabia
"Which film has the director died later, Seven In The Sun or Daughter Of The Jungle?",Seven In The Sun,Seven in the Sun
"Which film was released first, Vacations In Majorca or Dr. Socrates?",Dr. Socrates,Dr. Socrates
"Which film has the director born later, Woman In The Moon or Changeland?",Changeland,Changeland
"Who is younger, Peter Rosegger or Ruel Redinger?",Ruel Redinger,Peter Rosegger
Who is Pyotr Karatygin's sibling-in-law?,Alexandra Kolosova,Vasily Karatygin
Who is the spouse of the performer of song This Time (Waylon Jennings Song)?,Jessi Colter,Jessi Colter
Are Twin Cairns Island and Nova Zembla Island located in the same country?,yes,yes
"Who died first, Erich Haenisch or William Pooley?",William Pooley,William Pooley
What nationality is the performer of song You Can?,Sweden,Answer: American
Do Nick Varner and Carl Duser share the same nationality?,yes,yes
"Which film has the director who died earlier, Melody Of The World or Ladies Love Danger?",Melody Of The World,Ladies Love Danger
Where was the place of death of the composer of film Miracle Of Marcelino?,Madrid,Madrid
Who is the mother of the director of film Atomised (Film)?,Gisela Elsner,Kekuʻiapoiwa II
"Which film has the director who died later, The Great Man'S Lady or La Belle Américaine?",La Belle Américaine,The Great Man's Lady
What is the place of birth of the director of film Sweepstakes (Film)?,"Oklahoma City, Oklahoma","Eddie Quillan, the director of the film *Sweepstakes*, was born in the United States."
Where was the place of death of Shahnawaz Bhutto's mother?,Dubai,Dubai
Where was the performer of song Égérie (Song) born?,La Trinité,"La Trinité, a commune within the Nice metropolitan area, France."
Who is the father-in-law of Duke William Of Mecklenburg-Schwerin?,Prince Albert of Prussia,Ludwig von Westphalen
Are Gut (Crișul Alb) and Gepiș both located in the same country?,yes,yes
Where was the place of death of Anne Devereux's husband?,Banbury,Answer: Beaulieu-sur-Loire
"Who is Sir William Gore, 3Rd Baronet's paternal grandfather?","Sir Paul Gore, 1st Baronet","Sir Paul Gore, 1st Baronet"
Which country Nizar Al-Mustafa's father is from?,Fatimid caliphate,Egypt
Where was the wife of Lou Breslow born?,"Dayton, Ohio","Dayton, Ohio"
Who is the spouse of the director of film Ann Carver'S Profession?,Ona Munson,Edward Buzzell
"Which film came out earlier, The Drover'S Sweetheart or Pigsty (Film)?",The Drover'S Sweetheart,The Drover's Sweetheart
What is the place of birth of the director of film Bhagirathi (Film)?,Tumkur,"Marshall, Indiana"
"Which film came out earlier, Closely Watched Trains or Det Sande Ansigt?",Det Sande Ansigt,Det Sande Ansigt
"Which film has the director who died earlier, Il Gaucho or Bomgay?",Bomgay,Bomgay
Where was the place of death of Maria (Wife Of Boris I Of Bulgaria)'s husband?,Preslav,907
"Which film came out first, The Pyrammmid or Revolt Of The Praetorians?",Revolt Of The Praetorians,Revolt of the Praetorians
Are both directors of films La Morte Vivante and Stranger On Horseback from the same country?,yes,yes
What is the cause of death of Constantia Eriksdotter's father?,poisoning,arsenic poisoning
What nationality is the director of film Postmortem (1998 Film)?,America,American
Which country Keōpūolani's husband is from?,Kingdom of Hawaii,Kamakau
"Which film came out earlier, X-Paroni or Mi Novia Está De Madre?",X-Paroni,X-Paroni
"Which film was released earlier, August Underground'S Penance or Vasantha Raagam?",Vasantha Raagam,Vasantha Raagam
Who is the father-in-law of Hong Ra-Hee?,Lee Byung-chul,Answer: Lee Kun-hee
Who is Isabella Of Bourbon's paternal grandfather?,"John I, Duke of Bourbon","Louis I, Duke of Bourbon"
What is the date of death of Duleep Singh's father?,27 June 1839,27 June 1839
What is the place of birth of the director of film Gunsmoke (Film)?,Gura Humorului,"Marshall, Indiana"
"Who is the spouse of the performer of song Et Moi, Et Moi, Et Moi?",Françoise Hardy,Jacques Lanzmann
"Who lived longer, Charles Wheatstone or Jean-Claude Lauzon?",Charles Wheatstone,Charles Wheatstone
Where was the place of death of Thomas E. Noell's father?,Washington,"St. Mary's Cemetery, Perryville, Missouri"
"Which film has the director died first, Our Agent Tiger or London Melody?",London Melody,Our Agent Tiger
Who is the paternal grandfather of Diego Fernández De Oviedo?,Flaín Muñoz,Fernando Flaínez
Who is the child of the director of film The Trouble With Cali?,Mira Sorvino,Mira Sorvino
Are Ding Yaping and Johann Christian Gustav Lucae of the same nationality?,yes,no
"Which country Dorothea Of Denmark, Duchess Of Mecklenburg's father is from?",Norway,Denmark
What is the cause of death of Heonjong Of Goryeo's father?,illness,"Answer: The cause of death of Heonjong of Goryeo's father, Seonjong of Goryeo, is not explicitly mentioned in the provided passages."
Where did Mary Of Woodstock's mother die?,Harby,"Harby, Nottinghamshire"
Which award the director of film Tiramisu (2002 Film) earned?,Hong Kong Film Award for Best Director,Hong Kong Film Award for Best Director
What is the date of death of the director of film Nallavan Vazhvan?,3 September 1992,3 September 1992
"Who died first, Frederick Cleveland Morgan or Nathaniel Mclenaghan?",Nathaniel Mclenaghan,Frederick Cleveland Morgan
Where did the director of film Balls Out (2014 Film) graduate from?,Tisch,Tisch School of the Arts
"Which film whose director is younger, Cuchillos De Fuego or A Woman Has Killed?",Cuchillos De Fuego,Cuchillos De Fuego
"Which film was released earlier, Moment Of Danger or The Ballad Of Josie?",Moment Of Danger,Moment Of Danger
"Which magazine was established first, Rock Street Journal or De As?",De As,Rock Street Journal
"Which film has the director who died first, The Piper'S Price or The Blonde From Singapore?",The Piper'S Price,The Piper's Price
Are H. H. Hunnewell and Bob Flanigan (Singer) of the same nationality?,yes,yes
"When was Antoine Philippe, Duke Of Montpensier's mother born?",13 March 1753,15 October 1605
"Which film has the director who died later, True To The Navy or No Trees In The Street?",No Trees In The Street,True to the Navy
What is the place of birth of the director of film Ninamaninja Kalpadukal?,Methala,"Marshall, Indiana"
"Which film came out earlier, Alkohol or Night Of Dark Shadows?",Alkohol,Alkohol
"Which film whose director is younger, Many Tanks Mr. Atkins or Do Musafir?",Do Musafir,Do Musafir
Are Revolt In The Big House and The Fugitive (1914 Film) from the same country?,no,no
Where was the composer of film Consenting Adults (1992 Film) born?,New York,United States
"Which film has the director who died earlier, Tiger In The Smoke or Contragolpe?",Contragolpe,Tiger in the Smoke
Where was the place of death of the director of film Jail Yatra?,Mumbai,Mumbai
"Which film came out first, F The Prom or The Comedians Of Comedy?",The Comedians Of Comedy,The Comedians of Comedy
"Which film has the director who was born first, Tombstone Rashomon or Waiting For The Clouds?",Tombstone Rashomon,Tombstone Rashomon
"Which film has the director who was born earlier, Dhuen Ki Lakeer or Bomma Borusa?",Dhuen Ki Lakeer,Dhuen Ki Lakeer
"Which film has the director who was born first, Perdón, Viejita or Smokey And The Bandit?","Perdón, Viejita","Perdón, Viejita"
Where did the director of film American Gothic (2007 Film) graduate from?,University of Wisconsin,University of Wisconsin-Madison
Was Dudley Russell or Juan René Serrano born first?,Dudley Russell,Dudley Russell
"Who was born first, Vytautas Straižys or Mirjam Polkunen?",Mirjam Polkunen,Vytautas Straižys
Where did Grand Duchess Elena Vladimirovna Of Russia's father die?,Saint Petersburg,St. Petersburg
Where was the director of film The Dinner (2013 Film) born?,Eindhoven,Dutch
"Which magazine was established first, Women'S Suffrage Journal or Mostar (Magazine)?",Women'S Suffrage Journal,Women's Suffrage Journal
What is the place of birth of Carrie Watson Fleming's husband?,"Fairmont, West Virginia","Fairmont, West Virginia"
"Which film has the director who died earlier, Mayor Muthanna or The Market Of Souls?",The Market Of Souls,The Market of Souls
"Do both films, The Glass Castle (1950 Film) and The Ferret (Film), have the directors who are from the same country?",yes,yes
Where was the father of Muhammad Al-Nasir born?,Morocco,Abu Yusuf Yaqub al-Mansur
Where was the place of death of Enheduanna's father?,Akkadian empire,Akkad
"Which film whose director was born first, Solemn Promise or Tarzan The Magnificent?",Tarzan The Magnificent,Solemn Promise
"Which film has the director who was born later, The Man Is Armed or Wolf Warrior?",Wolf Warrior,Wolf Warrior
Who is the paternal grandfather of Trịnh Doanh?,Trịnh Bính,Abd al-Muttalib
Where was the director of film Hellcats Of The Navy born?,Gura Humorului,"Marshall, Indiana"
Where was the performer of song Feelin' Myself (Nipsey Hussle Song) born?,Crenshaw,"August 15, 1985"
"Which film whose director is younger, Winter Sleepers or Poveri Milionari?",Winter Sleepers,Winter Sleepers
Who is the paternal grandfather of Bruno Ii Von Berg?,Adolf II of Berg,Count Adolf III of Berg
Are The Other Half (2016 Film) and Spy Kids 2: The Island Of Lost Dreams from the same country?,no,yes
Where was the director of film 00 Schneider – Jagd Auf Nihil Baxter born?,Mülheim an der Ruhr,Mülheim an der Ruhr
"Which film came out first, Una Prostituta Al Servizio Del Pubblico E In Regola Con Le Leggi Dello Stato or The Bag Man?",Una Prostituta Al Servizio Del Pubblico E In Regola Con Le Leggi Dello Stato,Una prostituta al servizio del pubblico e in regola con le leggi dello stato
"Are the movies The Hatton Garden Job and Carry On Cleo, from the same country?",yes,yes
Who is the paternal grandfather of Dibyasambandh?,Mongkut,Bhanurangsi Savangwongse
"Who is Charles Willoughby, 10Th Baron Willoughby Of Parham's paternal grandmother?",Lady Frances Manners,Lady Margaret Clinton
"Where does the director of film L'Arbre, Le Maire Et La Médiathèque work at?",Cahiers du cinéma,Éric Rohmer
Where was the director of film Eisenstein In Guanajuato born?,"Newport, Wales","Peter Greenaway was born in Newport, Monmouthshire, Wales."
What is the place of birth of Sextus Barbour's father?,"Gordonsville, Virginia","Orange County, Virginia"
What is the place of birth of the performer of song Ruleta (Inna Song)?,Mangalia,West Berlin
Who is the father of the director of film A No-Hit No-Run Summer?,Félix Leclerc,Francis Leclerc
"Who is Henri Ii, Duke Of Nemours's paternal grandfather?",Jacques,"Henri II, Duke of Nemours's paternal grandfather is Philip II, Duke of Savoy."
Who is Gisela Of Hungary's father-in-law?,Géza,Stephen I of Hungary
Who is the paternal grandmother of King Kang Of Zhou?,Yi Jiang,Hubbah
"What is the date of death of Maria Isabel De Alcântara, Countess Of Iguaçu's mother?","November 3, 1867",3 November 1867
Who is the spouse of the director of film Rodney Steps In?,Ivy Duke,Elizabeth Allan
"When did Frances Vane, Marchioness Of Londonderry's father die?",1 August 1813,1813
"Which film has the director who is older than the other, Season Of Strangers or The Yellow Teddy Bears? ",Season Of Strangers,The Yellow Teddy Bears
Were Jake Eisenhart and Michael T. Ullman of the same nationality?,yes,no
"Who was born first, Antoine Casavant or Abdul Ali Lalu?",Antoine Casavant,Abdul Ali Lalu
Where did Rameshwari Nehru's husband graduate from?,Oxford,Allahabad University
"Who is the paternal grandfather of Sir John Hamilton-Dalrymple, 5Th Baronet?","Sir Hew Dalrymple, 2nd Baronet","Sir Hew Dalrymple, 3rd Baronet"
"Which film has the director who was born earlier, Khud-Daar or Murderer In The Fog?",Murderer In The Fog,Khud-Daar
Who is the spouse of the director of film Soldier (1998 American Film)?,Milla,Milla Jovovich
"Where did Catherine Of Taranto, Countess Of Copertino's mother die?",Lecce,1311
Which award the director of film Lady Magdalene'S got?,Prometheus Award,"Best Cutting Edge Film at the 2008 San Diego Film Festival, Audience Choice -- Feature-Length Narrative Film at the 2008 Cinema City International Film Festival, and Special Jury Prize for Libertarian Ideals at"
What nationality is Princess Charlotte Of Saxe-Meiningen's husband?,Duchy of Saxe-Gotha-Altenburg,German
"Which film has the director who was born first, The Longshots or Station For Two?",Station For Two,The Longshots
What is the place of birth of Aleksey Greig's father?,Inverkeithing,"Inverkeithing, Fife, Scotland"
When did Thomas Of Galloway (Bastard)'s father die?,1234,1234
"When did Robert Bertie, 3Rd Earl Of Lindsey's father die?",25 July 1666,1666
"Which film has the director born later, The Wind'S Fierce or Special Delivery (1927 Film)?",The Wind'S Fierce,The Wind's Fierce
Why did the director of film Port Of Seven Seas die?,drowning,"The director of the film Port of Seven Seas, James Whale, died by suicide. He drowned himself in his Pacific Palisades swimming pool on 29 May 1957 at the age of 67"
What is the place of birth of Abdulaziz Nasser Al Shamsi's wife?,Abu Dhabi,Ajman
What is the place of birth of Frank Wartenberg's wife?,Prenzlau,Prenzlau
Where was the director of film Edges Of The Lord born?,Poznań,"Poznań, Poland"
Where was the father of Teobaldo Ii Ordelaffi born?,Italy,Giorgio Ordelaffi
Where was the husband of Maude Smith born?,"Toronto, Ontario","Dallas, Texas"
"Which film was released earlier, Forbidden Daughters or The Third Kiss?",Forbidden Daughters,The Third Kiss
Does Leslie Pietrzyk have the same nationality as Marianne Wiggins?,yes,yes
"Who was born first, Bogdan Țăruș or Robert Wulnikowski?",Bogdan Țăruș,Robert Wulnikowski
"Which film has the director who died first, Folgore Division or Sandflow?",Sandflow,Folgore Division
"Which film has the director born later, From Corleone To Brooklyn or Durango Valley Raiders?",From Corleone To Brooklyn,From Corleone to Brooklyn
Are both Howard Lake (British Columbia) and North Buck Lake (Alberta) located in the same country?,yes,yes
Where was the place of death of the composer of song Gretchen Am Spinnrade?,Vienna,Vienna
"Who was born later, Hugh Evelyn Wortham or Johnny Ekström?",Johnny Ekström,Johnny Ekström
"Are both mountains, Yana Urqu (Q'Umirqucha) and Puka Rumi, located in the same country?",yes,yes
What nationality is Elizabeth Of Rhuddlan's father?,England,English
"What is the cause of death of director of film I Will, I Will... For Now?",Parkinson,complications of Parkinson's disease
"Who is Maurice De Berkeley, 4Th Baron Berkeley's maternal grandfather?","Roger Mortimer, 1st Earl of March","Richard de Beauchamp, 13th Earl of Warwick"
"Who died first, Albertus Seba or Ali Dinar?",Albertus Seba,Ali Dinar
"Who is the maternal grandfather of Marie Louise, Duchess Of Parma?",Ferdinand I of the Two Sicilies,"Francis II, Holy Roman Emperor"
"Which film was released earlier, Prince Of Arcadia or Italia-Germania 4-3?",Prince Of Arcadia,Prince of Arcadia
Where was the director of film Love At First Sight (1985 Film) born?,Milan,"Marshall, Indiana"
Where did the director of film Nanon (1938 Film) die?,Köln,Los Angeles
